,title,link,company,posted,location,job_func,emp_type,job_desc
0,"Python Developer (WFH, Day Shift)",https://ph.jobstreet.com/job/82820300?type=standard&ref=search-standalone&origin=cardTitle#sol=59b4aef68b09c387ce0d10e20ebec1b156dc140c,Platserv PH,15d ago,Metro Manila,Developers/Programmers (Information &amp; Communication Technology),Full time,"<p>Platinum Outsourcing is an award winning, Australian owned and managed co sourcing BPO – operating out of both the Philippines and Indonesia. We are a fast growing scale-up, opening our first offices in the Philippines only 3 years ago (and growing to 155+ employees in that time).</p><p>We have plans to expand to 200+ employees within the next 3 to 6 months.</p><p>Our client is an Australian based, SaaS company, with team members in Australia, Vietnam, Philippines and India.</p><p><i><strong>We are seeking an mid level Python Developer , with experience within NoSQL databases.</strong></i></p><p><strong>About you:</strong></p><ul><li>3+ years of experience as a Python Developer with a strong portfolio of projects.</li><li>Bachelor's degree in Computer Science, Software Engineering or a related field</li><li>Experience with advanced Python programming&nbsp;concepts&nbsp;is essential.</li><li>Experience writing idiomatic Python code</li><li>In-depth understanding of the Python software development stacks, ecosystems, frameworks and tools.</li><li>Experience with Python data processing frameworks&nbsp;such as Pandas</li><li>Strong knowledge of&nbsp;database technologies, both SQL and NoSQL</li><li>Experience with writing complex SQL queries and performance&nbsp;tuning</li><li>Experience with Python project deployments and CI pipelines</li><li>Excellent problem-solving ability with solid communication and collaboration skills.</li></ul><p><strong>What we offer:</strong></p><p>&nbsp;</p><ul><li>Day shift, no weekends</li><li>Permanent WFH, or the option for hybrid or WFO</li><li>Above market remuneration</li><li>HMO Day 1 - Primary and Dependent&nbsp;</li><li>Performance incentives</li><li>Team building events and activities</li><li>Brand new IT equipment</li><li>15 days VL</li><li>5 days sick leave</li><li>13 month and all other government mandated benefits</li></ul><p>&nbsp;</p>"
1,PYTHON DEVELOPER | WFH,https://ph.jobstreet.com/job/83172126?type=standard&ref=search-standalone&origin=cardTitle#sol=6c1708b31d981d9a2cb0cb4b11cdcb787db4838b,Satellite Office,1d ago,"Pasig City, Metro Manila",Developers/Programmers (Information &amp; Communication Technology),Full time,"<p><strong>PYTHON DEVELOPER&nbsp;</strong></p><p>Work for our global clients and immerse in our rich and diverse company culture where you can thrive, grow and just be aweSOme! Apply now and discover the Satellite Office Candidate Experience – recognized as one of BEST among BPO companies worldwide.<br>&nbsp;</p><p><strong>WHAT IS A PYTHON DEVELOPER?</strong></p><p>Our awesome client a company based in Australia is looking for a <strong>PHYTHON DEVELOPER &nbsp;</strong> to be part of their team.<br>&nbsp;</p><p><strong>Role Description and Responsibilities</strong></p><p>&nbsp;</p><p><strong>Expectations:</strong></p><ul><li>PowerBI would be good / SQL would be good</li><li>Integration work</li><li>No front-end development</li><li>Current Developer is on Python | but any language would be preferred</li><li>Logic Apps isn't primarily a must have if we find an extremely strong Developer</li><li>CosmosDB can be secondary to a really strong Developer</li></ul><p>&nbsp;</p><p><strong>Required Skills and Qualifications</strong></p><p><strong>Technical Skills</strong></p><p>Proficiency in programming languages like JavaScript, Java, C#, Python, etc</p><p>Proficiency writing database queries</p><p><strong>Experience</strong></p><p>Experience working with API’s</p><p>Experience with Azure Function and Logic Apps</p><p>Experience writing queries for SQL and Cosmos DB</p><p>Experience working with Microsoft 365 stack</p><p><strong>Personal Attributes</strong></p><p>Good communication skills</p><p>Debugging, error handling and general problem solving</p><p>&nbsp;</p>"
2,Software Developer,https://ph.jobstreet.com/job/83121925?type=standard&ref=search-standalone&origin=cardTitle#sol=fc724a83b76e871f01c81c53ef4e2782822746ea,Toolkit Inc.,4d ago,Metro Manila,Developers/Programmers (Information &amp; Communication Technology),Full time,"<p><strong>About Toolkit Inc.:</strong></p><p>At Toolkit Inc., we specialize in transforming business processes through innovative software solutions. Our expertise ranges from ERP implementation with custom Odoo integration to developing full-stack, enterprise-grade applications using the latest technologies. We are at the forefront of incorporating Machine Learning and AI into business analytics, delivering insightful data interpretations. Our team excels in crafting user-centric mobile applications and creative UX designs across various platforms, ensuring an engaging and efficient user experience. Committed to advancing businesses into the digital era, we also offer comprehensive cloud services for seamless, scalable operations. At Toolkit Inc., we are dedicated to making businesses more efficient and effective, one innovative app at a time.</p><p><strong>Job Summary:</strong></p><p>We are seeking talented and motivated Full-Stack Software Developers to join our team. The successful candidate will work closely with other developers, designers, and project managers to develop and maintain high-quality software applications using a variety of programming languages.</p><p><strong>Key Responsibilities:</strong></p><ul><li>Design, develop, test, and deploy high-quality software applications using Python, JavaScript, and other programming languages.</li><li>Collaborate with cross-functional teams to integrate new features and optimize application performance.</li><li>Write clean, efficient, and maintainable code that adheres to industry standards and best practices.</li><li>Debug and troubleshoot software issues, and provide solutions to improve application performance and reliability.</li><li>Develop and maintain documentation, including technical specifications and user manuals, for all software applications.</li><li>Participate in code review, unit testing, and integration testing to ensure code quality and application functionality.</li><li>Stay up-to-date with emerging trends and technologies in software development, and apply them to develop innovative and efficient solutions.</li></ul><p><strong>Requirements:</strong></p><ul><li>Bachelor's degree in Computer Science, Software Engineering, or a related field. <strong>Undergraduates with advanced software development skills are also welcome to apply.</strong></li><li>Strong programming skills in Python, JavaScript, and familiarity with other languages such as Java, C#, Ruby, or PHP.</li><li>Experience with PostgreSQL and software development tools and technologies such as Git, SQL databases, RESTful APIs, and cloud platforms such as AWS, Google Cloud, or Azure.</li><li>Experience with agile software development methodologies and tools such as Jira, Trello, or Asana.</li><li>Strong problem-solving skills and attention to detail.</li><li>Excellent communication and interpersonal skills, with the ability to work effectively in a team environment.</li></ul><p><strong>Preferred Qualifications:</strong></p><ul><li>Experience in developing and deploying machine learning models using Python libraries such as Pandas, Flask, Django, Tensorflow, Odoo.</li><li>Familiarity with front-end development technologies such as HTML, CSS, and JavaScript.</li><li>Understanding of software security principles and best practices.</li></ul><p><strong>Why Join Toolkit Inc.?</strong></p><ul><li>Be part of a creative, forward-thinking team.</li><li>Opportunity to work on diverse projects and learn new technologies.</li><li>Competitive salary and benefits package.</li><li>Flexible working hours and remote working options.</li><li>A culture that values innovation, efficiency, and continuous learning.</li></ul>"
3,Senior Software Engineer (Python Back-end Development),https://ph.jobstreet.com/job/83182252?type=standard&ref=search-standalone&origin=cardTitle#sol=cdfa3fa40e0195224bb5ecb3be611f067ad49c19,ITRS (PHILS.) INC.,1d ago,"Makati City, Metro Manila",Engineering - Software (Information &amp; Communication Technology),Full time,"<p>Recognised as a Great Place to Work, ITRS is an Enterprise SaaS provider with industry-leading solutions. Our prestigious customer base includes 90% of the world's top investment banks. We are backed by leading private equity investors and are rapidly growing.</p><p>Our headquarters are in Shoreditch - London's tech hub – with offices in other UK and global locations from the Netherlands to Manila, NYC and Florida. We pride ourselves on a diverse, friendly, dynamic culture - with a focus on internal promotion and developing our people.</p><h2>&nbsp;</h2><h2><strong>Scope of role</strong></h2><p>As a Senior Software Engineer you will deliver new features in our Opsview product suite, you will report to the Engineering Manager in our Makati office. The Engineering team is a global team with main hubs in Manila, Sweden, Spain, UK and North America.</p><p>The Makati office is growing and we are looking for Engineers that want to be part of a successful team building software products and working with the latest technologies. &nbsp;</p><p>&nbsp;</p><p><strong>As a Senior Software Engineer, you will:</strong></p><ul><li>Build software for our Opsview product suite &nbsp;</li><li>Take a lead on user story definition and the production of detailed technical designs &nbsp;</li><li>Develop software and unit tests against those detailed designs &nbsp;</li><li>Take a lead on the production of engineering estimates and timescales</li><li>Maintain current technical documentation at the code, design and user levels &nbsp;</li><li>Maintain the software on an ongoing basis</li><li>Review others work at design and code stage and provide constructive feedback on how it could be improved &nbsp;</li><li>Partner with our dedicated product support team to help fix customer raised defects </li></ul><p><br><br><strong>Requirements</strong></p><ul><li>5 years of experience with Python Application Development</li><li>Experience working with RDBMS and NoSQL databases (MySQL and CouchDB) &nbsp;</li><li>Experience with Unix/Linux at the command line&nbsp;</li><li>Experience in version control systems like Git </li><li>Experienced in overseeing product architecture</li><li>Experience working in continuous integration environments (Jenkins/Groovy)&nbsp;</li><li>Experience in code profiling and writing unit tests &nbsp;</li><li>Experience improving coding and development practices &nbsp;</li><li>Experience quickly assimilating new technologies and skills &nbsp;</li><li>Experience working within an Agile scrum team &nbsp;</li><li>Willing to work in a hybrid setup, reporting onsite at least once a week to our Makati office</li></ul><p><br><br><strong>Benefits</strong></p><ul><li>HMO for you and your dependents</li><li>Supplemental Medical Claim</li><li>Employee Assistance Program</li><li>Retirement Plan</li><li>Flexible Hybrid Working</li><li>Enhanced Parental Leave</li><li>Life Assurance</li><li>Subsidies and Allowances</li><li>Referral Bonus</li><li>Buy and Sell Holiday</li><li>Training Reimbursement</li></ul><p>&nbsp;</p><p>&nbsp;</p><p>ITRS Group is an Equal Opportunity employer, and Inclusion is part of our everyday life. We celebrate diversity and pride ourselves on providing an environment where all employees can be their authentic selves and have a voice, allowing everyone to contribute equally. We remain committed to advocating inclusion, diversity, and equality into our ITRS family as we grow and enrich our business.</p><p>We welcome applications from everyone in the community as we recognize that a diverse workforce is a stronger workforce.</p>"
4,PYTHON DEVELOPER (Hybrid),https://ph.jobstreet.com/job/83052148?type=standard&ref=search-standalone&origin=cardTitle#sol=017ad5c5b296685f12cb76bd6da72314e7518fb1,"Innodata Knowledge Services, Inc.",6d ago,Metro Manila,Developers/Programmers (Information &amp; Communication Technology),Full time,"<p><strong>JOB OVERVIEW:</strong></p><p>We are seeking a highly skilled Python Developer to join our dynamic team. The ideal candidate will have extensive experience in developing scalable applications using Python, with a strong understanding of back-end development, data processing, and automation. The Python Developer will collaborate with cross-functional teams to design, implement, and maintain efficient and high-performance solutions.</p><p><strong>QUALIFICATIONS:</strong></p><p>· A Bachelor's degree in Computer Science, Software Engineering, or a related field.</p><p>· Minimum of 3 years of experience in Python development roles.</p><p>· Proficiency in Python frameworks such as Django, Flask, or FastAPI.</p><p>· Experience in building RESTful APIs and microservices architecture.</p><p>· Strong understanding of database management systems such as PostgreSQL, MySQL/MSSQL, or MongoDB.</p><p>· Knowledge of front-end technologies like HTML, CSS, and JavaScript is a plus.</p><p>· Familiarity with cloud platforms such as AWS, Azure, or Google Cloud.</p><p>· Hands-on experience with CI/CD pipelines and version control (Git).</p><p>· Strong debugging, problem-solving, and optimization skills.</p><p>· Experience working with Agile methodologies and tools like JIRA and Confluence.</p>"
5,Web Developer (PHP/Python) - HMO - No weekends,https://ph.jobstreet.com/job/82555682?type=standard&ref=search-standalone&origin=cardTitle#sol=007fb429f5de68f3bf4a89dbbe7abb028fe5f0ac,ELGADA BPO SOLUTIONS INC.,27d ago,Metro Manila,Developers/Programmers (Information &amp; Communication Technology),Full time,"<p><i>Elgada BPO Solutions Inc. is a growing business solution provider based in the heart of Makati, Philippines. We support the ever-growing demands of our offshore client through software development.</i></p><p><i>Using our tech expertise and cross-industry experience, we evolve digital transformation into digital acceleration. We deliver full-cycle software development services that adapt seamlessly to project requirements and business needs.</i></p><p>&nbsp;</p><p><strong>What we are looking for:</strong></p><ul><li>Proficient in <strong>PHP/Python</strong> with at least <strong>2 to 4 years</strong> of <strong>professional/work experience in programming.</strong></li><li>Holds a BS Degree in Computer Science, Information Technology, Computer Engineering, or any related course.</li><li>Proficient in JavaScript</li><li>Proficient in OOP and design patterns</li><li><strong>Willing to work on a mid-shift from 5:00PM to 2:00AM Philippine Time.</strong></li><li><strong>Willing to work onsite in Makati, Monday to Friday (Fixed weekends off).</strong></li></ul><p>&nbsp;</p><p><strong>What you will do:</strong></p><ul><li>Develop front end website architecture.</li><li>Design user interactions on web pages.</li><li>Develop back-end website applications.</li><li>Solve complex performance problems and architectural challenges.</li><li>Build efficient, testable, and reusable applications.</li><li>Create servers and databases for functionality.</li><li>Ensure cross-platform optimization.</li><li>Ensure responsiveness of applications</li><li>Work alongside graphic designers for web design features.</li><li>See through a project from conception to finished product.</li><li>Design and develop APIs.</li><li>Meet both technical and consumer needs.</li><li>Stay abreast of developments in web applications and programming languages.</li><li>Support legacy applications that are written in PHP</li></ul><p>&nbsp;</p><p><strong>Skills Needed:</strong></p><ul><li>Graphql</li><li>Django</li><li>MySQL</li><li>PHP/Laravel</li></ul><p>&nbsp;</p><p><i>HMO on day 1</i></p><p><i>Government-mandated benefits</i></p><p><i>Employee Engagement Events (company outings, fun activities)</i></p><p><i>Fun, supportive, and inclusive culture</i></p>"
6,Calculation Developer (Python Developer),https://ph.jobstreet.com/job/83011024?type=standard&ref=search-standalone&origin=cardTitle#sol=04b4df75c14544ec2a42e2db06cb2f385a1bc90d,Ascendion,8d ago,"Bonifacio Global City, Taguig City, Metro Manila",Developers/Programmers (Information &amp; Communication Technology),Full time,"<p>Job Description</p><ul><li>Bachelor’s degree or college undergraduate is required, preferably in a program with heavy emphasis on mathematics or business.</li><li>Previous work/projects regarding to benefits or insurance experience a plus</li><li>Experience with data entry, validation and manipulation (advanced Excel skills are essential)<br>Ability to ask the right questions and seek help where appropriate<br>Sense of accountability; owning one’s work and taking pride in it<br>Collaboration with a global team, include taking accountability for quality and on-time delivery of own work and involving other team members when appropriate<br>Structured problem solving and analytical thinking<br>Continuous improvement mindset – increasing task efficiency and effectiveness with each product or service repetition<br>Strong client service orientation<br>Strong client relationship, interpersonal and team skills<br>Able to work shift hours</li></ul>"
7,Senior Backend Developer (Python/Java) Work From Home,https://ph.jobstreet.com/job/82872734?type=standard&ref=search-standalone&origin=cardTitle#sol=aed8c4053ce9cc62fdeb3dc05bd944ac60617c5b,Quantrics Enterprises Inc.,14d ago,"Taytay, Rizal",Developers/Programmers (Information &amp; Communication Technology),Full time,"<p>Join our award-winning IT team as we lead the way in digital, cloud, and security technology services. You will be playing a critical role in delivering innovative solutions for our biggest client, Canada’s leading telecommunications, tech, and media corporation.</p><p>&nbsp;</p><p>We’re looking for passionate and creative tech leaders who want to take their career to the next level and make a real impact. Our success is fueled by our people and our passion for innovation, so we empower our Qmunity and provide a workplace where they can flourish and grow.</p><p>&nbsp;</p><p><strong>We offer premium benefits, including:</strong></p><ul><li>Work From Home Set up</li><li>Salary based on experience, miscellaneous allowances</li><li>Performance bonuses and yearly increase</li><li>HMO from day 1 for you + 2 free dependents</li><li>6 months paid maternity/15 days paternity leave</li><li>Company-sponsored training and upskilling, and career growth opportunities!</li></ul><p>&nbsp;</p><p>&nbsp;<strong>You will have the opportunity to…&nbsp;&nbsp;</strong></p><ul><li>You will develop design, debug, and operate multiple applications used by Bell network operation/engineering teams and support legacy applications running on-premises.</li><li>You will provide engineering support on end-to-end problem resolution and root cause analysis in collaboration with other functional groups, business units, and vendors</li><li>You will represent messaging services with corporate security teams &amp; rest of the company</li><li>You can quickly learn and adapt to new technologies, and you have a strong aptitude for innovation</li></ul><p>&nbsp;&nbsp;&nbsp;&nbsp;&nbsp;&nbsp;&nbsp;&nbsp;&nbsp;&nbsp;&nbsp;&nbsp;&nbsp;&nbsp;&nbsp;&nbsp;&nbsp;&nbsp;&nbsp;&nbsp;&nbsp;&nbsp;&nbsp;&nbsp;&nbsp;&nbsp;&nbsp;&nbsp;&nbsp;&nbsp;&nbsp;&nbsp;&nbsp;&nbsp;&nbsp;&nbsp;</p><p><strong>Minimum Required Skills &amp; Experience:</strong></p><ul><li>5+ years of experience in Software Development</li><li>5+ years of experience in object-oriented software and application development mainly in Python and Java.</li><li>5+ years of experience in experience in Agile Development, DevOps, and Test-Driven Design</li><li>5+ years of experience in unit testing, Test-Driven Development, code review, continuous integration, continuous delivery &amp; DevOps practices.</li></ul><p>&nbsp;</p><p><strong>Nice to have:</strong></p><ul><li>Someone who is very familiar with code management tools (GIT) and possibly automation/orchestration tools such as Ansible/Puppet but considers Infra-As-Code as a new religion</li><li>Someone who can slice and dice a business/system problem into an easy modular and maintainable solution with your team</li><li>A team player who can define, establish, and communicate their long-term vision, who is adaptable to uncertain and changing needs</li><li>A candidate with strong interpersonal, oral, and written communication skills (A good sense of humor is a bonus!)</li><li>Superior coaching skills with the ability to raise your team’s game through your teaching</li><li>Experience with container environment (Docker, Kubernetes, or even DockerSwarm), because new stuff is fun!</li><li>Experience with real-time stream processing (Kafka).</li><li>Experience in a Public Cloud.&nbsp;GCP, AWS, Azure, or any will do.</li><li>Linux and/or Agile certification</li><li>Strong IP networking skills&nbsp;&nbsp;&nbsp;&nbsp;&nbsp;</li></ul><p>&nbsp;</p><p>If you’re ready to take the next step in your career, APPLY NOW!&nbsp;</p>"
8,Python Developer - Mid to Senior Level - Sign on Bonus - HMO on day 1,https://ph.jobstreet.com/job/82695806?type=standard&ref=search-standalone&origin=cardTitle#sol=4230de6e48fdc44a259e983150ad2969e9860402,ELGADA BPO SOLUTIONS INC.,21d ago,Metro Manila,Developers/Programmers (Information &amp; Communication Technology),Full time,"<p><i>Elgada BPO Solutions Inc. is a growing business solution provider based in the heart of Makati, Philippines. We support the ever-growing demands of our offshore client through software development.</i></p><p><i>Using our tech expertise and cross-industry experience, we evolve digital transformation into digital acceleration. We deliver full-cycle software development services that adapt seamlessly to project requirements and business needs.</i></p><p>&nbsp;</p><p><strong>What we are looking for:</strong></p><ul><li>Proficient in Python Programming Language (at least <strong>5 to 6 years of professional/work experience</strong>)</li><li>Holds a BS Degree in Computer Science, Information Technology, Computer Engineering, or any related course.</li><li>Proficient in JavaScript</li><li>Proficient in OOP and design patterns</li><li><strong>Willing to work on a mid-shift from 5:00PM to 2:00AM Philippine Time.</strong></li><li><strong>Willing to work onsite in Makati, Monday to Friday (Fixed weekends off).</strong></li></ul><p>&nbsp;</p><p><strong>Requirements:</strong></p><ul><li>Graphql</li><li>Flask</li><li>React.js</li><li>Django</li><li>MySQL</li></ul><p>&nbsp;</p><p><strong>What you will do:</strong></p><ul><li>Develop front end website architecture.</li><li>Design user interactions on web pages.</li><li>Develop back-end website applications.</li><li>Solve complex performance problems and architectural challenges.</li><li>Build efficient, testable, and reusable applications.</li><li>Create servers and databases for functionality.</li><li>Ensure cross-platform optimization.</li><li>Ensure responsiveness of applications</li><li>Work alongside graphic designers for web design features.</li><li>See through a project from conception to finished product.</li><li>Design and develop APIs.</li><li>Meet both technical and consumer needs.</li><li>Stay abreast of developments in web applications and programming languages.</li><li>Support legacy applications that are written in PHP</li></ul><p>&nbsp;</p><p><i>HMO on day 1</i></p><p><i>SIGN ON BONUS</i></p><p><i>Government-mandated benefits</i></p><p><i>Employee Engagement Events (company outings, fun activities)</i></p><p><i>Fun, supportive, and inclusive culture</i></p>"
