,title,link,company,posted,location,job_func,emp_type,job_desc
24,Big Data Engineer,https://ph.jobstreet.com/job/82683949?type=standard&ref=search-standalone&origin=cardTitle#sol=b78120d62e3a5afa9c3ffd0f40a36d78e9de8157,FIRSTMAC OPERATIONS CENTER PTY LTD-PHILIPPINE BRANCH,21d ago,Metro Manila,Engineering - Software (Information &amp; Communication Technology),Full time,"<p><strong>POSITION PURPOSE: </strong>The big data team is responsible for developing, monitoring and maintaining the data warehouse and the integration of business development tools to enable a more strategic, tactical and operational business. Big data technologies include AWS hosted databases and components such as Postgres and Redshift DB’s, AWS Data Pipelines, Lambda functions and Python code to deliver scalable solutions to the business.</p><p>&nbsp;</p><p><strong>KEY RESPONSIBILITIES:</strong></p><ul><li>Designing and implementing the architecture of ETL using PySpark and SQL language in AWS Glue.</li><li>Designing and developing transactional and analytical data structures.</li><li>Aligning the Data technical capabilities to business objectives.</li><li>Developing reporting solutions to support Business Intelligence, including resolving problems related to data analysis and reporting services.</li><li>Establishing and maintaining policies, operational procedures, and associated documentation for user interaction with the database environment.</li><li>Following Firstmac standards and best practice for the deployment of AWS components and code using source code controls such as BitBucket, and utilizing DevOps tools (e.g., Terraform), apps, and CLI as appropriate.</li><li>Recommending improvements to existing approaches and practices within Data Governance forums and other appropriate meetings.</li></ul><p>&nbsp;</p><p><strong>TECHNICAL SKILLS:</strong></p><ul><li>Python 3+ including Virtual environments, PIP, Pypy, Package development, Boto3, sqlalchemy, Pytest</li><li>ETL / ELT experience with SQL &amp; Python within a big data environment.</li><li>Experience with SQL and NoSQL databases</li><li>Excellent coding skills, source control management (ie git) across programming languages with a strong focus on unit and integration testing</li><li>SQL (ANSI, TSQL, PL/pgSQL)</li><li>Experience in deploying AWS components remotely using AWS CLI Ability to perform database modelling and design, develop, debug, troubleshoot database objects, stored procedures and functions</li><li>Knowledgeable on LINUX with the ability to program shell scripts</li><li>Experience in developing and maintaining software solutions within the AWS ecosystem (S3, Redshift, DynamoDB).</li></ul><p>&nbsp;</p><p><strong>JOB QUALIFICATIONS:</strong></p><ul><li>With at least 3-5 years of work experience and familiarity with the entire software development life cycle and facilitating agile practices and methodology</li><li>Graduate of Bachelor's Degree in Computer Science, Computer Engineering, Information Technology or related fields</li></ul><p>&nbsp;</p><p><strong>KEY COMPETENCIES:</strong></p><ul><li>&nbsp;Reporting and Analysis: Understanding of constructing, designing, and reporting using Power BI and a dimensional data warehouse.</li><li>Communication: Proficient in communicating insights from Reports and Analysis to the business.</li><li>Numeric and Data Analytics Skills: Prior experience implementing and utilizing analytics with BI tools such as Power BI, Python, and MongoDB data.</li><li>Database Skills: Experience in working with databases and analysing insights preferably with Athena, Redshift, MongoDB.</li></ul><p>&nbsp;</p><p><strong>IMPORTANT NOTE:</strong></p><ul><li>100mbps minimum internet speed.</li><li>An ideal work space set-up for optimized work productivity is a given.</li><li>Company asset (laptop) will provided upon hiring.</li></ul><p>&nbsp;</p><p><strong>Interested parties may apply direct to Jobstreet. Interviews to be done online remotely by video call with Human Resources.</strong></p>"
25,Software Engineer,https://ph.jobstreet.com/job/82382981?type=standard&ref=search-standalone&origin=cardTitle#sol=094e2ca93b256adb724081ef1dcca5a6904edd81,"Manpower Outsourcing Services, Inc.",5d ago,Metro Manila,Engineering - Software (Information &amp; Communication Technology),Full time,"<p><strong>About the role</strong><br><br>Manpower Outsourcing Services, Inc.' is seeking a talented Software Engineer to join our dynamic team. This is a position based in NCR, where you will play a crucial role in developing cutting-edge software solutions that drive our business forward.</p><p><strong>What you'll be doing</strong></p><ul><li>Act as the technical implementation engineer (TE) in the project and be responsible for technical implementation and technical issue handling of the delivery project.</li><li>Participate in the integration planning and design of project delivery, output integration delivery solutions, including deployment, configuration, test, data migration, training, cutover, and acceptance solutions, and be responsible for the solution deliverability.</li><li>Manage technical risks and issues in project delivery, obtain customer recognition, effectively implement the solution, and identify and mitigate technical risks and issues in advance.&nbsp;</li><li>Participates in requirements gathering, IT &amp; software solution analysis, design, development, implementation and validation of new IT &amp; software systems.</li><li>Involves in customizations, modifications and redevelopments of application to ensure essential local business operations and supports</li><li>Involves in maintenance and performance enhancement of existing IT &amp; software tools systems, correcting system bug and redeploy the program if it is needed.</li><li>Providing IT &amp; software support for all company internal users to ensure the sustainability of IT &amp; software systems.</li></ul><p><strong>What we're looking for</strong></p><ul><li>Degree in Computer Science, Software Engineering, or other related field</li><li>Minimum 2 years of experience in software development, with a strong understanding of software engineering principles and best practices</li><li>Proficiency in one or more programming languages</li><li>Familiarity with software development frameworks, databases, and cloud technologies</li><li>Excellent problem-solving, analytical, and critical thinking skills</li><li>Strong communication and collaboration abilities to work effectively in a team environment</li><li>Passion for staying up-to-date with the latest industry trends and technologies</li></ul><p><strong>What we offer</strong><br><br>At Manpower Outsourcing Services, Inc.', we value our employees and strive to provide a nurturing and rewarding work environment. As a Software Engineer, you can expect:</p><ul><li>Competitive salary and benefits package</li><li>Opportunities for professional development and career growth</li><li>Collaborative and supportive team culture</li><li>Flexible work arrangements to maintain a healthy work-life balance</li><li>Access to the latest technologies and tools to enhance your skills</li></ul><p><strong>About us</strong><br><br>Manpower Outsourcing Services, Inc.' is a leading provider of information and communication technology solutions. With a strong track record of delivering innovative and reliable software products, we are committed to empowering our clients and driving digital transformation. Join our team and be a part of our exciting journey as we continue to push the boundaries of what's possible in the ICT industry.</p><p>Apply now to become our next Software Engineer!</p>"
26,Full Stack Software Engineer - 100% Remote (Typescript | Next.js | NestJS),https://ph.jobstreet.com/job/82996171?type=standard&ref=search-standalone&origin=cardTitle#sol=e86af87f87b64c1158faed508b722ff435d1aa17,Acquire BPO,8d ago,"Pasig City, Metro Manila",Developers/Programmers (Information &amp; Communication Technology),Full time,"<p>Acquire BPO is an award-winning business process outsource provider, to some of the world’s largest brands operating contact centers and back-office services from offshore, nearshore, and onshore locations to clients globally and serviced from Australia, Dominican Republic, Philippines and the United States. Known for our commitment to safety, flexibility, and innovation, we strive to be the partner of choice for businesses looking to leverage the best global BPO and AI resources. Our employee value proposition,&nbsp;<i><strong>Come for a career, stay for the fun</strong></i>, underscores our commitment to a vibrant, inclusive, and engaging work environment.</p><h2>&nbsp;</h2><h2><strong>Why Join the A-Team?</strong></h2><p>Come for a career, stay for the fun!</p><ul><li><strong>Growth! </strong>Grow with us and utilise our learning and development opportunities and annual training budget.</li><li><strong>Health Care:</strong> Enjoy a healthcare allowance for your well-being.</li><li><strong>Flexi-Time: </strong>Take advantage of flexible working hours to improve work-life balance.</li><li><strong>Brand new laptop!</strong></li><li><strong>Competitive monthly salary.</strong></li><li><strong>Vibes: </strong>Join a fun, collaborative, growing team …and more!</li></ul><h2>&nbsp;</h2><h2><strong>A Glimpse into Your New Role</strong></h2><p><i><strong>Your tasks for the day include, but are not limited to, the following:</strong></i><strong>&nbsp;</strong></p><ul><li>This is a fully remote role and you’ll be joining a growing team in the Philippines and working with a supportive engineering team based in New Zealand.</li><li>In our technology stack we believe in using the best tool for the job, along with stable, smooth and regular releases where we build the best experiences for our customers.</li><li>Work with modern technologies - our tech stack is built on GCP, using NextJS, React and Typescript on the frontend with NestJS and Typescript on the backend.</li><li>Work in an agile delivery team, collaborating with developers, testers and product owners.</li><li>Participate in knowledge sharing sessions and demos with the engineering team and wider business.</li><li>Work in a continual learning environment that fosters and encourages innovation, creativity and collaboration.</li><li>Open communication, strong spoken and written english to communicate your ideas and ask questions.</li></ul><h2>&nbsp;</h2><h2><strong>What You’ll Bring</strong></h2><p>Consistent to our goal as an organization, at Acquire BPO, we are looking for individuals who are passionate in winning; those who enjoy achieving goals with the determination to go beyond hurdles. As a&nbsp;<strong>Full Stack Software Engineer</strong>, you will be able to:</p><ul><li><strong>Think strategically:</strong>&nbsp;See the big picture, plan ahead, and put thought into action</li><li><strong>Be adaptable:</strong>&nbsp;Demonstrate a willingness to be flexible, versatile and tolerant in a changing work environment while maintaining effectiveness and efficiency</li><li><strong>Foster Teamwork:</strong>&nbsp;Work cooperatively with others to set goals, resolve problems, and make decisions that enhance company effectiveness</li><li><strong>Problem Solve:&nbsp;</strong>Assess problem situations to identify causes. Gather and process relevant information, generate possible solutions, and make recommendations to resolve the problem.</li><li><strong>Build Relationships:</strong>&nbsp;Establish and maintain positive working relationships with others, both internally and externally, to achieve the goals of the company.</li><li><strong>Learn:</strong>&nbsp;Growth is important to us and sometimes that means making mistakes and asking for help when needed</li></ul><p>With a diverse global team working together, we proudly embrace and live by these shared values:&nbsp;</p><ul><li><strong>Collaboration:</strong>&nbsp;Brilliant jerks can be brilliant elsewhere.&nbsp;</li><li><strong>Impact:</strong>&nbsp;Do, get it done, create impact.&nbsp;</li><li><strong>Passion:&nbsp;</strong>Be positive, bring passion and energy.&nbsp;</li><li><strong>Transparency:</strong>&nbsp;A transparent team can help each other.&nbsp;</li></ul><p>&nbsp;</p><p>What are you waiting for?&nbsp;</p><p>Join the A-Team and experience the A-Life!&nbsp;</p>"
27,Software Engineer / Programmer  - remote work,https://ph.jobstreet.com/job/83146063?type=standard&ref=search-standalone&origin=cardTitle#sol=a8b1905e71d57202c0b9e05cf68fbeee99a514af,Thrive CMG,4d ago,Metro Manila,Developers/Programmers (Information &amp; Communication Technology),Full time,"<p>We are seeking a professional, innovative, and knowledgeable <strong>Software Engineer</strong> to join our dynamic team. In this fully remote role, you will play a critical part in designing, developing, and integrating software solutions that drive our internal systems and services. This position requires a self-motivated engineer with expertise in both front-end and back-end technologies, as well as modern automation platforms.</p><h2><strong>Technical Requirements:</strong></h2><ul><li><p>Proficient in <strong>PHP</strong>, <strong>Java</strong>, and <strong>JavaScript</strong> frameworks (e.g., Node.js, React, Angular).</p></li><li><p>Strong understanding and practical use of <strong>JSON</strong>, RESTful APIs, and <strong>OAuth 2.0</strong> authentication flows.</p></li><li><p>Experience with <strong>Power Automate</strong>, <strong>Power Apps</strong>, and the <strong>Microsoft 365 Ecosystem</strong> (including SharePoint Online, Teams, Outlook, Graph API).</p></li><li><p>Comfortable working with relational databases (e.g., <strong>SQL Server</strong>, <strong>MySQL</strong>) and designing efficient schemas and queries.</p></li><li><p>Solid grasp of <strong>API integration</strong> concepts, including third-party system connectivity and data synchronization.</p></li><li><p>Familiarity with <strong>DevOps pipelines</strong>, <strong>CI/CD workflows</strong>, version control using <strong>Git</strong>, and containerization (e.g., Docker).</p></li><li><p>Awareness of current best practices in <strong>software security</strong>, <strong>performance optimization</strong>, and <strong>scalable architecture</strong>.</p></li></ul><hr><h2><strong>General Requirements:</strong></h2><ul><li><p>Bachelor’s degree in Computer Science, Engineering, or equivalent technical discipline.</p></li><li><p>A minimum of 3 years of hands-on software engineering or full stack development experience.</p></li><li><p>Strong English communication skills, both verbal and written.</p></li><li><p>Ability to work independently while collaborating in a remote team setting.</p></li><li><p>Typing speed of 50 words per minute or higher.</p></li><li><p>A proactive mindset, critical thinking skills, and ability to solve problems efficiently.</p></li><li><p>A reliable and high-speed internet connection.</p></li><li><p>Operating system: <strong>Windows 10 or 11</strong> (Mac OS may be used where compatible, but Windows required for certain dev tools).</p></li><li><p>Minimum <strong>1920x1080 resolution monitor</strong>.</p></li><li><p>Quiet, professional home office environment suitable for remote development.</p></li></ul><hr><h2><strong>Responsibilities Include:</strong></h2><ul><li><p>Developing, testing, and deploying scalable web and desktop applications across internal and external systems.</p></li><li><p>Designing and maintaining secure and efficient APIs for system interoperability.</p></li><li><p>Automating workflows using <strong>Power Automate</strong>, connecting SharePoint, Teams, Outlook, and third-party services.</p></li><li><p>Writing clear, maintainable, and well-documented code across multiple programming languages.</p></li><li><p>Troubleshooting and debugging production issues and proactively improving application performance.</p></li><li><p>Participating in code reviews and collaborating with cross-functional teams to deliver high-quality products.</p></li><li><p>Creating integration logic between on-premises SQL servers and Microsoft cloud services using custom APIs or hybrid connectors.</p></li><li><p>Contributing to UI/UX improvements and optimizing user interactions across platforms.</p></li><li><p>Staying up to date with emerging technologies and recommending improvements to existing systems.</p></li></ul><hr><h2><strong>Bonus Skills (Preferred, Not Required):</strong></h2><ul><li><p>Experience with <strong>Azure Functions</strong>, <strong>Logic Apps</strong>, and <strong>Microsoft Graph API</strong>.</p></li><li><p>Experience in <strong>Agile/Scrum</strong> development environments.</p></li><li><p>Familiarity with <strong>AI/ML integration</strong>, <strong>chatbot frameworks</strong>, or <strong>Copilot SDK</strong>.</p></li><li><p>Experience working with <strong>WordPress</strong>, <strong>PowerShell</strong>, or <strong>.NET</strong> platforms.</p></li><li><p>Knowledge of <strong>HIPAA compliance</strong>, <strong>data privacy</strong>, and secure healthcare application development (a plus for healthcare-based environments).</p></li></ul><hr><h2><strong>Benefits:</strong></h2><ul><li><p>100% remote work with flexible hours.</p></li><li><p>Collaborative, forward-thinking, and inclusive engineering team.</p></li><li><p>Low-stress, high-autonomy environment.</p></li><li><p>Opportunities for professional growth, training, and certifications.</p></li><li><p>Be part of meaningful projects that support innovation and digital transformation in healthcare and business operations.</p></li><li><p>We are an equal opportunity employer. All applicants will be considered without regard to race, color, religion, sexual orientation, gender identity, national origin, veteran, or disability status.</p></li></ul>"
28,IT Programmer,https://ph.jobstreet.com/job/83096630?type=standard&ref=search-standalone&origin=cardTitle#sol=2d48e457aeda1998b08fb4889b369e0d78504fba,NTT Philippines Solutions Inc.,5d ago,Metro Manila,Developers/Programmers (Information &amp; Communication Technology),Full time,"<p><strong>Duties and Responsibilities:</strong></p><p>•&nbsp;&nbsp;&nbsp;&nbsp;&nbsp;&nbsp; Develop detailed design for modules that need to be developed and align with the requirements and architecture</p><p>•&nbsp;&nbsp;&nbsp;&nbsp;&nbsp;&nbsp; Develops application code and configuration/scripts according to the agreed functional design, technical design, methodologies and standards for package deployment</p><p>•&nbsp;&nbsp;&nbsp;&nbsp;&nbsp;&nbsp; Develops system &amp; operational documentation and user guides</p><p>•&nbsp;&nbsp;&nbsp;&nbsp;&nbsp;&nbsp; Prepares package, configuration files, deployment scripts and installation guide for all environments</p><p>•&nbsp;&nbsp;&nbsp;&nbsp;&nbsp;&nbsp; Support production when necessary</p><p></p><p><strong>Qualifications:</strong></p><p>•&nbsp;&nbsp;&nbsp;&nbsp;&nbsp;&nbsp; Bachelor’s Degree in Information Technology, Computer Science or any courses relevant for the role</p><p>•&nbsp;&nbsp;&nbsp;&nbsp;&nbsp;&nbsp; 0 to 3 years of experience in IT development</p><p>•&nbsp;&nbsp;&nbsp;&nbsp;&nbsp;&nbsp; Very conversant programming languages like C#, ASP.NET MVC/WEBFORMS, VB.NET, HTML, Java, Javascript, Python, Ruby, PHP, MS-SQL, Oracle DB, JQUERY, RDLC reporting, Crystal Reports, IOS, Android.&nbsp; On the frontend, expertise in either the iOS and/or Android is a must.</p><p>•&nbsp;&nbsp;&nbsp;&nbsp;&nbsp;&nbsp; Hands on experience on 1-2 core Platforms like CRM, Mobile app development, ECM, Data etc with at least 2 end to end projects delivered.</p><p>•&nbsp;&nbsp;&nbsp;&nbsp;&nbsp;&nbsp; Conversant with programming/development tools like Development platforms/IDE, Configuration management, Code review etc.</p><p>•&nbsp;&nbsp;&nbsp;&nbsp;&nbsp;&nbsp; Worked with Agile and Waterfall delivery methods</p>"
29,Software Developer,https://ph.jobstreet.com/job/83038795?type=standard&ref=search-standalone&origin=cardTitle#sol=08c3e624ca19a81faf494e839ba0c3bb3b283f29,"First Philec, Inc",7d ago,"Tanauan City, Batangas",Developers/Programmers (Information &amp; Communication Technology),Full time,"<ul><li>At least 2 years experience in Web and System Development</li><li>Able to work structured and independent</li><li>Knowledgeable in Java, MySQL, JSON, PHP and PHP Framework</li><li>Knowledge in AWS is a plus</li><li>Proactive</li><li>Team player</li><li>Action &amp; Outcome oriented</li></ul>"
