,title,link,company,posted,location,job_func,emp_type,job_desc
24,Associate Production Engineer,https://ph.jobstreet.com/job/82665593?type=standard&ref=search-standalone&origin=cardTitle#sol=59792347d7eb8d00646ecf1b05806941437a2b16,Coca-Cola Europacific Aboitiz Philippines Inc.,24d ago,"Misamis Oriental, Northern Mindanao","Other (Manufacturing, Transport &amp; Logistics)",Full time,"<p>Job Title: Associate Production Engineer</p><p>Location: Misamis Oriental Plant (Villanueva, Mis. Or.)</p><p>Reporting to: Production Team Leader</p><p>&nbsp;</p><p>At Coca- Cola Europacific Aboitiz Philippines, we are driven by our purpose to Refresh the Philippines and Make a Difference-- continuously leading the Beverage Industry with our Great People, Great Beverages, Great Execution and Great Partners. As we continue to Grow and shape the future, we are seeking passionate and innovative talents to join our team and make a difference with us.</p><p>&nbsp;</p><p>Our commitment to excellence has been recognized through numerous industry awards such as Great Place to Work, Best Places to Work in Asia, Dream Employer of the Year, and Universum's Most Attractive employers- and we take pride in our achievements and the impact we have made in the beverage industry.</p><p>&nbsp;</p><p>At Coca- Cola Europacific Aboitiz Philippines, &nbsp;Inc, our people are our most important resource. We are looking for skilled Associate Production Engineers to be part of our Supply Chain Team.</p><p>&nbsp;</p><p>Role Overview</p><p>The position exists to operate, monitor, and control production equipment and processes to ensure safe, and efficient operation and ensure quality of products.<br>Conducts immediate corrective maintenance activities to minimize equipment downtime and carries out routine preventive maintenance procedures to ensure safe, quality, and efficient performance of assigned equipment and processes.<br>Routinely analyzes equipment and process performance and implements corrective/preventive action methodologies to achieve continuous improvement in performance.</p><p>&nbsp;</p><p>Qualifications</p><p>-Graduate of any Engineering / Industrial Technology courses</p><p>-Technical background in mechanical/electrical/pneumatics and automation<br>-Preferably at least 2 years training or experience in manufacturing operations in an automated production setting; preferably with hands on experience with maintaining equipment.<br>-Strong ability to quickly learn and adapt to new technologies<br>-Highly analytical with strong problem solving and decision-making skills; attention to detail and highly collaborative</p><p>&nbsp;</p><p>Fresh Graduates are welcome to apply.</p><p>Company Socials</p><p>Reach us through our social media pages!</p><p>Linked In: https://www.linkedin.com/company/coca_cola_beverages_philippines/</p><p>Facebook: https://www.facebook.com/cocacolaphcareers</p><p>Instagram: https://www.instagram.com/cocacolaphcareers/</p><p>&nbsp;</p><p>Thrive with us at Coca- Cola Europacific Aboitiz Philippines and be part of a Company that is shaping the future of the beverage industry. Together, we can create great moments and make a positive impact on the lives of millions. Apply today and let's refresh the world together!</p>"
25,JOB CONTROLLER (Industrial Engineer),https://ph.jobstreet.com/job/83026502?type=standard&ref=search-standalone&origin=cardTitle#sol=473ed36f7d263cb4e6afab05c3e293b9c44575ca,"Toyota Bacoor Cavite, Inc.",10d ago,"Bacoor City, Cavite",Industrial Engineering (Engineering),Full time,"<p>The Job Controller’s / Industrial Engineer's general responsibility is to assist the foreman in the job loading and monitoring of technicians.</p><p>Functional Description of Position Responsibility:</p><ul><li>Assist the foreman in updating and monitoring of the job with the use of the Job Progress Control Board,</li><li>Under a computerized set-up, the Job Coordinator also functions as the data encoder on the computer,</li><li>Updates the Daily Work Control Sheet, where the units received are logged and,</li><li>Accomplishes reports related to workshop operations</li><li>Determine daily available manpower capacity based on the total hours of the available Technicians</li><li>Record all repair orders onto dispatch log and determine the repair time required.</li><li>Distribute repair orders to the most appropriately skilled technician based on priority and completion time</li><li>Distribute repair orders with expected job completion time</li><li>Monitor and follow-up on work progress for each technician to insure completion on time</li><li>Indicate and record the incidences and cause of job stoppages</li><li>Record number of and causes of repeat repairs</li><li>Record number of and causes of carry overs</li><li>Prioritize waiting customers, repeat repairs and carry over work</li><li>Keep Service Advisors inform when no more work can be taken base on available hours.</li><li>Maintain accurate time keeping records by ensuring all technicians clock on and off all repair orders and day cards</li><li>Keep Service Advisors informed of job delays and any additional work required</li><li>Control the distribution of all sublet repairs</li><li>Coordinate with the parts department in preparing parts for the next repair orders to be worked</li><li>Efficient distribution of all repair orders</li><li>Authorized to dispute and monitor all repair work to the Technicians</li><li>Works in cooperation with the Foreman and Service Advisors to ensure full utilization of department capacity</li></ul><p><strong>Minimum Qualifications</strong></p><ul><li>Candidate must be a graduate of Industrial Engineering</li><li>FRESH GRADUATES ARE WELCOME TO APPLY!</li><li>Strong analytical and planning skills</li><li>Excellent problem-solving skills</li><li>Possess good communication skills, good leadership skills, good time management skills</li><li>Must be familiar with MS Office</li><li>Well-organized, detail focused, initiative, resourceful, pro-active and self-motivated</li></ul>"
26,Business Process Engineer,https://ph.jobstreet.com/job/82587790?type=standard&ref=search-standalone&origin=cardTitle#sol=b9d3be2655c537244ed908f1f7d30a25977cc2a1,Mworld Trading,28d ago,Metro Manila,Industrial Engineering (Engineering),Full time,"<ul><li>Candidate must possess at least a Bachelor's/College Degree, Certification or Professional License (Passed Board/Bar/Professional License Exam), <strong>Industrial Engineering </strong>or equivalent.</li><li>With at least four years’ work experience is required for this position; previous work in ISO-certified companies an advantage</li><li>Applicants must be willing to work in NCR</li></ul><p><strong>Criteria for the Job Position</strong></p><p>​<strong>Required Knowledge:</strong></p><ul><li>Store Operations &amp; Inventory, Brand Merchandising, Warehouse and Logistics Management</li><li>Just-in-Time Principles, Materials-Handling, Equipment Maintenance</li><li>Process-related Project Management</li><li>Occupational Safety &amp; Health</li></ul><p><strong>Required Skills:</strong></p><ul><li>Conduct of Time &amp; Motion Study</li><li>Process Documentation and Process Efficiency Strategies</li><li>Policy Implementation and Monitoring</li><li>Database Management, Reports Generation and Analysis</li><li>Planning, Organization &amp; Control</li></ul><p><strong>Required Behavioral Competencies:</strong></p><ul><li>Collaboration, leadership, interpersonal and communication skills</li><li>Responsible, self-disciplined, results-oriented, with high quality of work output and keen attention to detail</li></ul><p><strong>Job Responsibilities:</strong></p><ul><li>Understand the work process, document the work flow and respective work processes of critical work units.</li><li>Recommend necessary process improvements or work flow changes.</li><li>Implement approved process improvements / changes to ensure efficiency and meet quality goals.</li><li>Identify opportunities to maximize the work spaces and company facilities and ensure health, safety, cleanliness, process efficiency and quality standards.</li><li>Help train existing and new employees on process, health, safety and quality standards.</li></ul>"
27,Warehouse Supervisor,https://ph.jobstreet.com/job/83283183?type=standard&ref=search-standalone&origin=cardTitle#sol=fc953cedfc034ef0e062f3276912892c90a52f3d,"SAN MIGUEL INTEGRATED LOGISTICS SERVICES, INC.",12h ago,"Santa Rosa City, Laguna","Team Leaders/Supervisors (Manufacturing, Transport &amp; Logistics)",Full time,"<p><strong>Qualifications:</strong></p><ul><li><p>Preferably a college graduate, IE or any related discipline</p></li><li><p>At least 3 years' experience in logistics and warehousing operations, with basic knowledge of operations and food safety</p></li><li><p>Strong analytical skills, leadership skills, and excellent communication and interpersonal skills</p></li><li><p>Strong organizational and problem-solving abilities to address challenges efficiently </p></li><li><p>Proficient in Microsoft office applications (MS Word, MS Excel, and Powerpoint)</p></li></ul><p><strong>Duties &amp; Responsibilities:</strong></p><ul><li><p>Supervises the day-to-day warehousing activities such as inbound and outbound operations of the Distribution Hub.</p></li><li><p>Schedule and assign tasks to warehouse staff, ensuring workloads are balanced.</p></li><li><p> Oversee inventory control processes, including receiving, storing, and shipping of products.</p></li><li><p>Conduct regular cycle counts and annual physical inventory audits.</p></li><li><p> Maintain accurate records of inventory levels and transactions.</p></li><li><p>Develop and implement efficient warehouse procedures and workflows to optimize productivity.</p></li><li><p> Monitor and enforce safety protocols and compliance with company policies.</p></li><li><p>Ensure equipment and machinery are properly maintained and in good working condition. </p></li><li><p>Implement quality control measures to ensure the accuracy and condition of incoming and outgoing shipments.</p></li><li><p>Address quality issues promptly and work on continuous improvement. </p></li><li><p>Coordinate the picking and dispatching of customer orders (SO/STO), meeting the required delivery dates.</p></li><li><p>Verify order accuracy and completeness.</p></li><li><p>Collaborate with other departments, such as procurement and finance, sales group, transport team, and shipping team customer service, etc. to meet operational goals. </p></li><li><p>Regularly assesses the team's performance to ensure adherence to established Key Performance Indicators (KPIs).</p></li><li><p>Identify and resolve operational issues and discrepancies in a timely manner and implement corrective actions to prevent recurrence.</p></li><li><p>Adheres to the established Good Warehousing Practices (GWP) implemented within the Distribution Hub.</p></li><li><p>Identify opportunities for cost savings and operational efficiencies.</p></li><li><p>Provides regular operational performance reports for evaluating team capabilities and identifying issues requiring management intervention.</p></li><li><p>Generate Monthly MOR (Monthly Operations Review) Reports to present the performance and challenges of Monthly KPIs to the Territory Head.</p></li></ul>"
28,Industrial Engineer (FRESH GRADUATES) | Quezon City,https://ph.jobstreet.com/job/82795556?type=standard&ref=search-standalone&origin=cardTitle#sol=2c021fb1b3eba04317c9f5db0f97560c2429c491,WalterMart Community Mall,20d ago,"Quezon City, Metro Manila",Industrial Engineering (Engineering),Full time,"<p><strong>Responsibilities:</strong></p><ul><li>Transfer of Work Requests (WR) to Work Orders (WO)</li><li>Responsible for monitoring all generated WOs</li><li>Coordinates with mall engrs / cluster engrs to validate specifications of request</li><li>Coordinates with the requestors to ensure that all requests are satisfied according to the required specifications</li><li>Ensures that requests are served at the least possible time</li><li>Coordinates with multiple internal departments with regards to billing and payments</li><li>Prepares purchase orders</li><li>Prepares bill rate</li></ul><p>&nbsp;</p><p><strong>Qualifications:</strong></p><ul><li>Graduate of BS Industrial Engineer</li><li>At least 2 years work experience; Fresh graduates are welcome to apply</li><li>Willing to be assigned in Muñoz, Quezon City</li></ul>"
29,Corporate Process Analyst,https://ph.jobstreet.com/job/82924847?type=standard&ref=search-standalone&origin=cardTitle#sol=0176df95cd9da1aab4266bae66b9c1bcb6b5c45e,Meralco Industrial Engineering Services Corporation,15d ago,"Pasig City, Metro Manila",Analysts (Consulting &amp; Strategy),Full time,"<p><strong>JOB SUMMARY</strong></p><p>The Corporate Process Analyst provides support to the Company through implementing various process improvement initiatives and projects in order to ensure strategic alignment of the organization to its goals and objectives. He/she conducts studies and reviews processes of the whole organization to improve efficiency and optimize resources.<strong>&nbsp;</strong></p><p><strong>KEY ROLES AND RESPONSIBILITIES</strong></p><ul><li>Conducts process mapping and documentation for assigned business process.</li><li>Analyzes processes using IE/OR methods and techniques.&nbsp;</li><li>Develops solutions to improve the quality, quantity and efficiency of the throughput and output in coordination with process owners; utilizes process redesign, ergonomics, layout redesign, training and resource utilization.</li><li>Presents recommended solution, implementation plan and cost-benefit analysis to management.</li><li>Manages and monitors the implementation of the project in terms of output quality, cost and schedule.</li><li>Promote awareness on corporate policies and procedures.</li></ul><p><strong>JOB QUALIFICATIONS</strong></p><ul><li>Graduate of a Bachelor’s/College degree in Industrial Engineering.</li><li>With 2 years work experience in the same field.</li><li>Strong analytical and problem solving skills.</li><li>Knowledgeable in IE/OR methods and techniques and process improvement methodologies.</li><li>Good presentation skills.</li><li>Knowledgeable in cost-benefit analysis.</li><li>Knowledgeable in Process Documentation software and Industrial Engineering software. (Camunda, Minitab)</li></ul>"
