,title,link,company,posted,location,job_func,emp_type,job_desc
17,Data Analyst - Python,https://ph.jobstreet.com/job/82535741?type=standard&ref=search-standalone&origin=cardTitle#sol=9942f369c59cfaca00ffb9334c6fae73b6a7a0e8,Aeon Credit Service Systems (Philippines) Inc.,27d ago,"Mandaluyong City, Metro Manila","Mathematics, Statistics &amp; Information Sciences (Science &amp; Technology)",Full time,"<p><strong>Job Brief:</strong></p><p>We are looking for a Data Analyst who can employ data analysis, machine learning, and programming expertise to enhance the performance of AEON and its affiliates. Your role will be instrumental in constructing data products to uncover valuable business insights.</p><p>Your role will involve collaborating with cross-functional teams, developing predictive models, and presenting actionable recommendations. Strong critical thinking and problem-solving skills are imperative for interpreting large and complex data sets. Your primary goal will be to assist AEON affiliates in making well-informed decisions by scrutinizing trends and patterns.</p><p>&nbsp;</p><p><strong>Job Responsibilities:</strong></p><ul><li>The Data Analyst is responsible for providing strategic, analytical, and technical support in all business intelligence activities for AEON.</li><li>The Data Analyst will work closely with cross-functional teams and stakeholders to identify business opportunities and provide data-driven solutions.</li><li>Create proposals and conduct end-to-end project management including scoping, building, testing, implementation, maintenance, and tracking and optimization.</li><li>Identify relevant data sources and mine necessary information for business needs.</li><li>Extract, transform,&nbsp;and analyze data from various sources to generate actionable insights.</li><li>Prepare data analysis and reports to monitor performance and identify quality controls necessary for improvement and development of AEON's products.</li><li>Prepare presentations and communicate complex findings and insights to both technical and non-technical stakeholders&nbsp;in a clear manner.</li><li>Develop and implement algorithms and models&nbsp;in R, Python, or other tools for predictive and prescriptive analytics.</li><li>Collaborate with software engineers to deploy models into production using API and monitor their performance.</li><li>Conduct ad-hoc analyses to answer specific business questions.</li></ul><p>&nbsp;</p><p><strong>Qualifications:</strong></p><ul><li>Bachelor’s degree in Mathematics, Statistics, Computer Science, Information Technology, or an equivalent related field.</li><li>Minimum of 2-5 years working in the data science field with proven experience in model development and/or deployment.</li><li>Excellent programming skills in R or Python (Proficiency in Python; knowledge in Scikit-learn, pandas, seaborn, and similar tools is preferred).</li><li>Excellent SQL skills (Familiarity with PostgreSQL, Oracle is preferred).</li><li>Experience in Flask, FastAPI, and similar technologies.</li><li>Experience in data visualization using Tableau is a plus.</li><li>Experience in AWS (Sagemaker &amp; S3) is a plus.</li><li>Excellent presentation skills, both in oral and written communication.</li><li>High attention to detail and strong documentation skills.</li></ul>"
18,Software Engineer,https://ph.jobstreet.com/job/83137146?type=standard&ref=search-standalone&origin=cardTitle#sol=8b9a249239871e3e21151ad9ae3fdc584ee3aa78,Manpower Philippines,4d ago,Metro Manila,Engineering - Software (Information &amp; Communication Technology),Full time,"<p><strong><em>Key Responsibilities </em></strong></p><ul><li><p>Develop, test, and deploy high-quality software applications.</p></li><li><p>Collaborate with product managers, designers, and other engineers to define and implement new features.</p></li><li><p>Write clean, efficient, and maintainable code following best practices.</p></li><li><p>Debug and troubleshoot issues to enhance application performance and reliability.</p></li><li><p>Participate in code reviews to ensure code quality and share knowledge with team members.</p></li><li><p>Stay updated with emerging technologies and industry trends to improve development processes.</p></li><li><p>Contribute to system architecture discussions and technical documentation.</p><p><strong>Qualifications</strong></p></li><li><p>Bachelor’s degree in Computer Science, Engineering, or a related field (or equivalent experience).</p></li><li><p>years of experience in software development using [Programming Languages – e.g., Python, Java, JavaScript, C#].</p></li><li><p>Proficiency in front-end and/or back-end technologies (e.g., React, Angular, Node.js, .NET, Django).</p></li><li><p>Experience with databases (SQL, NoSQL) and cloud platforms (AWS, Azure, Google Cloud).</p></li><li><p>Strong problem-solving skills and ability to work in a collaborative environment.</p></li><li><p>Familiarity with agile development methodologies (Scrum, Kanban). </p></li><li><p>Excellent communication skills and a proactive mindset.</p></li></ul><p><br></p>"
19,Senior Full Stack Developer | Permanent WFH | Day Shift | Weekends Off,https://ph.jobstreet.com/job/83195328?type=standard&ref=search-standalone&origin=cardTitle#sol=1042087505e1df6138a8fb5a2ff7541a9fd75332,Emapta,18h ago,Metro Manila,Developers/Programmers (Information &amp; Communication Technology),Full time,"<p><strong>Code Healthier Futures with Every Line</strong></p><p>Use your full stack development skills to transform the future of&nbsp;<strong>healthcare technology.</strong>&nbsp;Build high-performance systems that support real-world health outcomes and leave a lasting global impact—right from home.</p><p>Here’s your chance to join a forward-thinking healthcare tech team without compromising work-life balance. With a fixed day shift and weekends off, you’ll enjoy the freedom to pursue a global career in tech while still having time for the things that matter most.</p><p><strong>Job Description</strong></p><p>As a&nbsp;<strong>Senior Full Stack Developer,</strong>&nbsp;you’ll write, optimize, and debug software in multiple languages, build scalable systems, manage databases, support integration and security, and collaborate with stakeholders to create innovative healthcare solutions.</p><p><strong>Job Overview</strong></p><p>Employment type: Full-time</p><p>Shift: Day Shift, Monday to Friday, 08:00 AM – 05:00 PM (Weekends off)</p><p>Work setup: Permanent Work-from-Home</p><p><strong>Exciting Perks Await!</strong></p><ul><li><p>HMO coverage with free dependent upon regularization</p></li><li><p>Competitive Salary Package</p></li><li><p>Permanent WFH arrangement</p></li><li><p>Day shift schedule</p></li><li><p>Fixed weekends off</p></li><li><p>Unlimited upskilling through Emapta Academy courses (Want to know more? Visit&nbsp;https://bit.ly/EmaptaTrainingCalendar)</p></li><li><p>Free 24/7 access to our office gyms (Ortigas and Makati) with a free physical fitness trainer</p></li><li><p>Exclusive Emapta Lifestyle perks (hotel and restaurant discounts, and more!)</p></li><li><p>Unlimited opportunities for employee referral incentives across the organization</p></li><li><p>Standard government and Emapta benefits</p></li><li><p>Total of 20 annual leaves to be used at your own discretion (including 5 credits convertible to cash)</p></li><li><p>Fun engagement activities for employees</p></li><li><p>Mentorship and exposure to global leaders and teams</p></li><li><p>Career growth opportunities</p></li><li><p>Diverse and supportive work environment</p></li></ul><p><strong>The Qualifications We Seek</strong></p><ul><li><p><strong>Bachelor’s Degree in Computer Science, Information Technology</strong>, or related field</p></li><li><p>Relevant certifications in programming or IT preferred</p></li><li><p>Minimum of&nbsp;<strong>5 years of experience in full stack development</strong></p></li><li><p>Proficient in&nbsp;<strong>C#, .NET Framework, ASP.NET, HTML, CSS, JavaScript,</strong>&nbsp;and related frameworks</p></li><li><p>Strong understanding of object-oriented programming and design patterns</p></li><li><p>Experience with&nbsp;<strong>Microsoft SQL Server and CLR</strong></p></li><li><p>Familiar with TFS, automated testing, and continuous integration practices</p></li><li><p>Business intelligence experience is desirable</p></li><li><p>Strong written and verbal English communication skills</p></li><li><p>Willing to work on a night shift, if required</p></li><li><p>Must meet performance metrics and current job expectations</p></li></ul><p><strong>Your Daily Tasks</strong></p><ul><li><p>Develop programs using various languages including C++, C#, .NET, PHP, Java, JavaScript, SQL, Python, and other company-used technologies</p></li><li><p>Update and enhance existing applications to improve functionality and performance</p></li><li><p>Debug and test programs to identify and fix errors</p></li><li><p>Utilize computer-assisted software engineering (CASE) tools to automate code generation</p></li><li><p>Leverage code libraries to streamline development and ensure efficiency</p></li><li><p>Perform software maintenance and error detection</p></li><li><p>Execute database queries and manage programmability tasks</p></li><li><p>Provide software support and troubleshooting assistance</p></li><li><p>Prepare system documentation and user manuals</p></li><li><p>Submit monthly reports to the IT Manager</p></li><li><p>Generate ad-hoc reports based on stakeholder requests</p></li><li><p>Implement and manage software security measures</p></li><li><p>Develop using C# and .NET Framework with strong understanding of their ecosystems</p></li><li><p>Work at a senior level with ASP.NET, HTML, CSS, JavaScript, and frameworks such as Angular, Node.js, and JQuery</p></li><li><p>Apply object-oriented programming principles effectively</p></li><li><p>Create reusable libraries and APIs to enhance modular development</p></li><li><p>Utilize various design and architectural patterns</p></li><li><p>Work with Microsoft SQL Server for database management</p></li><li><p>Write clean, readable, and maintainable code</p></li><li><p>Apply design principles to build scalable applications</p></li><li><p>Create database schemas that support business processes</p></li><li><p>Understand Common Language Runtime (CLR), including its limitations and workarounds</p></li><li><p>Implement automated testing platforms and conduct unit testing</p></li><li><p>Use code versioning tools, especially TFS</p></li><li><p>Apply continuous integration practices</p></li><li><p>Contribute to projects involving business intelligence, where applicable</p></li></ul><p><strong>About the Client</strong></p><p><strong>Rest Assured, Innovation Never Sleeps</strong></p><p>Our client, SomnoMed, is&nbsp;<strong>a global leader in oral appliance therapy</strong>&nbsp;for the treatment of obstructive sleep apnea. With a commitment to innovation and patient-centric solutions, they support better sleep and better lives through technology-enabled healthcare. They are now expanding their development team to scale their digital solutions.</p><p><strong>Welcome to Emapta Philippines!</strong></p><p>Join a team that values camaraderie, excellence, and growth. Recognized as&nbsp;<strong>one of the Top 20 Dream Companies of Filipinos in 2024,</strong>&nbsp;Emapta stands proudly alongside industry giants, offering stability and exciting career opportunities. Your career flourishes here with competitive compensation, international clients, and a work culture focused on collaboration and innovation. Work with global clients across industries, supported by a stable foundation and like-minded professionals passionate about making an impact. We empower your success with opportunities for personal and professional development in an inclusive environment. Apply now and be part of the #EmaptaEra!</p>"
20,Senior Fullstack Developer (Python/Odoo),https://ph.jobstreet.com/job/83050019?type=standard&ref=search-standalone&origin=cardTitle#sol=76788610d234a952342a6ba6dde0f2ba10405166,iSupport Worldwide,7d ago,"Ortigas, Pasig City, Metro Manila",Developers/Programmers (Information &amp; Communication Technology),Full time,"<p>Be a part of our fast-growing team and unchain all the possibilities!<br><br>&nbsp;</p><h2><strong>What is your mission?</strong></h2><p>We are looking for a <strong>Senior Fullstack Developer for Odoo and Python</strong>. In this role, you will be responsible for the development, customization, and maintenance of Odoo modules, as well as the integration of AI-driven solutions to enhance business processes. You will work closely with the IT Director and collaborate with various teams to implement solutions that align with our company’s objectives and technological goals.</p><p><strong>You will provide the best service to our partner client by performing these tasks:</strong></p><ul><li>Design, develop, and customize Odoo modules to meet business requirements.</li><li>Integrate AI technologies with Odoo for process automation, predictive analytics, and improved decision-making.</li><li>Partner with DevOps and IT teams for the deployment and maintenance of Odoo systems.</li><li>Troubleshoot and resolve issues and bugs related to Odoo.</li><li>Document technical designs, processes, and changes in code.</li><li>Provide continuous support for system improvements, including AI-driven features.</li><li>Contribute to system analysis and design, utilizing AI insights.</li><li>Stay informed about the latest advancements in AI, machine learning, and ERP systems.</li></ul><p>&nbsp;</p><h2><strong>Who are we looking for?</strong></h2><ul><li>Bachelor’s degree in Computer Science, Information Technology, or a related field.</li><li>At least 5 years of experience in Python or Odoo development and implementation.</li><li>Proven expertise in AI technologies such as machine learning, natural language processing, or predictive analytics.</li><li>Strong proficiency in Python and the Odoo framework.</li><li>Familiarity with PostgreSQL, XML, JavaScript, and other Odoo technologies.</li><li>Solid experience in the full Software Development Life Cycle (SDLC).</li><li>Knowledge of AI tools and frameworks like TensorFlow, PyTorch, or OpenAI.</li><li>Exceptional problem-solving abilities and analytical thinking.</li><li>Must be available for full-time, onsite work in Ortigas, Pasig City.</li><li>Strong communication skills for effective collaboration with cross-functional teams and clients.</li><li>A collaborative mindset and a passion for teamwork.</li><li>Experience with Agile methodologies is a plus.</li></ul><p>&nbsp;</p><h2><strong>Company Perks</strong></h2><ul><li>Above-industry salary package and incentives</li><li>Comprehensive HMO benefits and life insurance from day 1</li><li>Free learning and development courses for your personal and career growth</li><li>Dynamic company events</li><li>Opportunities for promotion</li><li>Free meals and snacks</li></ul>"
21,Data Engineer,https://ph.jobstreet.com/job/83097417?type=standard&ref=search-standalone&origin=cardTitle#sol=6ab9333b7a99e84e2bfb2f9de4dda602a6eed5c4,EY GLOBAL DELIVERY SERVICES (GDS) PHILIPPINES,5d ago,Metro Manila,Engineering - Software (Information &amp; Communication Technology),Full time,"<p><strong>The opportunity</strong></p><p>We’re looking for a Senior with expertise as a Data Engineer to join the EY GDS Data and Analytics Team. This&nbsp;is a fantastic opportunity to be part of a leading firm whilst being instrumental in the growth.<br>&nbsp;</p><p><strong>To qualify for the role, you must have</strong></p><p>• At least 3 years of experience in developing data ingestion, data processing, and analytical pipelines&nbsp;<br>for big data, relational databases, NoSQL, and data warehouse solutions&nbsp;<br>• Extensive hands-on experience implementing data migration and data processing<br>• Hands on experience in Big&nbsp;Data or Cloud Data - Spark, Snowflake, Kafka, Hive, Azure Data Factory, Databricks, AWS, GCP, Lambda<br>• Hands on experience in programming like Python, Scala, and Hadoop – nice to have&nbsp;<br>• Well versed in DevSecOps and CI/CD deployments – nice to have&nbsp;<br>• Must have hands on experience in SQL and procedural SQL languages -&nbsp;<br>• Experience working with NoSQL in at least one of the data stores - HBase, Cassandra, MongoDB –&nbsp;nice to have&nbsp;<br>• Strong analytical skills and enjoys solving complex technical problems&nbsp;<br>• Proficiency in Software Development Best Practices&nbsp;<br>• Strong analytical skills and enjoys solving complex technical problems&nbsp;<br>• Excellent debugging and optimization skills&nbsp;<br>• Experience in Enterprise grade solution implementations &amp; in converting business&nbsp;problems/challenges to technical solutions considering security, performance, scalability, etc.</p><p><br><strong>What we look for</strong></p><p>• A Team of people with commercial acumen, technical experience and enthusiasm to learn new things&nbsp;in this fast-moving environment with consulting skills.&nbsp;<br>• An opportunity to be a part of market-leading, multi-disciplinary team of 1400 + professionals, in the&nbsp;only integrated global transaction business worldwide.&nbsp;<br>• Opportunities to work with EY Consulting practices globally with leading businesses across a range of&nbsp;industries.</p>"
22,Software Engineer,https://ph.jobstreet.com/job/82609090?type=standard&ref=search-standalone&origin=cardTitle#sol=0981b4535f8ae050a5e4d94ae3aa73d104d83462,"KYOCERA Document Solutions Development Philippines, Inc.",3d ago,"Cebu City, Cebu",Developers/Programmers (Information &amp; Communication Technology),Full time,"<p><strong>KYOCERA DOCUMENT SOLUTIONS DEVELOPMENT PHILIPPINES, INC.</strong></p><p>Is currently looking for:</p><p>&nbsp;</p><p><strong>SOFTWARE ENGINEER</strong></p><p>&nbsp;</p><p><strong>Role(s):</strong></p><ul><li>Firmware Engineer</li><li>Java Developer</li><li>Mobile Developer</li><li>UI/UX Developer</li><li>Web Developer</li><li>Windows Application Engineer</li></ul><p><strong>We offer:</strong></p><ul><li>One-time signing bonus (for experienced new hires)</li><li>Hybrid onsite and work-from-home schedule</li></ul><p><strong>Summary of responsibility:</strong></p><p>&nbsp;</p><p>Designs and develops software products including applications, and utilities that promote the sales of KYOCERA Document Solution printers and digital copier products worldwide.</p><p>&nbsp;</p><p>The project member performs various technical tasks for development for KYOCERA Document Solutions devices and PC software.</p><p>&nbsp;</p><p><strong>Core responsibilities:</strong></p><ul><li>Responsible for the software planning, design, implementation, progress, and quality delivery</li><li>Understands project requirements, change requirements, and execution of end-to-end traceability</li><li>Review requirements, design, source code, test specification, and products deliverables</li><li>Executes configuration plan and reports any problem related to configuration</li><li>Reports risks/issues and supports execution of preventive measures/countermeasures</li><li>Executes unit and white box testing. Reports, monitors, and fixes for any identified issues</li><li>Collaborate with System Evaluation and Quality Assurance Team</li></ul><p>&nbsp;</p><p><strong>Requirements:</strong></p><ul><li>Graduate of Bachelor of Science in Computer Science, Information Technology, Computer Engineering, Electronics and Communications/Electronics Engineering, Math, Physics, and other engineering or computer-related courses.</li><li>Preferably with related software development experience, but not necessary</li><li>Must have any of the following technical skills;</li><li>C/C+, Linux system programming, Image processing, basic electronics, and UML. Java 8, Objective C/Swift, Java/Kotlin, and C/C++. Angular, C#, and .Net Core Framework, C#, .Net Core Framework, and</li><li>Windows Programming. Photoshop, Illustrator, and Invision.</li><li>Good to have any of the following technical skills</li><li>QT Library, Java, HTML, CSS, JavaScript, Network Protocol (SOAP, HTTP, SNMP), Page Description Language (PDL). Linux, WS-SOAP, Win3. Adobe XD, Figma, and Sketch</li><li>Strong interpersonal and communication skills</li><li>A team player and highly collaborative</li><li>Proficient in research, reporting, and presentation</li><li>Enjoys analyzing and problem-solving skills</li><li>Creative and has a passion for innovation</li></ul><p>&nbsp;</p>"
23,R0005686: Fullstack Development Engineer,https://ph.jobstreet.com/job/82482187?type=standard&ref=search-standalone&origin=cardTitle#sol=9136d156a99d65699c96ff89f760f8a0e3baae5a,TREND MICRO INCORPORATED-PHILIPPINE BRANCH,29d ago,"Pasig City, Metro Manila",Developers/Programmers (Information &amp; Communication Technology),Full time,"<p><strong>Overview</strong></p><p>&nbsp;</p><p>The role of a Fullstack Developer is to design, develop, and maintain well-structured and efficient codes for both front-end and back-end components of web applications.</p><p>&nbsp;</p><p><strong>What you’ll do</strong></p><ul><li>Develop well-structured, efficient, and maintainable code for both front-end and back-end components.</li><li>Implement and maintain database architecture and design, ensuring optimal performance.</li><li>Develop security backend service on the public cloud. (AWS, Azure ) by using the best practices of current cloud computing solution</li><li>Participate in the development and maintenance of highly scalable and stable Web service</li><li>Assure code quality to ensure service viability</li></ul><p>&nbsp;</p><p><strong>What you need</strong></p><ul><li>At least (3) years of relevant work experience.</li><li>Advanced level programming, architecture design, and troubleshooting skills of a Web application in Python, Java or GoLang on Linux platform</li><li>Knowledge of multiple front-end languages and libraries (e.g. , JavaScript, ES6+, React, Typescript)</li><li>Build the front-end of applications through appealing visual design</li><li>Write effective Restful APIs</li><li>Professional knowledge of container and cluster management tools (Kubernetes, Docker)</li><li>Experience with cloud development (AWS, Azure)</li><li>Strong problem-solving skill and customer-centric mindset</li><li>Willing to be trained and be temporarily assigned overseas</li></ul><p>&nbsp;</p><p><strong>What will help</strong></p><ul><li>Experience with microservice architecture is a plus.</li><li>Familiar with a relational database or NoSQL database. Ex. Redis, Hadoop, Cassandra, ElasticSearch or MySQL</li><li>Good communication skill and proactive mindset on global team collaboration</li></ul><p>&nbsp;</p><p>&nbsp;</p>"
