title,company,link,job_desc,job_func,location,job_type,source
Finance Management Trainee | Makati,MedGrocer,https://www.kalibrr.com/c/medgrocer/jobs/250407/finance-management-trainee-makati,"MedGrocer's digitally-enabled wellness and population health programs, telehealth and medical services, and onsite medical staff work with hundreds of pharma companies and employers to improve the physical and mental health of over one million Filipinos every year.Here at MedGrocer, you will contribute to innovative healthcare solutions that enhance accessibility and efficiency. Collaborate with a diverse team on impactful projects that improve lives while fostering your personal and professional growth.The Finance Management Trainee collaborates with various departments to support financial operations and enhance the overall efficiency of financial processes.Key Responsibilities 	Establish a thorough understanding of operational processes and systems relating to finance	Identify and implement process and system improvements	Manage day-to-day operations relating to finance, accounting, and procurement	Manage, train, and provide learning and growth opportunities to the team	Address, investigate, and resolve major operational concerns	Manage databases and monitor key performance indicatorsPerks and Benefits	HMO for employees	Paid leaves	Medicine coupons	Opportunities for promotion and performance bonuses	13th month payMedGrocer's digitally-enabled wellness and population health programs, telehealth and medical services, and onsite medical staff work with hundreds of pharma companies and employers to improve the physical and mental health of over one million Filipinos every year.Here at MedGrocer, you will contribute to innovative healthcare solutions that enhance accessibility and efficiency. Collaborate with a diverse team on impactful projects that improve lives while fostering your personal and professional growth.The Finance Management Trainee collaborates with various departments to support financial operations and enhance the overall efficiency of financial processes.Key Responsibilities 	Establish a thorough understanding of operational processes and systems relating to finance	Identify and implement process and system improvements	Manage day-to-day operations relating to finance, accounting, and procurement	Manage, train, and provide learning and growth opportunities to the team	Address, investigate, and resolve major operational concerns	Manage databases and monitor key performance indicatorsPerks and Benefits	HMO for employees	Paid leaves	Medicine coupons	Opportunities for promotion and performance bonuses	13th month pay	Bachelor's degree in Accountancy, Economics, Financial Management, Management, or business-related course;	Preferably with finance, management, procurement, and leadership experience;	Knowledge in Google Workspace applications;	Open to fresh graduates and experienced professionals;	Must work onsite in MakatiHire NowSign UpLogin",Accounting & Auditing,"Makati City, National Capital Region (NCR)",Full-time,Kalibrr
Resource Management Intern,YONDU INC.,https://www.kalibrr.com/c/yondu-inc/jobs/252180/resource-management-intern,"Resource Management:	Provide general administrative support to the Talent Management Team, including:	Tech Pool Tracker Management	Grievance creation, routing, and monitoring	Monitoring, auditing, and reviewing documentation and track lists related to employee movements (roll-off, absorption, redundancies, transfers, etc.)	Timekeeping review, follow-up, and coordination with employees and other stakeholders.	Talent review, assessments, and surveys.	Building of Skills Inventory based on available trackers and references.​​​​​​​Other:	Perform other HR ad hoc tasks as needed.Resource Management:	Provide general administrative support to the Talent Management Team, including:	Tech Pool Tracker Management	Grievance creation, routing, and monitoring	Monitoring, auditing, and reviewing documentation and track lists related to employee movements (roll-off, absorption, redundancies, transfers, etc.)	Timekeeping review, follow-up, and coordination with employees and other stakeholders.	Talent review, assessments, and surveys.	Building of Skills Inventory based on available trackers and references.​​​​​​​Other:	Perform other HR ad hoc tasks as needed.	Education: Bachelor's Degree in Psychology, Human Resource Management, or equivalent.	Experience: Proven experience as a Staffing Coordinator or similar role; Experience in planning and executing HR plans (onboarding, hiring, etc.).	Knowledge: Knowledge of staffing policies, procedures, and best practices.	Soft Skills:			Outstanding organizational and leadership skills.		Excellent communication and interpersonal abilities.		Demonstrated reliability and respect for confidentiality.		Hire NowSign UpLogin",Human Resources,"Taguig City, National Capital Region (NCR)",Full-time,Kalibrr
Office Trainee,"Credit Pilipinas, Inc.",https://www.kalibrr.com/c/credit-pilipinas-inc/jobs/222600/office-trainee,"Create and maintain relationships with clients, business partners, vendors, etc... - you will be one of their first points of contact!	Manage inquiries through phone, social media, and email.	Screen new client applications	Keep detailed records.	Draft documents and contracts.	You will train under different departments.	Be a dynamic part of the team, as a small company - you'll wear different hats and have the opportunity to really learn the business inside out!	Create and maintain relationships with clients, business partners, vendors, etc... - you will be one of their first points of contact!	Manage inquiries through phone, social media, and email.	Screen new client applications	Keep detailed records.	Draft documents and contracts.	You will train under different departments.	Be a dynamic part of the team, as a small company - you'll wear different hats and have the opportunity to really learn the business inside out!	College graduate;	Excellent interpersonal skills;	Detail oriented;	Self-starter and independent;	Eager to learn;	Responsible and  can work with minimal supervision;	Honest and trustworthy;	Computer literate	Fluency in English and Filipino;	College graduate;	Excellent interpersonal skills;	Detail oriented;	Self-starter and independent;	Eager to learn;	Responsible and  can work with minimal supervision;	Honest and trustworthy;	Computer literate	Fluency in English and Filipino;Hire NowSign UpLogin",Administration and Coordination,"Pasig City, National Capital Region (NCR)",Full-time,Kalibrr
Management Trainee,Consistent Frozen Solutions Corporation,https://ph.jobstreet.com/job/82904698?type=standard&ref=search-standalone&origin=cardTitle#sol=3e3e8e933a7442dc95681c61879bfdb04e787da0,"BRIEF DESCRIPTION&nbsp;The Management Training Program is a 6-month comprehensive training initiative that will equip our Management Trainees with necessary knowledge and skill sets to become future specialists and leaders of the organization.&nbsp;There are 2 tracks to the MT Program namely: Product Category Management, and Business Process. Each MT will go through each track and after the training period will be assigned to a department where his/her talents will be fully maximized.&nbsp;DUTIES AND RESPONSIBILITIES:Product Category ManagementConducts forecasting and demand planning to ensure availability of products and inventory at all times.Regularly collaborates with local and international procurement teams to match demand versus supply.Generates regular reports and performs data analysis to ensure KPIs are met including but not limited to right SKU mix and profitability.Conducts client research/interviews and industry research to support the department’s initiatives.Keeps abreast of industry movements and trends for the assigned category.Support in the preparation and deployment of technical training for other departments.&nbsp;Business Process ExcellenceWorks collaboratively with stakeholders to gather relevant information and insights to identify areas that require improvement.Applies data analysis techniques to measure process performance and identify opportunities for enhancement.Engages with teams from various departments to understand their specific process requirements and gather input for process improvement initiatives.Assists in documenting enhanced processes, including the creation of standard operating procedures (SOPs) and process flowcharts.Conducts time and motion studies, space planning and statistical analysis when needed.&nbsp;QUALIFICATIONS:Bachelor’s degree in Industrial Engineering, Chemical Engineering, Management Engineering, Agricultural Engineering, Agri - Business, Business Management/Administration, Economics, Mathematics or any related course.Strong analytical skills and attention to detailExcellent communication and interpersonal skillsAbility to work independently and collaboratively in a team environmentProficiency in Microsoft Office Suite (Excel, PowerPoint, Word)Strong problem-solving abilities and a proactive mindsetFresh graduates are welcome to apply",Sales,"Manila City, National Capital Region (NCR)",Full-time,Jobstreet
Accounts Management Assistant,Stradcom Corporation,https://www.kalibrr.com/c/stradcom-corporation-1/jobs/92787/accounts-management-assistant,"The jobholder contributes to the growth and profitability of Stradcom Corporation by ensuring the effective and efficient account management in terms of revenue collection and reporting of assigned connectivity account. The jobholder performs accounting works regularly which involves maintaining, preparing, posting and balancing of financial transactions, statements, records, documents and/or reports relative to connectivity projects of the company.Duties and Responsibilities	Prepares daily and periodical collection and revenue report of Business Connectivity projects;	Maintains accurate revenue records for informational and operation use;	Receives and documents payments and transactions from the Compliance Officer, Revenue Accountant, Accounting Specialist and Web Applications Development Officers;	Communicates with clients their account balances and payments and initiates disconnection from system due to unsettled accounts;	Entertains client inquiries regarding accounts-related matters and communicates with clients to establish good working relations;	Ensures timely transmittal of a statement of accounts, transaction summary reports and corresponding official receipts for the deposit made by clients;	Analyzes and reconciles revenue collection on a daily and monthly basis with the Accounting Department;	Generates and prepares other reports required by management; and,	Performs other job-related tasks that may be assigned by his/her superiors from time to time.The jobholder contributes to the growth and profitability of Stradcom Corporation by ensuring the effective and efficient account management in terms of revenue collection and reporting of assigned connectivity account. The jobholder performs accounting works regularly which involves maintaining, preparing, posting and balancing of financial transactions, statements, records, documents and/or reports relative to connectivity projects of the company.Duties and Responsibilities	Prepares daily and periodical collection and revenue report of Business Connectivity projects;	Maintains accurate revenue records for informational and operation use;	Receives and documents payments and transactions from the Compliance Officer, Revenue Accountant, Accounting Specialist and Web Applications Development Officers;	Communicates with clients their account balances and payments and initiates disconnection from system due to unsettled accounts;	Entertains client inquiries regarding accounts-related matters and communicates with clients to establish good working relations;	Ensures timely transmittal of a statement of accounts, transaction summary reports and corresponding official receipts for the deposit made by clients;	Analyzes and reconciles revenue collection on a daily and monthly basis with the Accounting Department;	Generates and prepares other reports required by management; and,	Performs other job-related tasks that may be assigned by his/her superiors from time to time.	B.S. in Accountancy / Management or Business Management related course	At least 1 year relevant experience	Proficient in Microsoft Office applications	Sales and presentation skills	Oral &amp; written communication	Interpersonal skills	Resourceful	Flexible / Adaptable	People and results oriented	Team player	Customer focus	Loyal to the organizationHire NowSign UpLogin",Administration and Coordination,"Quezon City, National Capital Region (NCR)",Full-time,Kalibrr
Management Analyst,"Global-Estate Resorts, Inc. (a subsidiary of Megaworld Corporation)",https://ph.jobstreet.com/job/83237924?type=standard&ref=search-standalone&origin=cardTitle#sol=95d6f2a8b8128eb4d55a716762e5588b19450624,"Job Description:Collect, organize, and analyze data and develop solutions or alternative methods about problems to be solved or procedures to be improvedCreate solutions or alternative practicesRecommend new procedures, or organizational changesEffectively communicate with others to ensure successful functioning of implemented proceduresQualifications:Graduate of any related 4-year courseFresh Graduates encouraged to applyHas good verbal and written communication skillsMust be a team player and detail-oriented",Sales,"Manila City, National Capital Region (NCR)",Full-time,Jobstreet
Management Trainee  for Sales and Corporate,TCL Sun Inc.,https://ph.jobstreet.com/job/82414513?type=standard&ref=search-standalone&origin=cardTitle#sol=5b97c01cb5bf2521a48b62defd402f2582b7fbf9,"Join the TCL Team and Shape the Future with Us!Are you an ambitious and driven individual ready to jumpstart your career in sales and corporate functions? We are looking for passionate&nbsp;Management Trainees&nbsp;to join our dynamic team and be part of a fast-paced environment where innovation meets opportunity!Why Join Us?Accelerated Career Growth: Fast-track your career with hands-on training and mentorship from industry leaders.Dynamic Work Environment: Be part of a forward-thinking team that values creativity, collaboration, and innovation.Comprehensive Learning: Gain practical experience across sales, corporate functions, and business operations.What We Offer:Competitive compensation and performance-based incentives.Mentorship from experienced professionals and leaders.Career advancement opportunities within our growing organization.A supportive and inclusive company culture.Your Role:As a&nbsp;Management Trainee – Sales &amp; Corporate, you will be exposed to:Departmental LearningRotated across multiple departments to gain in-depth knowledge of company processes and operations.&nbsp;Assist in day-to-day business activities, including planning, execution, and performance analysis.&nbsp;Shadow department managers and senior leaders to understand decision-making processes.&nbsp;&nbsp;2. Project Involvement &amp; Execution&nbsp;Participate in special projects, process improvements, and strategic initiatives.&nbsp;Conduct research and analysis to support business strategies and present key findings.&nbsp;Collaborate with cross-functional teams to deliver innovative solutions. &nbsp;&nbsp;3. Operational Support &amp; Efficiency&nbsp;Support operational tasks related to sales, logistics, finance, marketing, and other assigned functions.&nbsp;Ensured compliance with company policies and industry regulations.&nbsp;Identify areas for operational efficiency and recommend improvements. &nbsp;&nbsp;4. Reporting &amp; Data Analysis&nbsp;Collect and analyze data to generate insights for business decisions.&nbsp;Prepare reports, presentations, and performance reviews for management. &nbsp;5. Customer &amp; Market Engagement&nbsp;Assist in customer service, client relationship management, and stakeholder communication.&nbsp;Conduct market research and competitor analysis to identify business opportunities.&nbsp;6. Leadership &amp; Professional Growth&nbsp;Develop leadership, problem-solving, and decision-making skills through mentorship.&nbsp;Take on increasing responsibilities as the program progresses.&nbsp;Demonstrate TCL Sun’s values of&nbsp;Responsibility, Innovation, and a Pioneering Spirit.Qualifications &amp; Skills:&nbsp;Fresh graduates are highly encouraged to apply (Bachelor’s degree in Business, Marketing, Management, or related fields)Bachelor’s Degree in Business Administration, Marketing, &nbsp;Entrepreneurship, Finance, Logistics, Human Resources, or a related field.&nbsp;Strong analytical and critical-thinking abilities.&nbsp;Excellent communication and interpersonal skills.&nbsp;Analytical mindset with the ability to interpret data and market trends.Ability to adapt to dynamic environments and work under pressure.Proficiency in Microsoft Office (Excel, Word, PowerPoint).&nbsp;Adaptability and eagerness to learn in a fast-paced, dynamic environment&nbsp;To learn more about&nbsp;TCL Sun, Inc.&nbsp;and our commitment to innovation and excellence, visit&nbsp;www.tcl.com/ph/en/about-tcl.&nbsp;",Sales,"Manila City, National Capital Region (NCR)",Full-time,Jobstreet
Junior Operations Analyst,Institutional Shareholder Services Philippines Inc.,https://ph.jobstreet.com/job/83235034?type=standard&ref=search-standalone&origin=cardTitle#sol=c47b96d7c31cd91bd07ed88ecdd3f2ceb580312c,"Let’s be #BrilliantTogetherOverview:We are looking for Junior Operations Analyst to join our Securities Class Action Services (SCAS) Team in Manila! If you are willing to experience new things, welcomes challenges and creative thinking and has a positive attitude, then this role might be for you.Responsibilities:Import data received from claims administrators into proprietary systems and reconcile data for completeness and accuracy. Ensure comprehensive audit trails for claims filings and deficiency resolution.Communicate with claims administrators any discrepancies in data received and obtain any missing data to complete reconciliation.Ensure disbursement payments are received to claims filed and resolve any discrepancies.Document and submit claims for Securities Class Action Service filing clients. Organize daily workload to ensure that required filing deadlines are met.Monitor key performance indicators to ensure the integrity of assigned data management areas.Work with clients prior to and during the claims filing process to answer client questions related to cases and upcoming claims, and procure the necessary documentation to successfully complete filings and resolve deficiencies.Furnish clients with reports pertaining to their claims filing activity, upcoming claims, and disbursement information. Apply client specific customizations to reports as neededPerform account maintenance for clients.Work with internal holdings and client implementation teams to ensure that required client data is received in a timely and high quality manner.Build and enhance relationships with various groups in the industry (claims administrators, law firms, and custodians) to improve efficiency in claims filing and recognized loss calculations and improve the products and services offered to clients.Participate and lead custom projects.Work with development teams to enhance and test new products and back office system applications.Qualifications:&nbsp;Bachelor's degree in Business, &nbsp;Economics, Finance, Political Science, Accounting, or equivalentFamiliarity with common office software applications (Excel, Word, PowerPoint)Experience/interest in finance or law a plusExcellent oral and written communicationsTeam player and an excellent relationship builderSelf-motivated and drivenDemonstrated analytical skills with strong attention to detailDemonstrated Project Management skills – defining of scope, resources and time lines, and managing to deliverablesInformation technology skills (SQL, VB, programming, etc.) a plusEffective problem-solving and critical thinking skillsAbsolute personal and business integrityGood communication skills – comfortable and confident when speakingFRESH GRADUATES ARE ENCOURAGED TO APPLYWhat you can expect from usOur people are the moving force behind ISS. We are dedicated to hiring the best, most talented people in our industry and empowering them with the resources and support to enhance their career, health, financial and personal well-being.&nbsp;We are committed to fostering, cultivating, and preserving a culture of diversity and inclusion. We are invested in our people and are working every day to ensure a diverse, equitable, and inclusive workplace.Let’s empower, collaborate, and inspire one another.&nbsp;Let’s be #BrilliantTogether.&nbsp;About ISSISS empowers investors and companies to build for long-term and sustainable growth by providing high-quality data, analytics, and insight. We are committed to positively impacting the environment and society through our market-leading solutions and leading by example.Clients can access turnkey securities class-action claims management provided by Securities Class Action Services, LLC (SCAS). With close to three decades of experience, SCAS delivers a complete end-to-end global offering with offices worldwide and research and claims filing coverage in all countries supporting securities class actions and antitrust cases.Visit our website: https://www.issgovernance.com &nbsp;&nbsp;&nbsp;&nbsp;&nbsp;&nbsp;View additional open roles: https://www.issgovernance.com/join-the-iss-team/",Banking & Financial Services,"Makati City, National Capital Region (NCR)",Full-time,Jobstreet
DATA ANALYST (Open to Fresh Grads),Global Technological Trading Inc.,https://ph.jobstreet.com/job/82572116?type=standard&ref=search-standalone&origin=cardTitle#sol=272e699d1a8ccbb6c20e522da546f91b2802a776,"Global Tech is a distributor of realme products.Job Overview:We are seeking a highly skilled and empathetic &nbsp;Data Analyst to join our team. The ideal candidate will have a strong background in HR data analysis, operational support, and problem-solving, with the ability to communicate complex findings with clarity and empathy. In this role, you will be responsible for analyzing HR data, identifying issues, and working closely with employees to address their concerns.Responsibilities:Analyze and interpret HR data, including attendance, overtime, and leave records, to identify patterns and discrepancies.Use Excel and HRIS systems to generate reports, track employee metrics, and ensure data accuracy.Collaborate with HR teams to improve processes and resolve issues, contributing to operational efficiency and data-driven decisions.Provide clear, empathetic communication to employees regarding HR policies, attendance discrepancies, and other concerns.Identify root causes of HR-related issues and work to implement solutions that enhance both the employee experience and operational performance.Develop and maintain reports to track key HR performance indicators, such as attendance trends, overtime, and employee satisfaction.Assist in HR process improvements by providing actionable insights based on data analysis and employee feedback.Manage sensitive employee relations matters with care and professionalism, ensuring employees feel supported throughout the process.Required Qualifications:Bachelor’s degree in Human Resources, Business Administration, Data Analytics, or a related field.At least 3 years of experience in HR data analysis or HR operations roles, with a strong understanding of HR processes and systems.Proficiency in advanced Excel (Pivot Tables, VLOOKUP, Macros).Experience in analyzing and interpreting HR data, including employee attendance, leave, overtime, and performance metrics.Excellent communication skills, with the ability to communicate complex data findings in a clear, empathetic manner.Strong problem-solving abilities and a detail-oriented approach to managing HR issues.A collaborative mindset with the ability to work cross-functionally with HR teams and other departments.Okay to work onsite everyday in BGC, TaguigOpen for Fresh Graduates",Information Technology,"Manila City, National Capital Region (NCR)",Full-time,Jobstreet
MANAGEMENT TRAINEE (fresh graduates only),"Neltex Development Co., Inc",https://ph.jobstreet.com/job/83254562?type=standard&ref=search-standalone&origin=cardTitle#sol=3d7a3f97ecfff283416945c627ed256d6dbc5900,"• Bachelor's Degree in Business Administration in Marketing, Finance/Accounting, and Engineering• Open to Fresh &amp; recent graduates only.• Application is not more than 1 year after graduation.• Honor /achiever graduate is an advantage.• Supply Chain- graduate of any engineering course.• Finance &amp; Administration/Sales Division – graduate of Accountancy, Marketing &amp; business-related courses.• Willing to undergo the Management Trainee program immediately after graduation.• Willing to be assigned in Paranaque City (head office) or Dasmarinas Cavite (plant)&nbsp;- Management Trainee Program Curriculum under our Sales &amp; Marketing, Supply Chain and Finance and Admin division.",Construction,"Manila City, National Capital Region (NCR)",Full-time,Jobstreet
