title,company,link,job_desc,job_func,location,job_type,source
Junior Java Engineer (Open for Fresh Graduates),Security Bank,https://www.kalibrr.com/c/security-bank/jobs/242591/junior-java-engineer-open-for-fresh-graduates,"About the RoleThe Engineer is an individual contributor and is responsible for helping to drive the design, development, maintenance and improvement of SBC’s IT Software applications and platforms. S/He is expected to use leading-edge development practices and to leverage on cutting-edge technologies. How you’ll contribute	Supports the translation of user requirements from SBC's business team into JAVA software requirements to ensure the applications adequately meet their needs	Designs, develops, tests, debugs, maintains and improves JAVA-based IT business applications Develops JAVA-based software and tools in support of design, infrastructure and technology platforms, including operating systems, compilers, routers, networks, utilities, databases, cloud based and Internet related tools.	Scale SBC's JAVA-based IT services through mechanisms like automation, and evolve systems by motivating changes that improve reliability and velocity	Researches, trains and advocates novel technologies and tools to ensure the latest trends and developments are considered as part of SBC's IT infrastructure	Supports a positive and collaborative digital delivery culture with a philosophy of continuous improvement, development, innovation and excellence, while remaining in compliance with the bank's policies and procedures and upholding the highest standards of professional conduct	It is accepted and understood that the employee may perform other related tasks which may be assigned from time to time.About Security BankSecurity Bank is one of the Philippines’ best capitalized private domestic universal banks. Established in 1951 and publicly listed with the Philippine Stock Exchange (PSE:SECB) in 1995, our major businesses cover retail, corporate, commercial, and business (MSME) banking.We’re recognized as an Employer of Choice in Philippine banking by various award-giving bodies for our values-based culture, industry-leading engagement and benefits, and commitment to work-life balanceMost recently, we ranked as the #2 best employer in the Philippines and #54 globally on the prestigious Forbes’ World’s Best Employers 2023 list.At Security Bank, our approach to Human Capital Management (HCM) is embodied by our Employee Value Proposition (EVP): “YOU matter.” Start your BetterBanking career with us today.About the RoleThe Engineer is an individual contributor and is responsible for helping to drive the design, development, maintenance and improvement of SBC’s IT Software applications and platforms. S/He is expected to use leading-edge development practices and to leverage on cutting-edge technologies. How you’ll contribute	Supports the translation of user requirements from SBC's business team into JAVA software requirements to ensure the applications adequately meet their needs	Designs, develops, tests, debugs, maintains and improves JAVA-based IT business applications Develops JAVA-based software and tools in support of design, infrastructure and technology platforms, including operating systems, compilers, routers, networks, utilities, databases, cloud based and Internet related tools.	Scale SBC's JAVA-based IT services through mechanisms like automation, and evolve systems by motivating changes that improve reliability and velocity	Researches, trains and advocates novel technologies and tools to ensure the latest trends and developments are considered as part of SBC's IT infrastructure	Supports a positive and collaborative digital delivery culture with a philosophy of continuous improvement, development, innovation and excellence, while remaining in compliance with the bank's policies and procedures and upholding the highest standards of professional conduct	It is accepted and understood that the employee may perform other related tasks which may be assigned from time to time.About Security BankSecurity Bank is one of the Philippines’ best capitalized private domestic universal banks. Established in 1951 and publicly listed with the Philippine Stock Exchange (PSE:SECB) in 1995, our major businesses cover retail, corporate, commercial, and business (MSME) banking.We’re recognized as an Employer of Choice in Philippine banking by various award-giving bodies for our values-based culture, industry-leading engagement and benefits, and commitment to work-life balanceMost recently, we ranked as the #2 best employer in the Philippines and #54 globally on the prestigious Forbes’ World’s Best Employers 2023 list.At Security Bank, our approach to Human Capital Management (HCM) is embodied by our Employee Value Proposition (EVP): “YOU matter.” Start your BetterBanking career with us today.What we’re looking for	Fresh Graduate	Bachelor's degree in Computer Science, Computer Engineering or a related field.	With knowledge and experience in Java	Experience with popular Java frameworks such as Spring and Hibernate	Experience with object-oriented design and development	Experience with web development technologies such as HTML, CSS, and JavaScript Experience with databases and SQL	Experience with agile software development methodologies	Knowledge of design patterns and software architecture	Knowledge of continuous integration and deployment (CI/CD) practices	Experience with version control systems such as Git	Strong problem-solving and debugging skillsWhat we’re looking for	Fresh Graduate	Bachelor's degree in Computer Science, Computer Engineering or a related field.	With knowledge and experience in Java	Experience with popular Java frameworks such as Spring and Hibernate	Experience with object-oriented design and development	Experience with web development technologies such as HTML, CSS, and JavaScript Experience with databases and SQL	Experience with agile software development methodologies	Knowledge of design patterns and software architecture	Knowledge of continuous integration and deployment (CI/CD) practices	Experience with version control systems such as Git	Strong problem-solving and debugging skillsHire NowSign UpLogin",Information Technology,"Makati City, National Capital Region (NCR)",Full-time,Kalibrr
Pre-Renewal Presentation Associate - Open to Fresh Graduates (Start ASAP),Atos Information Technology Inc.,https://ph.jobstreet.com/job/82718379?type=standard&ref=search-standalone&origin=cardTitle#sol=78333f3573ab44367f8a5cddc8629100a4c7db05,"Shift Schedule: 24/7 Shifting Schedule&nbsp;Work Setup: Onsite&nbsp;Brief background: PRP process is an important step in the insurance renewal process and involves presentation of current or existing insurance plans of the client (both medical and non-medical), changes in their profiles and potential adjustments to their coverage. The associate/analyst is expected to produce error free PowerPoint Presentation (using client template) according to set requirements. Average handling time for 1 presentation is 360 minutes.&nbsp;&nbsp;Job requirements:&nbsp;Excellent command over English (comprehension and written).&nbsp;Analytical skills, keen to details and fast learner.&nbsp;MS Office – MS PowerPoint Presentation (mandated), MS Excel (basic).&nbsp;Fresh graduates with insurance background.&nbsp;24/5 rotational shifts (morning, mid and night shifts)",Administration & Office Support,"Manila City, National Capital Region (NCR)",Full-time,Jobstreet
Account Management Executive,IMPACT - Training / Marketing / Consulting,https://www.kalibrr.com/c/impact-training-and-consultancy/jobs/249324/account-management-executive-18,"The Account Management Executive communicates with food and store owners or partners to understand their needs to resolve complaints and prevent additional issues by proposing and implementing process improvements.• Build strong and lasting relationships with customer/partners based on trust and respect.• Liaise with internal departments to facilitate partner’s fulfillment and grow partners’ business and revenue through offering marketing promos and expansion.• Identify and understand partners’ business needs to be able to customize product offerings.• Expand partner merchants’ business by offering other products and services to further create partnership value.• Keep accurate and updated records of account related information.• Maintain updated knowledge of company products and services.The Account Management Executive communicates with food and store owners or partners to understand their needs to resolve complaints and prevent additional issues by proposing and implementing process improvements.• Build strong and lasting relationships with customer/partners based on trust and respect.• Liaise with internal departments to facilitate partner’s fulfillment and grow partners’ business and revenue through offering marketing promos and expansion.• Identify and understand partners’ business needs to be able to customize product offerings.• Expand partner merchants’ business by offering other products and services to further create partnership value.• Keep accurate and updated records of account related information.• Maintain updated knowledge of company products and services.		Has a bachelor's degree in business, marketing, or other related fields			Has excellent communication, presentation, and analytical skills			Highly adaptable and has strong problem-solving and decision-making skills			At least 6 months experience			Applicants must be willing to do heavy field work			Work Arrangement: onsite &amp; fieldwork			26k basic salary plus monthly incentives of 10-20k 	Hire NowSign UpLogin",Sales,"Pasig City, National Capital Region (NCR)",Full-time,Kalibrr
MANAGEMENT TRAINEE (Open to Fresh Graduates),Global Technological Trading Inc.,https://ph.jobstreet.com/job/82703018?type=standard&ref=search-standalone&origin=cardTitle#sol=48a3d5d69802cab8b848f3cdade4d7b7a35f3b4f,"Global Tech is a distributor of realme products.&nbsp;Qualifications:Fresh graduates from the top universities in the PhilippinesOpen to both Filipino and Filchi candidatesWilling to work in different provinces or their hometownsStrong interest in sales, retail, and channel managementUndergo comprehensive training at HQ officeRotate through various sales departments, including Retail, Channel Sales, etc.Gain hands-on experience in sales strategies, market expansion, and business operationsMandarin Speaker is a plus&nbsp;&nbsp;Location: Nationwide (Willing to be assigned to different provinces)&nbsp;",Sales,"Manila City, National Capital Region (NCR)",Full-time,Jobstreet
Accounting Associate (Open for Fresh Graduate) | Hybrid Setup,Infinit-O,https://ph.jobstreet.com/job/82749603?type=standard&ref=search-standalone&origin=cardTitle#sol=ae6e170621ece4ee6638cc463b312a14a1a4d999,"Basic Function:&nbsp;As a Cadet you will be part of the people being trained to become Financial Services Associate. In the program you are expected to learn about the parties in the financial market, learn the basic features of financial products including how these financial instruments are being used in the market including how basic reconciliation is prepared as a pre-trading exercise to know current holdings and current market value both at the security level and fund level.&nbsp;&nbsp;Specific Duties and Responsibilities:&nbsp;Attend Face to Face or Online Training Programs&nbsp;&nbsp;Read materials provided within the timeline given.&nbsp;Take the necessary exams and obtain passing scores in the exams given.&nbsp;&nbsp;Complete with assignments and participate in the activities done during the training.&nbsp;&nbsp;&nbsp;RequirementsEDUCATION, QUALIFICATION AND EXPERIENCE&nbsp;Candidate must possess at least a Bachelor’s/College Degree Accounting, Financial Management or similar courses ( With Diploma)&nbsp;English written and verbal communication skills at least B1 (CEFR)&nbsp;Have taken at least 12 units of basic accounting or have taken at least 6 units of Financial Management Subjects.&nbsp;Have Familiarity with Balance Sheet and Income Statement concepts.&nbsp;&nbsp;This is for ASAP start date. Devices will be provided to successful candidates&nbsp;",Accounting & Auditing,"Manila City, National Capital Region (NCR)",Full-time,Jobstreet
Data Analyst (Open to Fresh Grads),Home Credit Philippines,https://ph.jobstreet.com/job/83299151?type=standard&ref=search-standalone&origin=cardTitle#sol=4082e867105474695fe9a1e7b416769a48f7c463,"The primary role of the CRM Analyst is to optimize customer onboarding, engagement, retention, and loyalty, contributing to long-term growth and profitability of the organization. The role requires a deep technical, sales and risk understanding to design and implement strategies that will enable business growth by leveraging on customer data insights. &nbsp;&nbsp;About The JobWhat You’ll Do:&nbsp;Interpret data, analyze results, and provide ongoing reports Data analytics including development and maintenance of databasesCreate dashboards and adhoc analyses for business needsAcquire data from primary or secondary data sources and maintain databases/data systems Identify, analyze, and interpret trends or patterns in complex data sets Customer Journey MappingLocate and define new process improvement opportunities What You Need To Have:&nbsp;Open to fresh graduates or those with 1-2 years of experienceCoding knowledge regardless of languageExperience in business intelligence tools (ex. Power BI, Tableau)Proficiency in Microsoft Office SuiteStrong knowledge of and experience with databases (SQL etc.)&nbsp;&nbsp;What Can Set You Apart:Experience in financial lending business&nbsp;Job Perks You'll Enjoy:Permanent dayshift scheduleUp to 20% variable performance-based bonusHMO on Day 1 / HMO with dependentsAccess to mental health coverage and wellness partnersWellness Leave and Birthday Leave benefitsInternal Career MobilityOpportunity to work and train in our international offices&nbsp;Empower Filipinos with innovative financial solutions at Home Credit Philippines. Click Apply Now and join a company where there are #NoSmallRoles and everyone is important.At Home Credit Philippines, we believe that everyone has something special to offer. Our motto ""No Small Roles, Everyone is Important"" is at the heart of everything we do. We think diversity makes our company better and every single job and person here plays a big part in our success.We’re all about creating a welcoming place where everyone feels valued for who they are. This means we make sure that everyone, no matter their background or what they look like, gets a fair chance at jobs, training, and promotions.When it comes to hiring, everyone gets a fair look. It doesn’t matter where you’re from, what you believe, who you love, whether you have a disability, or any other or any other condition protected under Philippine laws. If you meet the job requirements, you have a chance to get the job.Come join us at Home Credit, where diversity fuels our innovation. Here, there are #NoSmallRoles and #EveryoneisImportant.&nbsp;#LI-IS1",Banking & Financial Services,"Manila City, National Capital Region (NCR)",Full-time,Jobstreet
Management Trainee - Open for Fresh Grads (URGENT HIRING!),Top Access Infinity Inc.,https://ph.jobstreet.com/job/83252981?type=standard&ref=search-standalone&origin=cardTitle#sol=d12d64bed13070d679cf1ac461f5ce364a0afdc7,"Job descriptionJob Duties and Responsibilities:Learn and assist in planning and implementing sales strategies.Conduct market research to identify sales opportunities and customer needs.Undergo training programs to understand the company’sProducts, services, and sales processes.Learn and practice negotiation, communication, and presentation skills.Prepare sales reports and analyze data to evaluate sales performance.Identify trends and provide feedback to improve strategies.Work with marketing, operations, and product teams to align sales strategies.Understand the company's overall workflow to contribute to organizational goals.Suggest improvements in sales processes based on observations and feedback.Stay updated on industry trends and competitor activities.Strong Analytical and planning skills.Competitor reporting and building good relationship with store OIC and dealersJob Qualifications:Knowledgeable in Microsoft and Excel ToolsPass Exam for Position and hit minimum requirements for position.Good Communication Skills and Responsible LeaderGood Skills in Leadership and ManagementCollege GraduateWork Location: METRO MANILABenefits:Company Christmas giftCompany eventsEmployee discountHealth insuranceOpportunities for promotion","Manufacturing, Transport & Logistics","Manila City, National Capital Region (NCR)",Full-time,Jobstreet
Data Analyst,"LENA - Lately, Everything Needs Analytics",https://www.kalibrr.com/c/twelve-baskets-analytics/jobs/251119/data-analyst-2,"As a Data Analyst, you are responsible for deriving insights and action points from data for specific business use cases or contexts. Tasks may include:	Univariate Statistical Analysis	Exploratory Data Analysis	Data Visualization and Storytelling	Statistical Modeling	Regression Analysis	Domain-related Analysis, i.e., Geospatial Analysis, Text Analysis, Timeseries Analysis, Market Basket Analysis, Etc.As a Data Analyst, you are responsible for deriving insights and action points from data for specific business use cases or contexts. Tasks may include:	Univariate Statistical Analysis	Exploratory Data Analysis	Data Visualization and Storytelling	Statistical Modeling	Regression Analysis	Domain-related Analysis, i.e., Geospatial Analysis, Text Analysis, Timeseries Analysis, Market Basket Analysis, Etc.	Bachelor’s degree in any of the related courses: Computer Science, Statistics, Mathematics, Physics, Business, Industrial Engineering, Operations Research	Experience or familiarity in Python, Github, Databases (e.g. Postgres, Redis, MongoDB, etc.)	Ability to do Statistical Analysis and Modeling	Familiarity in Exploratory Data Analysis	Familiarity with Data Storytelling	Bachelor’s degree in any of the related courses: Computer Science, Statistics, Mathematics, Physics, Business, Industrial Engineering, Operations Research	Experience or familiarity in Python, Github, Databases (e.g. Postgres, Redis, MongoDB, etc.)	Ability to do Statistical Analysis and Modeling	Familiarity in Exploratory Data Analysis	Familiarity with Data StorytellingHire NowSign UpLogin",Information Technology,"Pasig City, National Capital Region (NCR)",Full-time,Kalibrr
Mortgage Credit Analyst | Fresh Graduates | No Experience Needed,Mortgage Pros,https://ph.jobstreet.com/job/83228962?type=standard&ref=search-standalone&origin=cardTitle#sol=fee41cc241711e9c9695e0c6b5584e2d76b2c5e7,"About the businessWe're a multi-award-winning Australian mortgage brokerage home to 4 of the top 10 mortgage brokers in Australia, winner of the 2024 brokerage of the year (under five brokers) &amp; voted one of the top 25 mortgage brokerages of Australia. &nbsp;We're looking for the best of the best candidates to join our existing Philippines team &amp; become a superstar analyst committed to helping us achieve exceptional results for our customers.Benefits and perksDevelop a career in finance with a rapidly growing organisation that offers career progression &amp; leadership opportunities!Work in a small business with a young team &amp; start up culture. No office politics and lots of fun.Regular team outings such as lunches, dinners, escape rooms &amp; karaoke.Permanent Work From Home (WFH) allowed once first 6 to 12 months of training has been completed.&nbsp;All training is provided, and no experience is required! We have a supportive team that is there to help with your development every step of the way.Lateral movement across different departments,&nbsp;allowing you to find the role that best suits you!High-paying graduate role with HMO Intellicare coverage upon regularization (includes dependent/s)Ongoing remuneration review process with a potential exponential growth for high achievers (PHP 50,000 per month within 2 years)&nbsp;&nbsp;Generous leave entitlements: After 4 years tenure leave gradually increases to 20 days vacation &amp; 10 days sick.Skills and ExperienceNo experience is required!A bachelor’s degree is required in Mathematics, Commerce/Business, Accounting, IT, Finance, Engineering or any other STEM course from a top university.Highly meticulous with a strong attention to detail.Ability to find solutions analytically &amp; systematically to multi-faceted problemsAble to learn on their own and can quickly adapt to a fast-changing environmentA positive can-do attitude capable of taking and improving on constructive feedbackStrong reading comprehension required to accurately understand detailed policies &amp; manualsExcellent written and verbal English communication skillsTyping speed of 50 WPM or greaterMust be willing to work from Makati for up to the first 12 months so paid training can be successfully completedAbout the roleAlongside the broking team you will be required to timely &amp; accurately analyse, assess &amp; package new home and investment loan applications. Your tasks will include:Assessing &amp; packaging new home and investment loan applications that will be submitted to the bank.Analysing financial/supporting documents and providing a proposal to the broker team on which bank and product is most suitable for our customers.Organising valuations &amp; pricing requests through our support team.Running scenarios with the bank's management team and requesting exceptions to lending policy where required.Assisting our brokers with the bank's missing information requests, serviceability, extension approvals, and scenarios which then leads to obtaining approval of the loanAll applications must be made through Jobstreet (by Seek). Applicants who successfully make it to the next stage will receive an email within the next 1 to 2 business days.&nbsp;***Update 4th of April: We are still hiring and have filled 6 out of 10 available places!***",Banking & Financial Services,"Makati City, National Capital Region (NCR)",Full-time,Jobstreet
Order Management Specialist,WAGMI Solutions,https://www.kalibrr.com/c/stealth/jobs/246443/order-management-specialist,"Fluent in written and verbal English	At least two years of experience in customer or vendor support roles	Experience with freight shipping is a plus	Experience with e-commerce or dropshipping companies is a plus	Strong customer service skills, including prompt and clear communication, courtesy, and professionalism	Excellent attention to detail, as the role involves significant amounts of accurate data entry	Ability to multitask and efficiently switch between different responsibilities	Capable of handling a high volume of email and phone communication with vendors	Strong note-taking and follow-up skills, with the ability to track multiple ongoing tasks without losing important details	Can cope with a fast-paced work environment	Commitment to continuous improvement by recommending process enhancements to increase efficiency, accuracy, and scalability	Willingness to work the graveyard shift	Fluent in written and verbal English	At least two years of experience in customer or vendor support roles	Experience with freight shipping is a plus	Experience with e-commerce or dropshipping companies is a plus	Strong customer service skills, including prompt and clear communication, courtesy, and professionalism	Excellent attention to detail, as the role involves significant amounts of accurate data entry	Ability to multitask and efficiently switch between different responsibilities	Capable of handling a high volume of email and phone communication with vendors	Strong note-taking and follow-up skills, with the ability to track multiple ongoing tasks without losing important details	Can cope with a fast-paced work environment	Commitment to continuous improvement by recommending process enhancements to increase efficiency, accuracy, and scalability	Willingness to work the graveyard shift	Place orders with vendors via email and vendors’ online platforms	Manage and work in general office email inbox, responding to	vendors, handling escalations, recording updates in NetSuite, etc.	Generate UPS shipping labels and LTL freight BOLs for open POs	Fulfill orders in NetSuite with proper carrier and tracking information from vendors	Follow-up on open POs with vendors and carriers to ensure timely shipments and to notify customers if there are any delays	Monitor system alerts for errors, following up to identify and correct the error	Work with customers and vendors to manage all aspects of RMAs	Manage and respond to general customer inquiries and issues, managed in a HubSpot Support Ticket Queue	Place orders with vendors via email and vendors’ online platforms	Manage and work in general office email inbox, responding to	vendors, handling escalations, recording updates in NetSuite, etc.	Generate UPS shipping labels and LTL freight BOLs for open POs	Fulfill orders in NetSuite with proper carrier and tracking information from vendors	Follow-up on open POs with vendors and carriers to ensure timely shipments and to notify customers if there are any delays	Monitor system alerts for errors, following up to identify and correct the error	Work with customers and vendors to manage all aspects of RMAs	Manage and respond to general customer inquiries and issues, managed in a HubSpot Support Ticket QueueHire NowSign UpLogin",Customer Service,"Mandaluyong City, National Capital Region (NCR)",Full-time,Kalibrr
