title,company,link,job_desc,job_func,location,job_type,source
Finance Analyst,AboitizPower,https://www.kalibrr.com/c/aboitiz-power-corporation/jobs/141622/finance-analyst,"The position is responsible for providing consolidated financial reports and preparing financial models as tools for business decisions.It also includes providing assistance to the Business Units in the areas of Finance and Accounting, and in supporting the CFO in the review of the BU's financial results and tax strategies.	Prepares variance analysis and explanation of financial statements against prior year and budgets; and highlights key issues to the Finance Manager for comments, recommendations, and resolution.	Serves as support in financial planning and budgeting system, process, and activities needed by the BUs. Job Application Notice:We urge everyone to be vigilant against scams that involve fraudulent offers of employment with Aboitiz Power Corporation. Scammers are falsely claiming to be representatives of Aboitiz, offering jobs in exchange for recruitment fees. Aboitiz does not ask for money from our applicants at any point of the job application process.The position is responsible for providing consolidated financial reports and preparing financial models as tools for business decisions.It also includes providing assistance to the Business Units in the areas of Finance and Accounting, and in supporting the CFO in the review of the BU's financial results and tax strategies.	Prepares variance analysis and explanation of financial statements against prior year and budgets; and highlights key issues to the Finance Manager for comments, recommendations, and resolution.	Serves as support in financial planning and budgeting system, process, and activities needed by the BUs. Job Application Notice:We urge everyone to be vigilant against scams that involve fraudulent offers of employment with Aboitiz Power Corporation. Scammers are falsely claiming to be representatives of Aboitiz, offering jobs in exchange for recruitment fees. Aboitiz does not ask for money from our applicants at any point of the job application process.Experience:	At least 3 years relevant experience in a corporate environment or in an accounting firm, preferably with experience in preparing and presenting accounting reports and tax matters	Familiarity with Oracle and Hyperion, preferredEducation:	Bachelor's Degree graduateHire NowSign UpLogin",Accounting & Auditing,"Taguig City, National Capital Region (NCR)",Full-time,Kalibrr
Data Analyst,Peroptyx,https://www.kalibrr.com/c/peroptyx/jobs/248693/data-analyst,"At Peroptyx, we are looking for Data Analysts who will review mapping data for digital mapping applications. Your research capabilities will validate and ensure that the navigation of certain routes are accurate and safe.As part of this fully remote role, you will verify that business names and opening hours are correct. You will check that the distance from a starting point to an end destination is listed accurately resulting in better user experiences.With this job you can plan your days around this highly flexible working schedule, work weekends or late evenings, all from the comfort of your own office. The flexibility of our roles minimizes the impact on your daily routine.So, whether you are a student looking to earn as you learn, a retiree looking for a new challenge a part-time/full time professional or a work from home parent, Peroptyx has the right role for you! Benefits	Work up to 20 hours per week.	Earn a competitive rate of pay.	Avoid the long commute.	Work from the comfort of your home office.	Enjoy the flexibility of setting your own working hours!At Peroptyx, we are looking for Data Analysts who will review mapping data for digital mapping applications. Your research capabilities will validate and ensure that the navigation of certain routes are accurate and safe.As part of this fully remote role, you will verify that business names and opening hours are correct. You will check that the distance from a starting point to an end destination is listed accurately resulting in better user experiences.With this job you can plan your days around this highly flexible working schedule, work weekends or late evenings, all from the comfort of your own office. The flexibility of our roles minimizes the impact on your daily routine.So, whether you are a student looking to earn as you learn, a retiree looking for a new challenge a part-time/full time professional or a work from home parent, Peroptyx has the right role for you! Benefits	Work up to 20 hours per week.	Earn a competitive rate of pay.	Avoid the long commute.	Work from the comfort of your home office.	Enjoy the flexibility of setting your own working hours!Ideal Candidate	Fluent in English.	Excellent research skills.	Excellent local knowledge of The Philippines.	Good understanding and general knowledge of the geography and culture of The Philippines.	Analytical mindset.Job Requirements	Must be living in The Philippines for a minimum of 5 consecutive years.	Must pass an online open-book exam that can verify your full understanding of the material and concepts.	Must be willing to work a minimum of 10 hours and up to 20 hours per week depending on task availability.	Good working knowledge of search engines, map applications and familiarity with social media platforms.	Strong ability to learn, understand and apply multiple sets of different instructions.	All work must be of an independent nature.Ideal Candidate	Fluent in English.	Excellent research skills.	Excellent local knowledge of The Philippines.	Good understanding and general knowledge of the geography and culture of The Philippines.	Analytical mindset.Job Requirements	Must be living in The Philippines for a minimum of 5 consecutive years.	Must pass an online open-book exam that can verify your full understanding of the material and concepts.	Must be willing to work a minimum of 10 hours and up to 20 hours per week depending on task availability.	Good working knowledge of search engines, map applications and familiarity with social media platforms.	Strong ability to learn, understand and apply multiple sets of different instructions.	All work must be of an independent nature.Hire NowSign UpLogin",Administration and Coordination,"Quezon City, National Capital Region (NCR)",Contract/Temporary,Kalibrr
Management Trainee (Open to Fresh Graduates),Global Technological Trading Inc.,https://ph.jobstreet.com/job/83294342?type=standard&ref=search-standalone&origin=cardTitle#sol=f28482a1b4eaee0b304654cbd16e62b366da3992,"Global Tech is a distributor of realme products.&nbsp;Qualifications:Fresh graduates from the top universities in the PhilippinesOpen to both Filipino and Fil-chi candidatesWilling to work in different provinces or their hometownsStrong interest in sales, retail, and channel managementUndergo comprehensive training at HQ officeRotate through various sales departments, including Retail, Channel Sales, etc.Gain hands-on experience in sales strategies, market expansion, and business operations&nbsp;Location: Nationwide (Willing to be assigned to different provinces from Visayas to Mindanao)&nbsp;",Sales,"Manila City, National Capital Region (NCR)",Full-time,Jobstreet
Inventory Analyst,GINGERSNAPS Philippines,https://www.kalibrr.com/c/il-coniglio-bianco-corporation-gingersnaps/jobs/247554/inventory-analyst-3,"Join Our Team as an Inventory Analyst!Are you a detail-oriented professional with a passion for organization and analysis? Do you thrive in fast-paced environments and have experience in retail inventory management? We’re looking for an Inventory Analyst to join our team and make an impact!What You'll DoAs an Inventory Analyst, you’ll play a critical role in ensuring accurate and efficient inventory operations. Your key responsibilities include:Inventory Monitoring &amp; Scheduling	Oversee Yearly Store Physical Count Charges Summary and Pcount schedules (yearly/monthly).	Track monthly Physical Count status and manage permits for boutique/department store counts.Inventory Discrepancy Analysis &amp; Reporting	Monitor and report discrepancies pre- and post-Physical Count.	Generate comprehensive Physical Count analysis/discrepancy reports.Sales &amp; Inventory Management	Encode weekly/monthly sales and balance sales reports.	Review and update inventory concerns, including warehouse and clearance monitoring.Join Our Team as an Inventory Analyst!Are you a detail-oriented professional with a passion for organization and analysis? Do you thrive in fast-paced environments and have experience in retail inventory management? We’re looking for an Inventory Analyst to join our team and make an impact!What You'll DoAs an Inventory Analyst, you’ll play a critical role in ensuring accurate and efficient inventory operations. Your key responsibilities include:Inventory Monitoring &amp; Scheduling	Oversee Yearly Store Physical Count Charges Summary and Pcount schedules (yearly/monthly).	Track monthly Physical Count status and manage permits for boutique/department store counts.Inventory Discrepancy Analysis &amp; Reporting	Monitor and report discrepancies pre- and post-Physical Count.	Generate comprehensive Physical Count analysis/discrepancy reports.Sales &amp; Inventory Management	Encode weekly/monthly sales and balance sales reports.	Review and update inventory concerns, including warehouse and clearance monitoring.What We’re Looking For	Bachelor’s degree in Accountancy or Internal Audit.	At least 1 year in fashion retail.	Strong analytical and planning skills, keen attention to detail, and proficiency in analyzing inventory reports.	Familiarity with POS systems (not required). Work Arrangement	On-Site Only: Be ready to dive into the action at our workplace! Ready to take your career to the next level? Click Apply Now and be part of our journey to redefine fashion retail excellence!Hire NowSign UpLogin",Accounting & Auditing,"Pasig City, National Capital Region (NCR)",Full-time,Kalibrr
Data Management Lead,"Gardenia Bakeries Phils., Inc.",https://www.kalibrr.com/c/gardenia/jobs/253218/data-management-lead-2,"Key Responsibilities:	Leadership:		Lead and mentor a team of data management professionals, ensuring project success and fostering a collaborative environment.	Set team goals, provide feedback, and drive performance to meet organizational objectives.		Database Management:		Oversee the design, implementation, and maintenance of databases.	Ensure data integrity, security, and optimal performance across all database systems.		ETL Process Management:		Develop, optimize, and manage Extract, Transform, Load (ETL) processes to ensure accurate and timely data flow.	Address issues in ETL pipelines and maintain process documentation.		Data Warehouse Management:		Manage data warehouse infrastructure, including schema design, data modeling, and optimization for analytics and business intelligence.	Implement best practices for scalability and efficiency.		Collaboration:		Work closely with IT, analytics, and business units to understand data needs and develop tailored solutions.	Act as a subject matter expert in data management best practices.		Performance Optimization:		Identify and implement strategies to enhance data processing efficiency, scalability, and reliability.	Conduct performance tuning to improve system performance and response times.		Key Responsibilities:	Leadership:		Lead and mentor a team of data management professionals, ensuring project success and fostering a collaborative environment.	Set team goals, provide feedback, and drive performance to meet organizational objectives.		Database Management:		Oversee the design, implementation, and maintenance of databases.	Ensure data integrity, security, and optimal performance across all database systems.		ETL Process Management:		Develop, optimize, and manage Extract, Transform, Load (ETL) processes to ensure accurate and timely data flow.	Address issues in ETL pipelines and maintain process documentation.		Data Warehouse Management:		Manage data warehouse infrastructure, including schema design, data modeling, and optimization for analytics and business intelligence.	Implement best practices for scalability and efficiency.		Collaboration:		Work closely with IT, analytics, and business units to understand data needs and develop tailored solutions.	Act as a subject matter expert in data management best practices.		Performance Optimization:		Identify and implement strategies to enhance data processing efficiency, scalability, and reliability.	Conduct performance tuning to improve system performance and response times. 		Qualifications:		Bachelor’s degree in Computer Science, Information Technology, or a related field; Master’s degree is a plus.	Extensive experience in data management, including database management, ETL processes, data warehousing, and data architecture.	Proven leadership experience with the ability to lead and mentor teams.	Expertise in database technologies such as SQL Server, Oracle, MySQL, or PostgreSQL.	Proficiency with ETL tools like Informatica, Talend, or SSIS.	Solid experience with data warehouse design, modeling, and optimization.	Strong understanding of data governance frameworks and best practices.	Excellent communication and collaboration skills to work effectively with diverse stakeholders.	Strong analytical and problem-solving abilities with attention to detail.	Proven capability to manage multiple projects and deliver within deadlines.	Amenable to onsite work and extended working hours as needed.		Join our team and lead the transformation of our data infrastructure into a robust, efficient, and secure foundation for driving business success!	Hire NowSign UpLogin",Information Technology,"Biñan City, CALABARZON (Region IV-A)",Full-time,Kalibrr
GRC Analyst,Multisys Technologies Corporation,https://www.kalibrr.com/c/multisys-technologies-corporation/jobs/247042/grc-analyst,"Job Summary:A Governance, Risk and Compliance Analyst is responsible for assessing and documenting all requirements of the organization for realignment with certain standards, performing risk and posture assessments, and maintaining and updating the I.T and Cybersecurity policy of the organization. Duties and Responsibilities:	Perform other duties assigned to ensure the smooth functioning of the department and maintain the reputation of the organization as a viable business partner	Recommend programmatic and technical directions and operate with a high degree of independence in matters relating to the investigation, impact, and analysis of security incidents, decisions regarding risk, and measures for computer and network security	Operate with a high degree of independence with regard to project management activities, including development of project plans and budget/resource estimates.	Lead the development and implementation of the system-wide risk management function of the information security program to ensure information security risks are identified and monitored.	Internally assess, evaluate and make recommendations to management regarding the adequacy of the security controls for the Organization's information and technology systems.	Lead the system-wide information security compliance program, ensuring IT activities, processes, and procedures meet defined requirements, policies and regulations.	Develop and implement effective and reasonable policies and practices to secure protected and sensitive data and ensure information security and compliance with relevant legislation and legal interpretation.	Execute strategy for dealing with increasing number of audits, compliance checks and external assessment processes for internal/external auditors, PCI DSS, ISO27001, DPA	Interacts in both oral and written communications with all levels of System staff including; Computer center staff, developers and other ITS staff, campus technical staff, general counsel, auditors, and all System staff and students and technology vendors and contractors, in matters related to information security and security awareness materials.	Work as Internal Audit, Legal Department, H.R Department and outside consultants as appropriate on required security assessments and audits	Coordinate and track all information technology and security related audits including scope of audits, units involved, timelines, auditing agencies and outcomes. Work with auditors as appropriate to keep audit focus in scope, maintain excellent relationships with audit entities and provide a consistent perspective that continually puts the institution in its best light. Provide guidance, evaluation and advocacy on audit responses.	Familiarity with Incident Response, Business Continuity and Disaster Risk Management and PlanningJob Summary:A Governance, Risk and Compliance Analyst is responsible for assessing and documenting all requirements of the organization for realignment with certain standards, performing risk and posture assessments, and maintaining and updating the I.T and Cybersecurity policy of the organization. Duties and Responsibilities:	Perform other duties assigned to ensure the smooth functioning of the department and maintain the reputation of the organization as a viable business partner	Recommend programmatic and technical directions and operate with a high degree of independence in matters relating to the investigation, impact, and analysis of security incidents, decisions regarding risk, and measures for computer and network security	Operate with a high degree of independence with regard to project management activities, including development of project plans and budget/resource estimates.	Lead the development and implementation of the system-wide risk management function of the information security program to ensure information security risks are identified and monitored.	Internally assess, evaluate and make recommendations to management regarding the adequacy of the security controls for the Organization's information and technology systems.	Lead the system-wide information security compliance program, ensuring IT activities, processes, and procedures meet defined requirements, policies and regulations.	Develop and implement effective and reasonable policies and practices to secure protected and sensitive data and ensure information security and compliance with relevant legislation and legal interpretation.	Execute strategy for dealing with increasing number of audits, compliance checks and external assessment processes for internal/external auditors, PCI DSS, ISO27001, DPA	Interacts in both oral and written communications with all levels of System staff including; Computer center staff, developers and other ITS staff, campus technical staff, general counsel, auditors, and all System staff and students and technology vendors and contractors, in matters related to information security and security awareness materials.	Work as Internal Audit, Legal Department, H.R Department and outside consultants as appropriate on required security assessments and audits	Coordinate and track all information technology and security related audits including scope of audits, units involved, timelines, auditing agencies and outcomes. Work with auditors as appropriate to keep audit focus in scope, maintain excellent relationships with audit entities and provide a consistent perspective that continually puts the institution in its best light. Provide guidance, evaluation and advocacy on audit responses.	Familiarity with Incident Response, Business Continuity and Disaster Risk Management and Planning	2-3 years of advanced IT skills with high level of information security experience and expertise	Knowledge of information security risk management frameworks and compliance practices.	Knowledge of securing network technologies, client, and server operating systems.	Ability to develop security standards and guidelines based on best practices and industry standards	Experience responding to, analyzing, and communicating information security incidents	2 years of planning and managing security projects	Excellent interpersonal, communication, and presentation skills, including formal report writing experience	Understanding of common security standards and regulations relating to a higher education environment (e.g., PCI DSS, FERPA, ISO2700x, etc.)	2-3 years of advanced IT skills with high level of information security experience and expertise	Knowledge of information security risk management frameworks and compliance practices.	Knowledge of securing network technologies, client, and server operating systems.	Ability to develop security standards and guidelines based on best practices and industry standards	Experience responding to, analyzing, and communicating information security incidents	2 years of planning and managing security projects	Excellent interpersonal, communication, and presentation skills, including formal report writing experience	Understanding of common security standards and regulations relating to a higher education environment (e.g., PCI DSS, FERPA, ISO2700x, etc.)Hire NowSign UpLogin",Information Technology,"Paranaque City, National Capital Region (NCR)",Full-time,Kalibrr
AML/KYC Analyst (Open to Fresh Graduates),PricewaterhouseCoopers Consulting Services Philippines Co. Ltd.,https://ph.jobstreet.com/job/82950369?type=standard&ref=search-standalone&origin=cardTitle#sol=43216f1c6d744ac902dc6eefd64e92c04fae00f4,"About The TeamAt PwC South East Asia Consulting, we help businesses to work smarter and grow faster. We partner with our clients to build effective organisations, innovate and grow, reduce costs, manage risk and regulation and, leverage talent. Our aim is to support businesses in designing, managing and executing lasting beneficial change.&nbsp;PwC’s South East Asia Consulting practice provides a comprehensive range of professional services and experience to deliver large scale, cross territory transformation projects, wherever our clients need us to be – from strategy through to execution.&nbsp;About The RoleA KYC Analyst is primarily responsible for processing KYC profile in compliance to the client’s policies and procedures. This role includes:&nbsp;Conducting research and obtaining information from publicly available resources, screening entities for adverse news, sanctions or politically exposed persons.Process/prepare KYC profiles in accordance to the KYC policies and procedures of the client.Process cases based on the priorities set by the Team Leader, reworks and their KYC expiry dates.Information, documentation gathering and record retention of the evidence.Initiation of the CDD process and follow up, review of due dates.Apply the rework items flagged by the QCs.Actively participate in the daily team huddles.Monitor progress and status of assigned cases.Report/escalate operational, system and policy issues immediately.Reach the quality and production target.Work extensively with various teams across global locations to fulfill an entity’s KYC requirements as mandated by compliance and regulatory standards.Efficiently manage ad hoc tasks for effective project management.&nbsp;About YouOpen to work in RTO setup (from Mondays - Fridays) and can report to office in Makati City.Fresh graduates are highly encouraged to apply.Must be college graduate degree in Business Administration, Finance or Accountancy.Strong analytical skills and proactive attitude, with excellent communication skills.Ability to think out of the box and to be assertive in offering solutions to posed problems or situations.High flexibility and detail-orientation with the ability to multitask to meet constant business demands and priorities.Ability to think independently with strong communication skills to clearly and concisely articulate complex findings.Resilient to challenges and setbacks, enthusiastic and motivated to work in a fast-paced and high-pressure environment.Focused to meet delivery and quality targets.Intermediate knowledge in Microsoft Excel.",Banking & Financial Services,"Makati City, National Capital Region (NCR)",Full-time,Jobstreet
