title,company,link,job_desc,job_func,location,job_type,source
Virtual Medical Assistant (BSN/RN) - Remote (Start Date April 14),"MedSpecialized, Inc.",https://ph.linkedin.com/jobs/view/virtual-medical-assistant-bsn-rn-remote-start-date-april-14-at-medspecialized-inc-4200855476?position=13&pageNum=0&refId=xWVRL6YVXkA8sPx9O09ugQ%3D%3D&trackingId=FRX2tqKPJM0q03L2dPFyQg%3D%3D,"MedSpecialized, Inc. is looking for a Virtual Medical Assistant!About the Client: DrCatalystDrCatalyst (DrC) is a remote healthcare staffing organization that has over 250 billable staff from the Philippines servicing healthcare companies throughout America. We are looking for Energetic and Highly Fluent English speaking Healthcare Professionals to serve new and existing US Healthcare clinics as inbound and outbound clinical operators during the business hours of our respective clients. Throughout your career you will also get the opportunity to be trained on additional skills such as referral management, authorizations, medical records, prescription coordination, eligibility and benefits, HEDIS, and more.Work Schedule and Arrangement: Night shift, Remote set-upOffice Location: 8th floor Skyrise 4B Building, IT Park, Lahug, Cebu City, CebuResponsibilities: Answer inbound calls and help for scheduling, rescheduling, and clinic information Make outbound calls for patient appointment reminders, wellness checks, and more Supply EMR notes on all calls conducted looping in onsite personnel and providers Google Chat with online personnel, as well as separate chats with DRC team membersRequirements: A graduate of BS in Nursing Must have at least 6 months of BPO Healthcare account experience Excellent English proficiency with strong communication skills 25 wpm or faster Internet speed has to be at least 100 mbps Computer literacy (GMail, Google Sheets) Stable internet connection and a conducive work environment at home Physically fit to work in a BPO setting Willing to work during holidays and weekends Must be residing outside CebuSalary and monetary benefits (in PHP): Monthly salary of 20,000 - 30,000 New hire bonus of 5,000 Attendance bonus of 2,000Perks and other benefits: Paid Training Period All national Philippines and USA holidays are observed Paid time off—public holidays, vacation, and personal time off Robust and effective Government Benefits Administration Lactation breaks (for breastfeeding moms) Discounted optical services with our partner clinic Free lunch/dinner and unlimited coffee and ice cream daily (for on site employees) Free Health insurance with one (1) free dependent Free Life insurance Free Accident insurance Relocation allowance for new hires (from Outside Cebu) Company-sponsored outings Interest-based employee clubs (DOTA, Basketball, Dance, Music, Photography, Yoga) International travel opportunities (India and US office)Our Recruitment Process:Candidate Application FormGeneral AssessmentPhone ScreeningTechnical Interview (Virtual)Reference CheckJob OfferTrainingDisclaimer for salary ranges: Salary ranges may not be applicable to all. Depending on the level of experience, educational background and potential for growth seen during interviews, offers may go higher or lower.PRO TIP: prepare for that interview and impress the hiring managers!For more information about our company, visit our website: www.medspecialized.comPowered by JazzHRQQzv8VtYzK",Health Care Provider,"Cebu City, Central Visayas (Region VII)",Full-time,Linkedin
Virtual Medical Assistant (BSN/RN) - Remote (Start Date May 5),"MedSpecialized, Inc.",https://ph.linkedin.com/jobs/view/virtual-medical-assistant-bsn-rn-remote-start-date-may-5-at-medspecialized-inc-4200853795?position=27&pageNum=0&refId=xWVRL6YVXkA8sPx9O09ugQ%3D%3D&trackingId=QKj%2FbNUvp8DlUkDGGZlfQg%3D%3D,"MedSpecialized, Inc. is looking for a Virtual Medical Assistant!About the Client: DrCatalystDrCatalyst (DrC) is a remote healthcare staffing organization that has over 250 billable staff from the Philippines servicing healthcare companies throughout America. We are looking for Energetic and Highly Fluent English speaking Healthcare Professionals to serve new and existing US Healthcare clinics as inbound and outbound clinical operators during the business hours of our respective clients. Throughout your career you will also get the opportunity to be trained on additional skills such as referral management, authorizations, medical records, prescription coordination, eligibility and benefits, HEDIS, and more.Work Schedule and Arrangement: Night shift, Remote set-upOffice Location: 8th floor Skyrise 4B Building, IT Park, Lahug, Cebu City, CebuResponsibilities: Answer inbound calls and help for scheduling, rescheduling, and clinic information Make outbound calls for patient appointment reminders, wellness checks, and more Supply EMR notes on all calls conducted looping in onsite personnel and providers Google Chat with online personnel, as well as separate chats with DRC team membersRequirements: A graduate of BS in Nursing Must have at least 6 months of BPO Healthcare account experience Excellent English proficiency with strong communication skills 25 wpm or faster Internet speed has to be at least 100 mbps Computer literacy (GMail, Google Sheets) Stable internet connection and a conducive work environment at home Physically fit to work in a BPO setting Willing to work during holidays and weekends Must be residing outside CebuSalary and monetary benefits (in PHP): Monthly salary of 20,000 - 30,000 New hire bonus of 5,000 Attendance bonus of 2,000Perks and other benefits: Paid Training Period All national Philippines and USA holidays are observed Paid time off—public holidays, vacation, and personal time off Robust and effective Government Benefits Administration Lactation breaks (for breastfeeding moms) Discounted optical services with our partner clinic Free lunch/dinner and unlimited coffee and ice cream daily (for on site employees) Free Health insurance with one (1) free dependent Free Life insurance Free Accident insurance Relocation allowance for new hires (from Outside Cebu) Company-sponsored outings Interest-based employee clubs (DOTA, Basketball, Dance, Music, Photography, Yoga) International travel opportunities (India and US office)Our Recruitment Process:Candidate Application FormGeneral AssessmentPhone ScreeningTechnical Interview (Virtual)Reference CheckJob OfferTrainingDisclaimer for salary ranges: Salary ranges may not be applicable to all. Depending on the level of experience, educational background and potential for growth seen during interviews, offers may go higher or lower.PRO TIP: prepare for that interview and impress the hiring managers!For more information about our company, visit our website: www.medspecialized.comPowered by JazzHRfswK82mf3I",Health Care Provider,"Cebu City, Central Visayas (Region VII)",Full-time,Linkedin
Accounting Assistant,"Autohub Group of Companies, Inc.",https://www.kalibrr.com/c/global-city-auto-sales-inc-gcasi/jobs/247205/accounting-assistant-27,"Process invoices and daily transactions and expenses	Update and maintain accounting database with data entry and reports	Handle monthly and quarterly reports	Handle day-to-day accounting duties including Accounts Receivable and Accounts Payable	Process invoices and daily transactions and expenses	Update and maintain accounting database with data entry and reports	Handle monthly and quarterly reports	Handle day-to-day accounting duties including Accounts Receivable and Accounts Payable 	Candidates must possess a Bachelor’s Degree in Accountancy and/or Commerce/Business Administration major in Accounting Management, Accounting, Finance and Management.	At least one (1) year of related work experience	Willing to be assigned in Kalawaan, Pasig City 	Candidates must possess a Bachelor’s Degree in Accountancy and/or Commerce/Business Administration major in Accounting Management, Accounting, Finance and Management.	At least one (1) year of related work experience	Willing to be assigned in Kalawaan, Pasig CityHire NowSign UpLogin",Accounting & Auditing,"Pasig City, National Capital Region (NCR)",Full-time,Kalibrr
Dental Receptionist Assistant,CMZ Dental Supply and General Merchandise Company,https://ph.jobstreet.com/job/82822281?type=standard&ref=search-standalone&origin=cardTitle#sol=42df84286cb9baada8f6690eb193a4d4f507b01b,For immediate hireDo the usual tasks of a Receptionist &nbsp; &nbsp; &nbsp; &nbsp; &nbsp; &nbsp; &nbsp; &nbsp; &nbsp; &nbsp; &nbsp; &nbsp; &nbsp; &nbsp; &nbsp; &nbsp; &nbsp; &nbsp; &nbsp; &nbsp; &nbsp; &nbsp; &nbsp; &nbsp; &nbsp; &nbsp; &nbsp; &nbsp; &nbsp; &nbsp; &nbsp; &nbsp; &nbsp; &nbsp; &nbsp; &nbsp; &nbsp; &nbsp; &nbsp; &nbsp; &nbsp; &nbsp; &nbsp; &nbsp; &nbsp; &nbsp; &nbsp; &nbsp; &nbsp; &nbsp; &nbsp; &nbsp; &nbsp; &nbsp; &nbsp; &nbsp; &nbsp; &nbsp; &nbsp; &nbsp; &nbsp; &nbsp; &nbsp; &nbsp; &nbsp; &nbsp; &nbsp; &nbsp; &nbsp;Greeting and welcoming clients/patients &nbsp; &nbsp; &nbsp; &nbsp; &nbsp; &nbsp; &nbsp; &nbsp; &nbsp; &nbsp; &nbsp; &nbsp; &nbsp; &nbsp; &nbsp; &nbsp; &nbsp; &nbsp; &nbsp; &nbsp; &nbsp; &nbsp; &nbsp; &nbsp; &nbsp; &nbsp; &nbsp; &nbsp; &nbsp; &nbsp; &nbsp; &nbsp; &nbsp; &nbsp; &nbsp; &nbsp; &nbsp; &nbsp; &nbsp; &nbsp; &nbsp; &nbsp; &nbsp; &nbsp; &nbsp; &nbsp; &nbsp; &nbsp; &nbsp; &nbsp; &nbsp; &nbsp; &nbsp; &nbsp; &nbsp;RelatedM or F.  To be assigned in Quezon CityKnowledge in computer is an advantageGood communication skillApproachable,Administration & Office Support,"Manila City, National Capital Region (NCR)",Full-time,Jobstreet
Accounting Assistant,YourBookkeepersOnline (YBO),https://www.kalibrr.com/c/ybo-yourbookkeepers-online/jobs/253394/accounting-assistant,"Experience in Accounting Software is an advantage.	Will primarily handle recording and monitoring of accounts receivables and payables and other accounting related transactions.	Will handle ADMIN &amp; accounting transactions outside the office from time to time. 	Experience in Accounting Software is an advantage.	Will primarily handle recording and monitoring of accounts receivables and payables and other accounting related transactions.	Will handle ADMIN &amp; accounting transactions outside the office from time to time.	Candidate must be a graduate of BS Accountancy, or equivalent. Philippine CPA is an advantage.	At least 1 year working experience in Public Practice or in Finance Roles.	Fresh graduates/entry level applicants are still encouraged to apply.	Strong analytical and planning skills;	Good communication and presentation skills;	Excellent problem-solving skills;Hire NowSign UpLogin",Accounting & Auditing,"San Juan City, National Capital Region (NCR)",Full-time,Kalibrr
Medical Virtual Assistant,GoTeam,https://ph.linkedin.com/jobs/view/medical-virtual-assistant-at-goteam-4190361541?position=17&pageNum=0&refId=xWVRL6YVXkA8sPx9O09ugQ%3D%3D&trackingId=ZYDuUj0gfk7vfQhfoGOT8g%3D%3D,"Job Title: Allied Health Assistant/Case ManagerCompany: GOTEAMLocation and Workplace: Hybrid Setup - IT Park, Apas, Cebu CitySchedule: 6am-3pm (weekends off)Salary: 25k-50k (depending on experience)Summary: As an Allied Health Assistant at GOTEAM, you will support our Allied Health and Administration Teams to deliver impeccable clinical services, quality professional assessments, and holistic, proactive case management for individuals coping with complex injuries and disabilities.About the JobKey Duties:- Work shadowing and confirmation of client/participant information.- Reviewing and documenting medical history.- Maintaining client/participant records.- Conducting research to improve service delivery.- Supporting case management and clinical services.Skills and ExperienceEssential Skills:- Ability to work constructively with a diverse team across remote locations.- Proficient in Advanced Word and Excel, with experience using Case Management software.- Excellent written communication skills, including report compilation and editing.- Developed clinical skills with knowledge of injuries and disabilities.Qualifications:- Relevant tertiary qualifications and/or industry experience.- Developed clinical skills, knowledge of injuries and disabilities- An empathetic, clear, and positive professional communication style- Excellent computer skills: Advanced Word, Advanced Excel, experience using Case Management software- Excellent written communication skills, including compilation, editing, and refinement of complex reportsYour Benefits:- We don’t just give you a laptop, we give you an extra monitor—because two screens are better than one.- You’ll get HMO coverage from day one—not just for you, but also for a dependent (yup, private room benefits included).- Ever needed legal or financial advice? Well, now you and your family can access it—on us.- Salary finance platform for personal loans, because we’re here to help you, even with the tough stuff.- P1,000,000 life insurance coverage—because we’ve got your back.- Leave credits above industry standards, including additional client-specific leave entitlements.- The little things? We’ve got you covered: welcome gift, monthly lunch with CEO updates, talent nights, gratitude celebrations, and more.- And yes, how does a trip for two to Bali sound? Referral bonuses can take you there.""Your Family’s Benefits""- Mental health support for your family, 24/7, because we care about them too.- Preventive care like health education, diet counseling, and wellness sessions—available for four family members.- Free telemedicine for your family, because we know life doesn’t wait for appointments.- Personal invites to family events, with prizes up for grabs—because life is about more than just work.About UsCompany Name: GOTEAMAchievements:- Consistently raising the bar in employee engagement with an 85% score—leaving the global average of 23%, the US average of 33%, and even best practice organizations at 70% in the dust.- Certified as a Great Place to Work for four years running—because when you’re great, you just keep proving it.- Over 1,000 employees strong, with no plans to hit the brakes anytime soon.Culture:At GOTEAM, innovation isn’t just part of the job—it’s the job. We celebrate diversity, thrive on global perspectives, and create an environment where personal and professional growth isn’t a perk—it’s the norm. That 85% employee engagement score? It’s proof that we’re not just ahead of the pack—we’re redefining the pack.Mission:Our mission is bold and simple: provide 100,000 people with free AI certification through the Vjal Institute, fueling the future of innovation.Location:Headquartered in the Philippines, with ambitious plans to expand globally by 2025.#LI-DNI",Health Care Provider,"Cebu City, Central Visayas (Region VII)",Full-time,Linkedin
Buyers Assistant,Suitestudio Operations Inc.,https://www.kalibrr.com/c/suitestudio-operations-inc/jobs/251930/buyers-assistant-4,"As a Buyers Assistant (Philippines-based, Supporting Australia Office), you will play a critical role in assisting the Buying Team by managing product data, coordinating with suppliers, maintaining accurate inventory records, and ensuring smooth administrative operations.Key Responsibilities:Product &amp; Pricing Management:	Maintain and update product databases with accurate price changes and new listings.	Manage backend administrative tasks for all website sales and promotions.	Upload and maintain Excel spreadsheets for new products, ensuring accuracy.	Resolve product-related discrepancies and queries efficiently.Supplier &amp; Inventory Coordination:	Communicate with Australian and international suppliers to obtain product imagery, descriptions, and updated price lists.	Assist in monitoring inventory levels, ensuring correct stock data for online and retail stores.	Work closely with the Buying Team to update product availability and pricing as part of item record maintenance.Data &amp; Report Management:	Generate and review reports related to sales, inventory, and pricing trends.	Assist in analyzing sales performance to support the Buying Team’s decision-making.Administrative Support &amp; Cross-Team Coordination:	Act as the first point of contact for product and administrative queries.	Provide efficient support across various team functions, ensuring smooth retail operations.	Assist with other day-to-day administrative tasks or any additional duties as required.Why Join Us?	Work from the Philippines office while supporting a leading Australian retail team.	Be part of a fast-paced, dynamic, and collaborative work environment.	Gain hands-on experience in retail buying, product management, and e-commerce.	Opportunities for career growth and professional development.	If you're detail-oriented, tech-savvy, and passionate about retail operations, we’d love to hear from you! 🚀As a Buyers Assistant (Philippines-based, Supporting Australia Office), you will play a critical role in assisting the Buying Team by managing product data, coordinating with suppliers, maintaining accurate inventory records, and ensuring smooth administrative operations.Key Responsibilities:Product &amp; Pricing Management:	Maintain and update product databases with accurate price changes and new listings.	Manage backend administrative tasks for all website sales and promotions.	Upload and maintain Excel spreadsheets for new products, ensuring accuracy.	Resolve product-related discrepancies and queries efficiently.Supplier &amp; Inventory Coordination:	Communicate with Australian and international suppliers to obtain product imagery, descriptions, and updated price lists.	Assist in monitoring inventory levels, ensuring correct stock data for online and retail stores.	Work closely with the Buying Team to update product availability and pricing as part of item record maintenance.Data &amp; Report Management:	Generate and review reports related to sales, inventory, and pricing trends.	Assist in analyzing sales performance to support the Buying Team’s decision-making.Administrative Support &amp; Cross-Team Coordination:	Act as the first point of contact for product and administrative queries.	Provide efficient support across various team functions, ensuring smooth retail operations.	Assist with other day-to-day administrative tasks or any additional duties as required.Why Join Us?	Work from the Philippines office while supporting a leading Australian retail team.	Be part of a fast-paced, dynamic, and collaborative work environment.	Gain hands-on experience in retail buying, product management, and e-commerce.	Opportunities for career growth and professional development.	If you're detail-oriented, tech-savvy, and passionate about retail operations, we’d love to hear from you! 🚀	Excel Proficiency: Strong skills in Microsoft Excel, including Vlookup, pivot tables, formulas, data linking, price calculations, and template creation.	 	Administrative Experience: Background in administrative support, data entry, or document management, preferably within a corporate retail environment.	 	Retail Operations Knowledge: Understanding of retail buying, product management, and sales processes.	 	Detail-Oriented: High level of accuracy and efficiency in managing product data and inventory records.	 	Proactive &amp; Self-Motivated: Ability to work independently, take initiative, and effectively prioritize tasks.	 	Problem-Solving Mindset: Quick thinking with the ability to resolve issues efficiently.	 	Strong Communication &amp; Collaboration Skills: Comfortable working with internal teams and external suppliers across different time zones.	 	Educational Background: Bachelor’s degree in Business, Merchandising, Supply Chain, or a related field, or equivalent work experience.	 	Tech-Savvy: Comfortable using various computer systems and digital tools.	 	Report Generation (Preferred): Experience in compiling, analyzing, and presenting reports for management is an advantage.Hire NowSign UpLogin",Administration and Coordination,"Pasig City, National Capital Region (NCR)",Full-time,Kalibrr
Finance Assistant,SMX Convention Specialist Corp.,https://www.kalibrr.com/c/smx-convention-specialist-corp/jobs/253736/finance-assistant,"Update financial spreadsheets with daily transactions.	Prepare balance sheets.	Track and reconcile bank statements.	Create cost analysis reports (fixed and variable costs)	Process tax payments.	Support monthly payroll and keep organized records.	Record accounts payable and accounts receivable.	Update financial spreadsheets with daily transactions.	Prepare balance sheets.	Track and reconcile bank statements.	Create cost analysis reports (fixed and variable costs)	Process tax payments.	Support monthly payroll and keep organized records.	Record accounts payable and accounts receivable.	Candidate must possess Bachelor’s Degree in Finance/Accounting/Banking or equivalent	Accounting/Finance experience (Accounts Receivable, Accounts Payable, General Ledger, or Payroll) is a big plus but not required.	Excellent analytical skills, presentations, and reports. 	Must have good communication skills, persistent, mature and independent.	Can start immediately.	Strong analytical and planning skills;	Good communication and presentation skills;	Excellent problem-solving skills;Hire NowSign UpLogin",Accounting & Auditing,"Pasay City, National Capital Region (NCR)",Full-time,Kalibrr
Treatment Staff / Aesthetic Nurse / Aesthetic Therapist - Cebu,"Marie France Bodyline International, Inc.",https://ph.jobstreet.com/job/83172798?type=standard&ref=search-standalone&origin=cardTitle#sol=d3256f9b4481ffc0652bf3bfd9845b85b9cdab83,"START YOUR BEAUTIFUL CAREER WITH US!We are looking for Customer Centric and Motivated Individuals who have exceptional customer service skills and passionate in providing a positive customer experience.Minimum Qualifications:Graduate of BS Nursing, Physical Therapy, Occupational Therapy, Medical Technology and BS BiologyFresh graduates are highly encouraged to applyLicense or experience is NOT REQUIRED but a definite advantageNon-medical graduates with Aesthetic Experience are also welcome to applyExcellent interpersonal and customer service skillsHas genuine concern for clients by consistently providing a remarkable customer experienceSociable and able to interact with different types of peopleWith professional bearing and vibrant personalityHas passion for BEAUTYJob Description:Perform standard execution of prescribed treatments to clientsEnsures prompt and satisfactory delivery of treatments to clientsRecommend specific treatments needed by the clients and thoroughly explain its importance and benefitsAttends to client’s needs. Provides means to answer client’s requests and concerns immediately.&nbsp;Perks &amp; Benefits:Commission on top of basic payMedical / Health InsurancePaid holiday, Vacation, Sick and Maternity LeaveLife InsuranceDental InsuranceDay Shift ScheduleWork Life BalancePlus many moreWhat are you waiting for? APPLY TODAY and get a chance tobe part of our growing Family.We provide a COMPETITIVE remuneration package andthe opportunity to grow with us!",Healthcare,"Cebu City, Central Visayas (Region VII)",Full-time,Jobstreet
