title,company,link,job_desc,job_func,location,job_type,source
Data Processor | UK,"BCI Central (Philippines), Inc.",https://www.kalibrr.com/c/bci-asia-philippines-inc/jobs/243415/data-processor-uk,"Benefits:	Paid training	Monthly Performance Incentives	HMO coverage upon regularization	Life &amp; Accident Insurance coverage upon regularization	Vacation Leave, Sick Leave, Birthday Leave &amp; Anniversary LeaveThe CompanyWe deliver the most accurate and comprehensive construction sales leads in the UK. We combine this with business analysis and forecasting, enabling businesses to make sales, win contracts and plan for future growth.Joining us means joining an ambitious and determined team with a proven track record of year-on-year double-digit growth, where innovative thinking is encouraged and results are generously rewarded. We service a large clientele of companies in the construction industry, allowing them to maintain a competitive advantage and win new business through the use of our project reports and market information.The RoleBCI is looking for individuals who are willing to be assigned in Glenigan, our UK-based Company. We are looking for candidates who are interested in researching upcoming construction projects across the United Kingdom &amp; Republic of Ireland.What's in it for you?	Opportunity to work with different nationalities &amp; culture	Opportunity for career advancement	You will be part of a Global CompanyJob Responsibilities:	Maintain and oversee the data coming through from web harvesters &amp; scrapers	Report any issues to relevant stakeholders	Tidy up data after it has been scraped from the harvesters – including inputting headings, categories	Read through planning documentation and ensure all materials from different statements are inputted onto the project	Deduplicate companies and contacts on projects	Ensure data is cleansed within the appropriate turn around time	Update and ensure ongoing validity and quality of leads &amp; projects through the system	Database management	Handle inbound client enquiries within given time frames	Ability to explain BCI/Glenigan to contacts within the industry when questioned	Other ad hoc Special Projects as required	Uphold BCI’s company philosophies &amp; corporate mission	Maintain individual Occupational Health &amp; Safety (OHS) responsibilities at all timesBenefits:	Paid training	Monthly Performance Incentives	HMO coverage upon regularization	Life &amp; Accident Insurance coverage upon regularization	Vacation Leave, Sick Leave, Birthday Leave &amp; Anniversary LeaveThe CompanyWe deliver the most accurate and comprehensive construction sales leads in the UK. We combine this with business analysis and forecasting, enabling businesses to make sales, win contracts and plan for future growth.Joining us means joining an ambitious and determined team with a proven track record of year-on-year double-digit growth, where innovative thinking is encouraged and results are generously rewarded. We service a large clientele of companies in the construction industry, allowing them to maintain a competitive advantage and win new business through the use of our project reports and market information.The RoleBCI is looking for individuals who are willing to be assigned in Glenigan, our UK-based Company. We are looking for candidates who are interested in researching upcoming construction projects across the United Kingdom &amp; Republic of Ireland.What's in it for you?	Opportunity to work with different nationalities &amp; culture	Opportunity for career advancement	You will be part of a Global CompanyJob Responsibilities:	Maintain and oversee the data coming through from web harvesters &amp; scrapers	Report any issues to relevant stakeholders	Tidy up data after it has been scraped from the harvesters – including inputting headings, categories	Read through planning documentation and ensure all materials from different statements are inputted onto the project	Deduplicate companies and contacts on projects	Ensure data is cleansed within the appropriate turn around time	Update and ensure ongoing validity and quality of leads &amp; projects through the system	Database management	Handle inbound client enquiries within given time frames	Ability to explain BCI/Glenigan to contacts within the industry when questioned	Other ad hoc Special Projects as required	Uphold BCI’s company philosophies &amp; corporate mission	Maintain individual Occupational Health &amp; Safety (OHS) responsibilities at all timesThe CandidateBCI is looking for candidates who are quick and eager learners, who want to work in a fast-paced environment and aren’t afraid of meeting targets under a deadline. We want people with excellent research skills who are hard-workingJob Requirements:	A Filipino citizen who resides resides near Metro Manila	High level of proficiency in the English language (both in verbal &amp; written form)	Committed to learning lots of new things	Research related experience is an advantage	This is a full-time role and the successful candidates will work remotely	Must be able to start working and undergoing training right away	Must be willing to work in night shift (4pm- 1am)The CandidateBCI is looking for candidates who are quick and eager learners, who want to work in a fast-paced environment and aren’t afraid of meeting targets under a deadline. We want people with excellent research skills who are hard-workingJob Requirements:	A Filipino citizen who resides resides near Metro Manila	High level of proficiency in the English language (both in verbal &amp; written form)	Committed to learning lots of new things	Research related experience is an advantage	This is a full-time role and the successful candidates will work remotely	Must be able to start working and undergoing training right away	Must be willing to work in night shift (4pm- 1am)Hire NowSign UpLogin",Other,"Makati City, National Capital Region (NCR)",Full-time,Kalibrr
Energy Economics Specialist,AboitizPower,https://www.kalibrr.com/c/aboitiz-power-corporation/jobs/253608/energy-economics-specialist,"This position is responsible for providing modeling and research support to energy market analysis and forecasting used by various groups in AboitizPower as a key input to commercial decision making and long-term planning and strategy.This position is responsible for providing modeling and research support to energy market analysis and forecasting used by various groups in AboitizPower as a key input to commercial decision making and long-term planning and strategy.	Graduate of Economics, Business Management, any Engineering or Math related, Preferably with post graduate studies 	Has at least 3-4 years of experience in Energy Economics and/or Energy Trading, or other analytical roles in Commercial Operations in Power business;	Has at least 2-3 years experience in electricity market modeling using forecasts tools or statistical price modeling (i.e. EMCAS, Aurora, Plexos, R, LEAP, etc.)	Has at least 2-3 years of experience in statistical/econometric modeling in electricity related output data.Hire NowSign UpLogin",Architecture,"Taguig City, National Capital Region (NCR)",Full-time,Kalibrr
Multimedia Artist,Oxford Business Group,https://ph.jobstreet.com/job/82966509?type=standard&ref=search-standalone&origin=cardTitle#sol=4ba4a9d1116f646176b099de1f99cfee147bbc6d,"We are looking for a driven and competent Freelance Multimedia Artist to join a talented Marketing team within a well-established global research and consultancy company.Our company, Oxford Business Group (OBG) is a global research and consultancy company—as such, this role offers exciting opportunities to work and collaborate with teams from around the world and will lead to growth and more experience in Graphic Art. If you’re someone who already has experience in the areas below and wants to grow more in those fields with a global perspective, this role is a great fit for you.&nbsp;Key Responsibilities:Edit and produce professional videos, including promotional content, interviews, and event coverage.Enhance video quality through color correction, sound design, and motion graphics.Ensure all video content aligns with brand guidelines and messaging.Collaborate with the marketing and creative teams to develop compelling visual narratives.Manage video assets, organise footage, and maintain an efficient post-production workflow.Optimize videos for various platforms, including websites, social media, and presentations.Stay updated with industry trends, editing techniques, and video production best practices.&nbsp;Key Requirements &amp; Qualifications:Proven experience as a Video Editor, preferably in a corporate or agency setting.Proficiency in Adobe Premiere Pro, After Effects, Final Cut Pro, and other video editing software.Strong understanding of storytelling, pacing, and composition.Experience with motion graphics, animation, and visual effects is a plus.Ability to work under tight deadlines and manage multiple projects simultaneously.Excellent attention to detail and creative problem-solving skills.Strong communication and teamwork abilities.A portfolio showcasing previous corporate video editing work is required.&nbsp;Other Responsibilities:Create/design marketing kit PDFs as per company guidelinesCreate headers, 3d books, book stacks for the websiteCreate billboard ads, posters, subscription cards, event invites, backdropsAssist in any design needs for the website (image editing, looking for possible images to use on the website)Create infographics for the website blogAssist in creating artwork for social media postsCreate holiday cardsAssist in resizing web banners and images for clients and eventsCreate business cards as per HR department’s requestAssist in any PDF designs needed by the teams&nbsp;Other competencies and requirementsUniversity graduate, majored in Graphic Art, design or related fieldsMinimum 2 years’ experience in graphics art/ designAdvanced in English, both written and spokenComputer literate, hands on experience with MS Office programs and Adobe Photoshop, Adobe Acrobat Pro, EPS, InDesign, Illustrator, Premiere Pro and After EffectsUnderstanding of electronic, online and multi-media publishingExcellent communication skills and presentation skillsOrganised, responsible and detail oriented,&nbsp;ability to realize task to deadlineGood interpersonal skills, ability to work co-operativelyPositive attitude, ability to work under pressureExperience in color grading and sound design.Knowledge of video production techniques, including lighting and cinematography.","Advertising, Arts & Media","Manila City, National Capital Region (NCR)",Contract/Temporary,Jobstreet
Content Marketing Lead,Media Meter,https://www.kalibrr.com/c/media-meter/jobs/248804/content-marketing-lead,"As the Content Marketing Lead at Media Meter Inc, you will oversee the content strategy and execution, driving the brand’s messaging and positioning in the media monitoring space. You will lead a team of content creators and collaborate across departments to create compelling, results-driven content that increases brand awareness, generates leads, and supports client engagement. Your role will be pivotal in establishing thought leadership and ensuring that our content is impactful, creative, and aligned with business objectives.What are your responsibilities?	Develop and lead the overall content marketing strategy to promote media monitoring services.	Manage the content calendar, ensuring timely production and publication of high-quality content across all channels (website, blogs, social media, email, etc.).	Supervise and mentor a team of content creators, copywriters, and freelancers, providing guidance and feedback to ensure high standards.	Collaborate with cross-functional teams (sales, product, client support) to align content with customer needs and company goals.	Create and oversee the development of diverse content formats, including case studies, whitepapers, infographics, videos, podcasts, and webinars.	Optimize content for SEO and lead generation, utilizing data analytics to measure content performance and adjust strategies as needed.	Spearhead the development of thought leadership pieces, positioning the company as an industry leader in media monitoring and analysis.	Build and manage partnerships with influencers, guest bloggers, and external media channels to expand content reach.	Manage budgets for content marketing initiatives and ensure a positive return on investment.	Stay current with industry trends, content marketing best practices, and innovations to keep the company’s content strategy fresh and competitive.As the Content Marketing Lead at Media Meter Inc, you will oversee the content strategy and execution, driving the brand’s messaging and positioning in the media monitoring space. You will lead a team of content creators and collaborate across departments to create compelling, results-driven content that increases brand awareness, generates leads, and supports client engagement. Your role will be pivotal in establishing thought leadership and ensuring that our content is impactful, creative, and aligned with business objectives.What are your responsibilities?	Develop and lead the overall content marketing strategy to promote media monitoring services.	Manage the content calendar, ensuring timely production and publication of high-quality content across all channels (website, blogs, social media, email, etc.).	Supervise and mentor a team of content creators, copywriters, and freelancers, providing guidance and feedback to ensure high standards.	Collaborate with cross-functional teams (sales, product, client support) to align content with customer needs and company goals.	Create and oversee the development of diverse content formats, including case studies, whitepapers, infographics, videos, podcasts, and webinars.	Optimize content for SEO and lead generation, utilizing data analytics to measure content performance and adjust strategies as needed.	Spearhead the development of thought leadership pieces, positioning the company as an industry leader in media monitoring and analysis.	Build and manage partnerships with influencers, guest bloggers, and external media channels to expand content reach.	Manage budgets for content marketing initiatives and ensure a positive return on investment.	Stay current with industry trends, content marketing best practices, and innovations to keep the company’s content strategy fresh and competitive.Are you right for the role?	Bachelor’s degree in Marketing, Communications, Journalism, or a related field.	5+ years of content marketing experience, with a proven track record of managing content teams and delivering impactful content strategies.	Strong leadership skills and the ability to manage a team, provide strategic direction, and ensure high-quality outputs.	Expertise in SEO, content management systems (CMS), and social media marketing.	Excellent writing, editing, and storytelling skills with a portfolio of published work.	Ability to analyze content performance metrics and pivot strategies accordingly.	Solid project management skills with the ability to meet deadlines in a fast-paced environment.Preferred Skills:	Experience in the media monitoring or technology sector is highly desirable.	Familiarity with tools like Google Analytics, SEMrush, and social media management platforms.	Proficiency in graphic design tools (e.g., Canva, Adobe Creative Suite) and experience working with multimedia content.Are you right for the role?	Bachelor’s degree in Marketing, Communications, Journalism, or a related field.	5+ years of content marketing experience, with a proven track record of managing content teams and delivering impactful content strategies.	Strong leadership skills and the ability to manage a team, provide strategic direction, and ensure high-quality outputs.	Expertise in SEO, content management systems (CMS), and social media marketing.	Excellent writing, editing, and storytelling skills with a portfolio of published work.	Ability to analyze content performance metrics and pivot strategies accordingly.	Solid project management skills with the ability to meet deadlines in a fast-paced environment.Preferred Skills:	Experience in the media monitoring or technology sector is highly desirable.	Familiarity with tools like Google Analytics, SEMrush, and social media management platforms.	Proficiency in graphic design tools (e.g., Canva, Adobe Creative Suite) and experience working with multimedia content.Hire NowSign UpLogin",Sales,"Quezon City, National Capital Region (NCR)",Full-time,Kalibrr
Graphic Artist (Freelance),Primer Group of Companies,https://ph.jobstreet.com/job/82609245?type=standard&ref=search-standalone&origin=cardTitle#sol=2e528cd82270c4e4c06bc4b1a473dcbbd1c1cf77,"The Graphic Artist performs art &amp; design, and CADs for product development, do other graphic design related purposes delegated by the Product Development Head.Duties &amp; Responsibilities:Executes product graphic design, mood boards, line list, CADs and catalogue for principal’s approval.Performs art services, which includes conceptualization and color separation.Handles Final Artwork and mock-up development to support events of the departmentSubmit trend reports on color, materials and pegs based on market research.Performs other duties as may be assigned by immediate leader.Qualifications:Graduate of Multimedia Arts or equivalent1-2 years of progressive technical experience in graphic design preferably from a Retail companyProficient ability to apply and perform graphic design skills, including drawing/sketching, typography, ideation, color theory, use of texture, spacing, and scale, visual presentation development and layout that is supported by a portfolio of non-computer-based creative art and graphic design.Familiar with current trends, color, and design.Must be computer literate using Macintosh computer design applications. (Any 3D Software, Photoshop, Illustrator and After Effects)Knowledgeable with photography (eg. Product or Event Photography)",Architecture,"Manila City, National Capital Region (NCR)",Part-time,Jobstreet
Visual Designer,"GOKONGWEI BROTHERS FOUNDATION, INC.",https://ph.jobstreet.com/job/83088194?type=standard&ref=search-standalone&origin=cardTitle#sol=18d7004c8c4beea6b6981841421812685ede6784,"Gokongwei Brothers Foundation, Inc. (GBF) has silently been making an impact on the education sector for over 30 years now.&nbsp; Born from the vision of Mr. John Gokongwei to build our country’s industrial competitiveness through an educated workforce, GBF has been implementing programs that empower students and learners with opportunities for skills mastery and practical application.&nbsp; Its key focus is on -Elevating educators’ professional developmentIncreasing access to quality education for the underprivileged sectorCreating quality content that is accessible to educators and learnersSupporting the growth of STEM and digitally enabled learners and professionalsThrough its various programs, GBF has already made an impact to 17K educators and 1.5M learners to date.To know more details about its programs and impact, please see https://www.jgsummit.com.ph/annualreport2023/gokongwei-brothers-foundationGBF is growing its team to include industry experts and advocates who will champion STEM education in our country.&nbsp; We believe that values are as important as competencies.&nbsp; We are looking for people who are innovative and open-minded, and who value integrity, excellence, and service to others.Responsibilities:Design and DevelopmentCreate visually appealing and appropriate designs to be used in digital media and educational materials, including presentations, worksheets, online learning platforms, social media, and more.Brand AlignmentCollaborate with marketing and content teams to ensure designs align with the brand.Maintain and enhance the visual consistency of the brand.Tools and ProcessesUse tools like AI image generation software, Adobe Illustrator, Figma, Canva, and other relevant software.Project ManagementPrepare and package design files for production or deployment, ensuring completeness and proper organization.Assist in other tasks, as needed, such as UI/UX testing, user research, platform maintenance, and community immersion.Requirements:EducationBachelor’s degree in Graphic Design, Web Design, Visual Communication, or a related field.ExperienceAt least 1 year of professional design experience.Strong portfolio showcasing a range of creative projects in digital media, preferably for educational purposes.Willingness to work in a Freelance mode&nbsp;",Architecture,"Mandaluyong City, National Capital Region (NCR)",Contract/Temporary,Jobstreet
Associate Product Manager,"Cambert (PILIPINAS), Inc.",https://www.kalibrr.com/c/cambert-pilipinas-inc/jobs/249831/associate-product-manager,"The Assistant Product Manager will support the brand manager and management team in developing and managing products. Their responsibilities include:	Marketing and Advertising: Developing and executing marketing and advertising plans.	Market research: Conducting research to understand customer needs and market trends. Providing competitive analysis by reviewing competitors' products to identify their strengths and weaknesses.	Product strategy: Developing strategies for product development and marketing based on research and analysis	Project management: Coordinating projects to ensure products are delivered on time	Inventory management: Monitoring inventory and working with supply chain to ensure products are available.	Reporting: Generating reports and analysis on marketing promotions and performance indicators.	Advertising &amp; Promotions Budgeting: Development and monitoring of advertising and promotion spending.The Assistant Product Manager will support the brand manager and management team in developing and managing products. Their responsibilities include:	Marketing and Advertising: Developing and executing marketing and advertising plans.	Market research: Conducting research to understand customer needs and market trends. Providing competitive analysis by reviewing competitors' products to identify their strengths and weaknesses.	Product strategy: Developing strategies for product development and marketing based on research and analysis	Project management: Coordinating projects to ensure products are delivered on time	Inventory management: Monitoring inventory and working with supply chain to ensure products are available.	Reporting: Generating reports and analysis on marketing promotions and performance indicators.	Advertising &amp; Promotions Budgeting: Development and monitoring of advertising and promotion spending.	At least 1 (one) year experience in related field (marketing, advertising, product management, or sales)	Proficiency in Microsoft Office (Excel, Powerpoint, Word)	Knowledge in Adobe Suite	Strong analytical and planning skills	Good communication and presentation skills	Excellent problem-solving skills	Good interpersonal skills	At least 1 (one) year experience in related field (marketing, advertising, product management, or sales)	Proficiency in Microsoft Office (Excel, Powerpoint, Word)	Knowledge in Adobe Suite	Strong analytical and planning skills	Good communication and presentation skills	Excellent problem-solving skills	Good interpersonal skillsHire NowSign UpLogin",Sales,"Makati City, National Capital Region (NCR)",Full-time,Kalibrr
