title,company,link,job_desc,job_func,location,job_type,source
WFH Mortgage Broker Assistant,Brunt Work,https://ph.jobstreet.com/job/82706341?type=standard&ref=search-standalone&origin=cardTitle#sol=2fe39e8d726a364249c9f9b8baf79bbd80d30713,"Job Role Summary/OverviewJoin a dynamic and forward-thinking mortgage brokerage firm that values innovation, proactivity, and continuous learning. Our client is a respected player in the financial services industry, known for their commitment to excellence and client satisfaction. In this role, you’ll provide crucial support to experienced brokers, gaining invaluable insights into the financial services industry.&nbsp;&nbsp;Job HighlightsMonthly Rate: Approximately PHP 51,000Paid Hours per Week: 40Schedule: Monday to Friday, 9:30 AM - 6:30 PM, 1 hour unpaid break | Melbourne, Australia time | 6:30 AM - 3:30 PM Manila timeWork Arrangement: Work from homeContract: Independent ContractorSide note: Since this is a permanent work-from-home position and an “Independent Contractor” arrangement, the candidates must have their own computer and internet connection. They will handle their own benefits and taxes. The professional fees are on hourly rates and the rate depends on your performance in the application process.&nbsp;ResponsibilitiesCommunicationAll means of communication with clients, providers or third-party affiliates which includes but not limited to voice calls, video calls, emails and online messaging.Managing incoming calls and returning voicemails promptlyGeneral AdministrationIdentifying requests and problems and providing complete information and offering appropriate solutions.Managing and setting appointments with clients and communicating any changes to meetings (i.e. meeting cancellations or rescheduling) to all parties involved.Adding, modifying, deleting data when needed and generating reports and templates.Responding, forwarding or actioning service requests in a timely manner.Utilising and organising files in the Online Storage Facility Management efficiently (Dropbox, Google Drive, OneDrive, Box, In office, Admin or Staff’s computer etc.).Preparing, completing and pre-populating documents such as Application forms, Loan Maintenance and product switch forms accurately by knowing where to obtain required information and coordinating with the appropriate parties.Recording meeting minutes to track progress, detail action plans or use as a reference.Entering and encoding data into different formats accurately.Keeping informed and up to date on lender policies, interest rates and lender products and campaigns.Utilise CRM for all recording purposes.Mortgage BrokingIdentifying and gathering all client information that is required for a loan application and a Fact Find (residential history, tax status, employer address Next of Kin etc.).Knowledge in Australian mortgage brokering&nbsp;Ensuring all compliance documents and assessments are completed&nbsp;accurately and stored in the CRM.&nbsp;Sorting and checking documents to ensure validity prior to submission.Preparing and submitting loan applications accurately to the lender including providing any assumptions used when completing ApplyOnline for reviewSorting emails from clients into folders or into CRM for compliance and tracking purposes.Undertaking credit policy research using lender policy documents, policy guides in aggregator CRM, 3rd&nbsp;party research tools (Brokerpedia, Finane &amp; Coffee) and running potential credit scenarios past BMDs and Credit Scenario hotlines.Understanding and calculating base/overtime/bonus income and self-employed income based on the&nbsp;Lender Policy.Generating a Funding Position/Loan costing document based on the client’s unique circumstances, transaction type and the recommended lender.Running a generic and lender specific serviceability calculator to ensure applicants are eligible for the recommended loan products.Lodging and escalating pricing and cashback requests with lenders.Generating a product comparison based on the client’s lender and loan feature preferences nominated in the Fact Find.Ordering upfront valuations, applying a loan product to an application, pre-filling AOL, lender application, discharging forms and performing a check on whether any updated supporting documents are required.Performing accurate compliance reviews of the assessment completed as required by the aggregator and licensee.Updating the Needs Analysis to reflect broker-instructed adjustments.Generating and customising Credit Proposal Disclosure, Client Needs Analysis and Preliminary Assessment.Monitoring the progress of each loan application, anticipating the next steps in the loan application process and managing each stage proactively and effectively through to settlement and communicating to clients as necessary.Requesting a valuation for the property and monitoring the results from the valuers.Coordinating with the Property Relationship Manager and/or Builders for any invoicing, drawdown schedules, progress payments etc.Managing post-settlement follow-ups and fixed/interest-only expiry follow-ups.Sending loan review offers to suitable existing clients.&nbsp;Effectively onboarding clients by implementing banking products, repayment authorities, managing post settlement follow ups and fixed/interest only expiry follow ups.All other ad hoc duties as directed by Management.&nbsp;RequirementsHigh level of professionalism&nbsp;Strong numerical and analytical skillsExcellent interpersonal skills and ability to develop relationships with clients&nbsp;&nbsp;ZR_19871_JOB&nbsp;ReminderKindly apply directly to the link provided; you will be redirected to BruntWork’s Career Site. Complete the initial requirements, including the voice recording, pre-screening assessment, and technical check of your computer/device.&nbsp;&nbsp;Independent Contractor PerksPermanent work-from-homeHMO Coverage for eligible locationsImmediate hiringSteady freelance job",Banking & Financial Services,"Manila City, National Capital Region (NCR)",Full-time,Jobstreet
"Quiz Content Writer – 11 Plus (Non-Verbal Reasoning, GL Assessment)",11 Plus Rocket,https://ph.jobstreet.com/job/83184176?type=standard&ref=search-standalone&origin=cardTitle#sol=2e2d257369e596af7e86167d6ad54d14b90027c5,"We are looking for talented and detail-oriented quiz writers to create high-quality Non-Verbal Reasoning (NVR) questions for 11 Plus GL Assessment preparation.This is a freelance, remote role suited to individuals with strong analytical thinking and content creation skills. You will be designing question sets to support students in developing pattern recognition, spatial awareness, and logical thinking.What We’re Looking For:Ability to create original, well-structured NVR questions.Familiarity with pattern-based tasks such as sequences, analogies, and classification.Design any visuals or diagrams needed for Non-Verbal Reasoning questions (e.g. shapes, patterns, sequences).Reliable and efficient work style.Willingness to familiarise yourself with the 11 Plus GL Assessment format (Guidance will be provided if needed).All content must be original and will be subject to plagiarism checks.Payment:₱235 per batch of 10 questions.Potential for ongoing work based on quality and consistency.This is a freelance role.To Apply:Step 1:Send your CV and a brief Covering Letter explaining what you understand about Non-Verbal Reasoning questions, the GL Assessment format, your expertise as a quiz question writer, and why you'd be a good fit.Step 2:If your CV and Covering Letter is accepted, you will be required to create 3 example Non-Verbal Reasoning questions to demonstrate your skills and ability to follow a specification.Step 3:Successful candidates will be invited to a paid trial for the final assessment before offers are made.",Education,"Batangas City, CALABARZON (Region IV-A)",Contract/Temporary,Jobstreet
WFH Marketing Assistant,Brunt Work,https://ph.jobstreet.com/job/83086625?type=standard&ref=search-standalone&origin=cardTitle#sol=6920ed5dc44134cacebf0de6d1d18cfa34890968,"Job Role Summary/OverviewWe are looking for a highly organized and creative Marketing Assistant to help grow our client's brand presence, monetize channels, and secure exciting brand collaborations. This role is perfect for someone who understands digital marketing, is social media-savvy, and can craft compelling content that aligns with our brand voice.Job HighlightsMonthly Rate: Approximately PHP 57,000Paid Hours per Week: 40Schedule: 8 hours per day from 10AM Los Angeles, CA time for nowWork Arrangement: Work from homeContract: Independent ContractorSide note: Since this is a permanent work-from-home position and an “Independent Contractor” arrangement, the candidates must have their own computer and internet connection. They will handle their own benefits and taxes. The professional fees are on hourly rates and the rate depends on your performance in the application process.ResponsibilitiesSocial Media Management – Plan, schedule, and post engaging content across multiple platforms (Instagram, TikTok, YouTube, etc.).Marketing Copywriting – Write compelling captions, email campaigns, video descriptions, website updates, and ad copy.Website Maintenance – Update and optimize website content, landing pages, and product descriptions to align with marketing campaigns.Brand Outreach &amp; Partnerships – Research, pitch, and negotiate collaborations with brands that align with our audience and values.Monetization Strategy – Assist in developing and implementing monetization strategies across social media, YouTube, and digital platforms.Analytics &amp; Reporting – Track performance metrics, analyze data, and provide insights to improve engagement and revenue.RequirementsExperience in social media marketing, digital content creation, or influencer marketing. (APPLICANTS MUST SUBMIT PORTFOLIOS)Familiarity with platforms like Instagram, TikTok, YouTube, and website CMS (e.g., WordPress, Shopify).Ability to research and pitch to brands professionally and persuasively.Bonus Points If You HaveExperience in influencer marketing, PR, or brand partnerships.Graphic design or video editing skills.Knowledge of paid advertising and SEO strategies.ZR_21365_JOBReminderKindly apply directly to the link provided; you will be redirected to BruntWork’s Career Site. Complete the initial requirements, including the voice recording, pre-screening assessment, and technical check of your computer/device.&nbsp;Independent Contractor PerksPermanent work-from-homeImmediate hiringSteady freelance job",Marketing,"Makati City, National Capital Region (NCR)",Full-time,Jobstreet
Project Manager,"Ogilvy & Mather (Philippines), Inc.",https://www.kalibrr.com/c/ogilvy-mather-philippines/jobs/253708/project-manager,"Project Management 			Works with suits o assign work to the creative teams.		Ensure timely delivery of day-to-day requirements to the Account Managers.		Manage the workload and coordinate the schedules of the cross functional teams		Assess requirements and make judgements regarding necessary workload reassignment and deadline negotiations with the account managers.		Schedule briefings and internals and they facilitate team meetings.		Source and manage freelancers as needed.		Draft baseline schedules and get approval from Senior Project Manager		Proactively identify risks and develop and communicate solutions to contingency plans and manage to those plans		Keep track of client POs, preparing PRFs, and coordinating with the traffic manager for the necessary paperwork.		In charge of delivery of all internal requirements with the supervision of the Senior Project Manager		 			Document Ownership			Maintain and update daily calendar schedules of the teams		Create and file copies of necessary internals paperwork needed to facilitate supplier payment			Project Management 			Works with suits o assign work to the creative teams.		Ensure timely delivery of day-to-day requirements to the Account Managers.		Manage the workload and coordinate the schedules of the cross functional teams		Assess requirements and make judgements regarding necessary workload reassignment and deadline negotiations with the account managers.		Schedule briefings and internals and they facilitate team meetings.		Source and manage freelancers as needed.		Draft baseline schedules and get approval from Senior Project Manager		Proactively identify risks and develop and communicate solutions to contingency plans and manage to those plans		Keep track of client POs, preparing PRFs, and coordinating with the traffic manager for the necessary paperwork.		In charge of delivery of all internal requirements with the supervision of the Senior Project Manager		 			Document Ownership			Maintain and update daily calendar schedules of the teams		Create and file copies of necessary internals paperwork needed to facilitate supplier payment		The Project Manager is responsible for working closely with the Project Director and Senior Project Managers to ensure that project plans are in support of client business objectives and are aligned with Ogilvy's human and financial resources. In addition, he/she is also responsible for creative workload assignment and schedule management across all involved teams in the agency.Hire NowSign UpLogin",Advertising,"Makati City, National Capital Region (NCR)",Full-time,Kalibrr
Data Scientist,"LENA - Lately, Everything Needs Analytics",https://www.kalibrr.com/c/twelve-baskets-analytics/jobs/229042/data-scientist,"We are looking for bright and talented Data Scientists to join our dynamic team here at LENA.As a Data Scientist, you are responsible for managing data-related development pipelines. You will design and develop data science projects, review data-related code, and research on data packages.Specifically, you may be tasked to perform the following:	Designing data solutions with clients;	Researching and understanding packages and technologies related to data science;	Developing data solutions for internal or client use; and	Managing data solutions development and improvement. As part of a new team, you will help lay the culture and technical foundation for the team. You will enjoy growth opportunities working alongside a team that encourages intellectual excitement and a startup working environment. You will have the opportunity to bring your skills to the next level and acquire new ones along the way.We are looking for bright and talented Data Scientists to join our dynamic team here at LENA.As a Data Scientist, you are responsible for managing data-related development pipelines. You will design and develop data science projects, review data-related code, and research on data packages.Specifically, you may be tasked to perform the following:	Designing data solutions with clients;	Researching and understanding packages and technologies related to data science;	Developing data solutions for internal or client use; and	Managing data solutions development and improvement. As part of a new team, you will help lay the culture and technical foundation for the team. You will enjoy growth opportunities working alongside a team that encourages intellectual excitement and a startup working environment. You will have the opportunity to bring your skills to the next level and acquire new ones along the way.	Minimum of 2 years experience as a data scientist, machine learning engineer, researcher, or relevant roles; or with significant academic experience in data science or related fields	Strong problem-solving skills with an emphasis on model development	Deep knowledge on data wrangling, feature engineering, machine learning techniques, and statistical concepts	Good analytics capabilities	Advanced level of Python programming	Experience on code review and management	Minimum of 2 years experience as a data scientist, machine learning engineer, researcher, or relevant roles; or with significant academic experience in data science or related fields	Strong problem-solving skills with an emphasis on model development	Deep knowledge on data wrangling, feature engineering, machine learning techniques, and statistical concepts	Good analytics capabilities	Advanced level of Python programming	Experience on code review and managementHire NowSign UpLogin",Information Technology,"Pasig City, National Capital Region (NCR)",Full-time,Kalibrr
Research &amp; Development | Baking Technologist I,"Gardenia Bakeries Phils., Inc.",https://www.kalibrr.com/c/gardenia/jobs/253203/research-development-baking-technologist-i,"The R&amp;D Baking Technologist I will be responsible in hands-on laboratory and production scale work, data analysis, and collaboration with the Research &amp; Development team to achieve innovative solutions. Why Join Us?At Gardenia, we take pride in being the #1 bread brand in the Philippines, recognized for our world-class quality and innovation.In 2024, we ranked #65 among the Philippines' Top 100 Employers for Fresh Graduates (Prosple) and received the Circle of Excellence Award at the Asia CEO Awards for Top Employer of the Year and CSR Company of the Year.Join us and take the opportunity to build your career with the country's most advanced bread manufacturing company.Be part of a company that #DeliversServiceExcellence and fosters career growth!The R&amp;D Baking Technologist I will be responsible in hands-on laboratory and production scale work, data analysis, and collaboration with the Research &amp; Development team to achieve innovative solutions. Why Join Us?At Gardenia, we take pride in being the #1 bread brand in the Philippines, recognized for our world-class quality and innovation.In 2024, we ranked #65 among the Philippines' Top 100 Employers for Fresh Graduates (Prosple) and received the Circle of Excellence Award at the Asia CEO Awards for Top Employer of the Year and CSR Company of the Year.Join us and take the opportunity to build your career with the country's most advanced bread manufacturing company.Be part of a company that #DeliversServiceExcellence and fosters career growth!Department: Research and DevelopmentEmployment Type: ProbationaryWorking Schedule: Monday to Friday (08:00 AM - 05:30 PM)Work Setup: Work Onsite (Binan, Laguna) Qualifications:	Graduate of BS in Food Technology, Chemistry, Nutrition or equivalent	With GMP, and HALAL Standard Awareness and Understanding is an advantage	With at least one (1) year of related experience in a food manufacturing company or Food Analysis laboratory	Should understand the Principles of Sensory Evaluation test and procedure	Results-driven with the ability to thrive in a fast-paced and high pressure work environmentHire NowSign UpLogin",Operations,"Biñan City, CALABARZON (Region IV-A)",Full-time,Kalibrr
Junior Graphic  Assistant,Staffright,https://ph.jobstreet.com/job/83053328?type=standard&ref=search-standalone&origin=cardTitle#sol=5223ec3688b1013d672db00bac213b2b6aaa50d4,"Permanent Remote / Work-from-home / Full-TimeGraveyard Shift / Night Shift (at least 2 years of graveyard experience is a must)Salary Range: (Depending on your experience) + HMO Benefits with MaxicareHolidays and PTO LeavesStaffRight is the premier outsourced staffing agency helping businesses grow worldwide. We are looking for loyal and motivated rock stars to join our rapidly growing team. Our team members enjoy many benefits such as competitive pay, health insurance, paid time off along with national holidays, and a supportive StaffRight HR team.We seek a creative and detail-oriented Design Assistant to support our team in developing marketing materials, website assets, and other visual content. This role requires strong design skills, organization, and proficiency in design software.Key Responsibilities:- Assist in creating marketing materials, social media graphics, and presentations- Support design projects, ensuring brand consistency and quality- Research design trends and competitor visuals- Organize and maintain design files and assets- Edit and resize images, graphics, and videosPreferred Qualifications:- Experience with video editing software (Premiere Pro, After Effects)- Familiarity with project management tools like Asana, Trello, or Monday.com- Prior experience in a design-related role, internship, or freelance workRequirements:- Degree or certification in Graphic Design, Visual Arts, or a related field- Proficiency in Adobe Creative Suite (Photoshop, Illustrator, InDesign)- Strong understanding of typography, color theory, and layout principles- Basic UI/UX design knowledge is a plus- Attention to detail and ability to multitask- Comfortable using time tracker tools like Time Doctor- Highly motivated and organized- Fluent in English - excellent written and verbal communication- Proficient on a computer and in Microsoft Office (Outlook, Word, Excel)- High-quality noise-canceling headset- High-speed internet (50+ Mbps) with backup internet- High-speed computer with a working webcam also must have a backup computer- A quiet working environment free of outside noise (cars, animals, others working)",Architecture,"Manila City, National Capital Region (NCR)",Full-time,Jobstreet
Research Specialist (Work from Home),Platform 3 Inc.,https://ph.jobstreet.com/job/83093274?type=standard&ref=search-standalone&origin=cardTitle#sol=172ca5a7864e841c482f109f4bea90b3c492adc2,"We're looking for a Research Specialist to join our international team!&nbsp;If you have a keen eye for research, data analysis, and competitor tracking, this role is for you. You'll play a crucial role in monitoring competitors, identifying key advertisers, and supporting sales teams with valuable insights.This is a full-time, remote, and day shift role.&nbsp;What you will do:Maintain and update competitor account records in the CRM.Conduct research on competitors across various industries and verticals.Monitor priority competitors monthly, capturing advertiser/sponsor details.Create new account records for identified competitor spenders.Research and identify key sales contacts for competitor spenders.Undertake ad hoc research projects as required.&nbsp;What you need to succeed:Experience in market research, competitive intelligence, sales support, or a related field.Strong analytical and research skills with attention to detail.Proficiency in using CRM tools.Good organizational and communication skills.Self-motivated and able to manage multiple research projects.&nbsp;Life at Key Media: Where every story mattersJoin us in our mission to inform, connect, educate, and inspire business people around the world. At Key Media, we're proud to be the home of trusted B2B media brands, where excellence is recognized and celebrated every day.&nbsp;Perks and Benefits: Because we value youComprehensive HMO coverage with no waiting period, ensuring your health and well-being.Family coverage options after two years of dedicated service.Extra vacation time as a token of appreciation for your hard work and commitment.Access to our Employee Assistance Program for confidential counseling services.Continuous learning opportunities through our E-learning support with LinkedIn learning.Employee recognition programs, including quarterly awards, vouchers, and travel incentives.100% remote arrangement; work where it suits you best.Great culture (98% employees think we are a ‘great place to work’)&nbsp;About UsIn just over 20 years, Key Media has grown from the launch publisher of a B2B magazine to a global business media company with an ever-growing portfolio of market-leading products. Key Media prides itself on its entrepreneurial culture, creating innovative products for the industries in which we operate.&nbsp;The organization’s products operate across key business verticals including Financial Services, Legal, Education, Property and Human Resources, bringing product providers and business communities together through print media, events and online channels. Key Media has an unquestioned reputation for delivering high-quality, timely information in whatever format best suits our customers.&nbsp;“We believe there are no forms of media too old to thrive or too young to explore. We are always adapting and developing and looking for ways to improve our quality and expand our presence within our markets.”",Customer Service,"Manila City, National Capital Region (NCR)",Full-time,Jobstreet
