title,company,link,job_desc,job_func,location,job_type,source
SEO Copywriter,EngineRoom Applications,https://ph.jobstreet.com/job/83116678?type=standard&ref=search-standalone&origin=cardTitle#sol=fb554499483fe5312aba24b5c7eeb538224b8aa0,"Remote SEO Copywriter (Philippines-Based)Freelance or Contract | Fully Remote | Long-Term OpportunityWe’re a fast-growing Australian digital marketing agency looking for a talented SEO Copywriter based in the Philippines to join our remote team.If you know how to write content that ranks and resonates — and love diving into keywords, data, and storytelling — we’d love to hear from you.What You’ll Be DoingWriting high-quality, SEO-optimised blog posts, landing pages, and web copy for a variety of clientsCollaborating with our SEO and content team to match copy with keyword strategies and business goalsConducting basic research to ensure content is accurate, relevant, and engagingAdhering to tone of voice guidelines while delivering content that’s both human-first and search-friendlyMaking content improvements based on feedback, SEO performance, and client objectivesTo Apply, Please Include:✅ Your experience with SEO writingTell us about the industries you’ve written for and what types of content you specialise in (e.g. blog posts, product pages, service pages, etc.).✅ Links to 2–3 examples of content you’ve writtenIf possible, include a quick analysis of how it performed (e.g. keyword rankings, traffic increase, engagement metrics).✅ The SEO tools you’ve usedLet us know your experience with tools like SurferSEO, Ahrefs, SEMrush, Clearscope, Frase, or others.✅ How you stay updated on SEO trends and Google algorithm updatesDo you follow SEO blogs, newsletters, webinars, or experts? Let us know how you stay sharp.✅ Your typical turnaround timeFor example: “I can complete a 1,500-word SEO article in 2–3 business days.”✅ What KPIs you've worked towardShare any content-related metrics you've been accountable for (e.g. organic traffic growth, bounce rate, rankings, etc.).✅ If and how you use AI tools in your processDo you use ChatGPT or other AI platforms to support your writing? Tell us how you maintain originality and quality while using them.🚀 Why Work With Us?We don’t just want you to work well — we want you to feel well, grow, and be recognised for the awesome work you do.Here’s what you can expect when you join our team:Generous and competitive pay – we value your time, talent, and expertiseBirthday gifts – because you deserve to be celebrated!Recognition &amp; awards – we love to shout out great workMonthly rice allowance – yes, we’ve got your staples coveredLearning &amp; development benefits – access to upskilling resources and support to grow your craftRemote workspace allowance – to help you set up or improve your work-from-home setupWellness perks – because your mental and physical health matterNo commute stress – work from anywhere in the Philippines, in your own timeSupportive culture – great communication, regular check-ins, and a team that genuinely caresWe believe in building long-term relationships, celebrating wins, and creating a remote culture that feels connected, even across the miles.",Marketing,"Makati City, National Capital Region (NCR)",Full-time,Jobstreet
WFH Paid Ads Specialist,Brunt Work,https://ph.jobstreet.com/job/83288851?type=standard&ref=search-standalone&origin=cardTitle#sol=47006618cc6125779ca7e00edc44ad275e1aff70,"Job Role Summary/OverviewWe are seeking a skilled Paid Ads Specialist to manage and optimize digital advertising campaigns across Google Ads and Meta Ads (Facebook and Instagram). The ideal candidate has a strong background in PPC advertising, data analysis, and campaign optimization, ensuring the best return on ad spend (ROAS) for our clients.Job HighlightsHourly Rate: Approximately PHP 700Paid Hours per Week: 20Schedule: FlexibleWork Arrangement: Work from homeContract: Independent ContractorSide note: Since this is a permanent work-from-home position and an “Independent Contractor” arrangement, the candidates must have their own computer and internet connection. They will handle their own benefits and taxes. The professional fees are on hourly rates and the rate depends on your performance in the application process.ResponsibilitiesSet up and manage Google Ads campaigns (Search, Display, YouTube).Set up and manage Meta Ads (Facebook and Instagram).Implement campaign instructions provided, including targeting, ad creatives, and budget allocation.Monitor ad performance, analyze data, and provide recommendations for improvement.Collaborate with internal team members to ensure campaign goals align with broader marketing objectives.Stay updated with changes in ad platform features, policies, and best practices.Install tracking pixels on company websites.Import and manage product feeds for Meta Ads.Set up Meta and Google Ads backend accounts and assist clients in setting up their accounts if they do not exist.Utilize Google Analytics to pull and analyze data for multiple clients.Conduct keyword research using Google tools and SEMrush.RequirementsProven experience in managing Google Ads and Meta Ads campaigns.Strong knowledge of ad platform features, targeting options, and bidding strategies.Familiarity with Google Analytics and data interpretation.Experience with product feed imports and tracking pixel installation.Proficiency in keyword research using Google tools and SEMrush.Ability to analyze data, identify trends, and optimize campaigns accordingly.ZR_21674_JOBReminderKindly apply directly to the link provided; you will be redirected to BruntWork’s Career Site. Complete the initial requirements, including the voice recording, pre-screening assessment, and technical check of your computer/device.&nbsp;Independent Contractor PerksPermanent work-from-homeImmediate hiringSteady freelance job",Marketing,"Manila City, National Capital Region (NCR)",Part-time,Jobstreet
Online Media Specialist | Online Media Planner Buyer,"Get Hooked 360, Inc.",https://www.kalibrr.com/c/get-hooked-360-inc/jobs/253458/online-media-specialist-online-media-planner-buyer,"The Online Media Specialist helps in the day-to-day operations of the projects he/she is involved in.Summary	Placement and optimization of online ads	Daily management and reporting of Search Engine Marketing / Cost Per Click / Pay Per Click (SEM / CPC / PPC) campaigns.	Helps determine campaign KPIs	Ensures the fulfillment of campaign deliverables and KPIs	Tracks budget spend of each managed account	Maintains a good relationship with internal clients and external stakeholders	Ensures profitability of campaigns are achieved	Perform other duties as specified by the Media teamThe Online Media Specialist helps in the day-to-day operations of the projects he/she is involved in.Summary	Placement and optimization of online ads	Daily management and reporting of Search Engine Marketing / Cost Per Click / Pay Per Click (SEM / CPC / PPC) campaigns.	Helps determine campaign KPIs	Ensures the fulfillment of campaign deliverables and KPIs	Tracks budget spend of each managed account	Maintains a good relationship with internal clients and external stakeholders	Ensures profitability of campaigns are achieved	Perform other duties as specified by the Media teamEssential	Graduate of any Bachelor's degree	At least 2 years experience in Seach Engine Marketing, Keyword Research, Facebook Advertising and/or Google advertising	Social media savvy	Strong analytical and planning skills;	Attention to details is a must	Good communication and presentation skills	Excellent problem-solving skills	Google / Facebook certificationsHire NowSign UpLogin",Sales,"Quezon City, National Capital Region (NCR)",Full-time,Kalibrr
Multimedia Artist | Work From Home,7th Media Digital Studios Inc.,https://www.kalibrr.com/c/7th-media-digital-studios-inc-/jobs/252952/multimedia-artist-work-from-home,"We are looking for highly agile multimedia artists / graphic designers who are strong in layout design and with basic skill in illustration, 2D animation and storyboarding.	Should be comfortable both in day-to-day production and creative design work.	Create multimedia related work (digital layout design, print design, storyboard, etc.).	Willing to be trained to support animation for explainer 2D videos and related multimedia work, as needed.	Provide daily progress of the multimedia design.	Provide work estimates.	Timely delivery.	High-quality delivery.	While the role is mostly work from home, the successful candidate should have the ability to travel to Metro Manila for occasional face to face client meetings or team meetings 1 to 3x a quarter.We are looking for highly agile multimedia artists / graphic designers who are strong in layout design and with basic skill in illustration, 2D animation and storyboarding.	Should be comfortable both in day-to-day production and creative design work.	Create multimedia related work (digital layout design, print design, storyboard, etc.).	Willing to be trained to support animation for explainer 2D videos and related multimedia work, as needed.	Provide daily progress of the multimedia design.	Provide work estimates.	Timely delivery.	High-quality delivery.	While the role is mostly work from home, the successful candidate should have the ability to travel to Metro Manila for occasional face to face client meetings or team meetings 1 to 3x a quarter.		Intermediate to proficient in layout design, with at least 1 - 2 years experience in doing layouts whether in professional or freelance capacity. Candidates with more experience are welome to apply. Candidates with less experience but with academic extra-curricular layout-related experience and above average academic standing are welcome to apply in lieu of the minimum work experience.			At least basic in illustrations, 2D animation and storyboards.			Candidate must possess at least a Bachelor's/College Degree.			Required skill(s): Adobe PhotoShop (proficient), Adobe Illustrator (proficient), Adobe After Effects (basic - intermediate)			Has a creative flair in design and a good sense of art.			Has a strong design sense of color, layout, and typography.			Has strong creative skills and ability to design ideas for a wide range of industries.			Has creative conceptualization ability as well as technical execution capability.			Can translate complex data or information into easy-to-digest designs, layouts, and infographics.			Has the ability to work independently or as part of a team.			Strong organization skills.			Good communication skills - update to convey ideas and provide progress updates in a timely manner.			Able to multi-task and can gracefully handle pressure.			Willing to learn other multimedia software apart from Adobe creative tools to deliver other multimedia related work.			Work Experience: Fresh Grad - 2 years experience			Intermediate to proficient in layout design, with at least 1 - 2 years experience in doing layouts whether in professional or freelance capacity. Candidates with more experience are welome to apply. Candidates with less experience but with academic extra-curricular layout-related experience and above average academic standing are welcome to apply in lieu of the minimum work experience.			At least basic in illustrations, 2D animation and storyboards.			Candidate must possess at least a Bachelor's/College Degree.			Required skill(s): Adobe PhotoShop (proficient), Adobe Illustrator (proficient), Adobe After Effects (basic - intermediate)			Has a creative flair in design and a good sense of art.			Has a strong design sense of color, layout, and typography.			Has strong creative skills and ability to design ideas for a wide range of industries.			Has creative conceptualization ability as well as technical execution capability.			Can translate complex data or information into easy-to-digest designs, layouts, and infographics.			Has the ability to work independently or as part of a team.			Strong organization skills.			Good communication skills - update to convey ideas and provide progress updates in a timely manner.			Able to multi-task and can gracefully handle pressure.			Willing to learn other multimedia software apart from Adobe creative tools to deliver other multimedia related work.			Work Experience: Fresh Grad - 2 years experience	Hire NowSign UpLogin",Advertising,"Makati City, National Capital Region (NCR)",Full-time,Kalibrr
Jr. UI/UX Designer,"Elinnov Technologies, Inc.",https://ph.jobstreet.com/job/83237727?type=standard&ref=search-standalone&origin=cardTitle#sol=182e34a6b68a69165a53fe1a70308a3488647af8,"Position Title: Jr. UI/UX DesignerEmployment Type: Full-TimeLevel: JuniorAbout UsElinnov Technologies Inc. is a leading technology company in the Philippines, committed to innovation, excellence, and sustainability. We are passionate about transforming ideas into reality through cutting-edge technologies and fostering a collaborative and inclusive work environment.Job OverviewWe are seeking a creative and detail-oriented UI/UX Designer to join our team. The ideal candidate will have a strong understanding of user-centered design principles, the ability to create intuitive user interfaces, and a passion for crafting seamless and enjoyable user experiences. The role requires a balance of design aesthetics with functionality and will involve working on web and mobile applications, ensuring an optimal user journey.Key ResponsibilitiesUI Design: Design visually appealing user interfaces for websites and mobile applications, focusing on creating cohesive, intuitive, and aesthetically pleasing designs.UX Research &amp; Analysis: Conduct user research, gather insights, and analyze user behaviors to inform design decisions and improve usability.Wireframing &amp; Prototyping: Create wireframes, prototypes, and interactive mockups using design tools such as Figma or Adobe XD, and conduct usability testing.Collaboration: Work closely with product managers, developers, and other team members to define project requirements and deliver high-quality design solutions.User Testing: Conduct usability tests, gather feedback, and iterate on designs to ensure an optimal user experience.Design Consistency: Ensure all user interface designs align with the company’s branding guidelines and overall design system.Stay Updated: Keep up with the latest UI/UX trends, design tools, and technologies to improve design skills and efficiency.QualificationsEducation: Bachelor’s degree in Graphic Design, Multimedia Arts, Interaction Design, or a related field.Experience: 1-2 years of experience in UI/UX design, including internships or freelance projects.SkillsProficiency in design software such as Figma, Adobe XD, Sketch, or similar UI/UX tools.Strong understanding of user-centered design principles, usability, and interaction design.Experience with wireframing, prototyping, and conducting user testing.Ability to create responsive and mobile-first designs.Understanding of design systems, grids, typography, and color theory.Good communication skills to present and justify design decisions.Basic knowledge of HTML/CSS is a plus.PreferredExperience working on both web and mobile platforms.Familiarity with Agile methodologies and collaboration with development teams.BenefitsCompetitive salary and benefits package.Opportunities for professional development and career growth.Dynamic and innovative work environment.Collaborative and supportive team culture.Work from homeElinnov Technologies Inc. is an equal opportunity employer. We celebrate diversity and are committed to creating an inclusive environment for all employees.Pay: Php20,000.00 - Php30,000.00 per monthSchedule:8 hour shiftSupplemental Pay:13th month salary",Architecture,"Manila City, National Capital Region (NCR)",Full-time,Jobstreet
Graphic Designer | Work From Home,7th Media Digital Studios Inc.,https://www.kalibrr.com/c/7th-media-digital-studios-inc-/jobs/251739/graphic-designer-work-from-home,"We are looking for highly agile graphic designers / multimedia artists who are strong in layout design and with basic skill in illustration, 2D animation and storyboarding.	Should be comfortable both in day-to-day production and creative design work.	Create multimedia related work (digital layout design, print design, storyboard, etc.).	Willing to be trained to support animation for explainer 2D videos and related multimedia work, as needed.	Provide daily progress of the multimedia design.	Provide work estimates.	Timely delivery.	High-quality delivery.	While the role is mostly work from home, the successful candidate should have the ability to travel to Metro Manila for occasional face to face client meetings or team meetings 1 to 3x a quarter.We are looking for highly agile graphic designers / multimedia artists who are strong in layout design and with basic skill in illustration, 2D animation and storyboarding.	Should be comfortable both in day-to-day production and creative design work.	Create multimedia related work (digital layout design, print design, storyboard, etc.).	Willing to be trained to support animation for explainer 2D videos and related multimedia work, as needed.	Provide daily progress of the multimedia design.	Provide work estimates.	Timely delivery.	High-quality delivery.	While the role is mostly work from home, the successful candidate should have the ability to travel to Metro Manila for occasional face to face client meetings or team meetings 1 to 3x a quarter.		Intermediate to proficient in layout design, with at least 1 - 2 years experience in doing layouts whether in professional or freelance capacity. Candidates with more experience are welome to apply. Candidates with less experience but with academic extra-curricular layout-related experience and above average academic standing are welcome to apply in lieu of the minimum work experience.			At least basic in illustrations, 2D animation and storyboards.			Candidate must possess at least a Bachelor's/College Degree.			Required skill(s): Adobe PhotoShop (proficient), Adobe Illustrator (proficient), Adobe After Effects (basic - intermediate)			Has a creative flair in design and a good sense of art.			Has a strong design sense of color, layout, and typography.			Has strong creative skills and ability to design ideas for a wide range of industries.			Has creative conceptualization ability as well as technical execution capability.			Can translate complex data or information into easy-to-digest designs, layouts, and infographics.			Has the ability to work independently or as part of a team.			Strong organization skills.			Good communication skills - update to convey ideas and provide progress updates in a timely manner.			Able to multi-task and can gracefully handle pressure.			Willing to learn other multimedia software apart from Adobe creative tools to deliver other multimedia related work.			Work Experience: Fresh Grad - 2 years experience			Intermediate to proficient in layout design, with at least 1 - 2 years experience in doing layouts whether in professional or freelance capacity. Candidates with more experience are welome to apply. Candidates with less experience but with academic extra-curricular layout-related experience and above average academic standing are welcome to apply in lieu of the minimum work experience.			At least basic in illustrations, 2D animation and storyboards.			Candidate must possess at least a Bachelor's/College Degree.			Required skill(s): Adobe PhotoShop (proficient), Adobe Illustrator (proficient), Adobe After Effects (basic - intermediate)			Has a creative flair in design and a good sense of art.			Has a strong design sense of color, layout, and typography.			Has strong creative skills and ability to design ideas for a wide range of industries.			Has creative conceptualization ability as well as technical execution capability.			Can translate complex data or information into easy-to-digest designs, layouts, and infographics.			Has the ability to work independently or as part of a team.			Strong organization skills.			Good communication skills - update to convey ideas and provide progress updates in a timely manner.			Able to multi-task and can gracefully handle pressure.			Willing to learn other multimedia software apart from Adobe creative tools to deliver other multimedia related work.			Work Experience: Fresh Grad - 2 years experience	Hire NowSign UpLogin",Advertising,"Makati City, National Capital Region (NCR)",Full-time,Kalibrr
